,Description,Platform,Price,Product
1569,Find duplicate bookmarks on your Firefox.,Windows,Free,Bookmark Duplicate Detector
1570,Configure your proxies manually.,Windows,Free,Proxy Toolbar
1571,Set refreshing time for each and every tab opened in the browser.,Windows,Free,Chrome Refresh
1572,Unblock access to YouTube in Google Chrome.,Webware,Free,Youtube Unblock
1573,Copy URLs and links from open window and selected text.,Windows,Free,Copy Urls Expert for Firefox
1574,Browse the source codes of any Web site and save them as image files.,Windows,Free,Free Source Code Browser
1575,Get nutritional information and monitor your daily caloric intake.,Windows,Free,Calorie Count Plus Toolbar for Internet Explorer
1576,Add Internet Explorer functionality similar to the Firefox AutoCopy extension.,Windows,Free to try,Autocopy for IE
1577,Shop online searching for multiple sites at once.,Windows,Free,Amazon Explorer
1578,Browse the Web and play Web games in an optimized gaming environment.,Windows,Free,Toolwagon
1579,Aaj Tak is a 24-hour Hindi news television channel run by TV Today Network.,Windows,Free,Aaj Tak for Windows 10
1580,Access all your bookmarks from one menu.,Mac,Free,AllBookmarks
1581,Locate an address on a Web page on Google Maps and find directions.,Windows,Free,Locate on Google Maps
1582,Display all rainy spots on the maps of Netherlands and other part of Western Europe.,Windows,Free,BuienRadar
1583,Preview search results without having to open every single page in the Safari browser.,Mac,Free,CoolPreviews for Safari
1584,Click links on web pages.,Windows,Free to try,Auto Click URL Links Buddy
1585,Log Internet activities and block harmful Internet content.,Windows,Free to try,NetDADI Internet Filter
1586,Place a progress bar of your Internet usage on Firefox Toolbar.,Windows,Free,Net Usage Item
1587,"Show the PageRank, Alexa and tons of SEO parameters.",Windows,Free,SeoQuake 
1588,"Browse over 5, 000+ digital magazines in the world's largest newsstand.",Android,Free,Zinio: 5000+ Digital Magazines
1589,Display web pages directly on the desktop.,Mac,Free to try,Desktop Web Browser
1590,Design your Firefox with a Gant theme.,Windows,Free,mGant
1591,Search video files on YouTube and on various search engines.,Windows,Free,Search Plus for Video (Internet Explorer)
1592,"Read, download, and manage news feeds on your Windows desktop.",Windows,Free to try,NewsSeeker
1593,Find and remove inactive people and non-followers from your Google+ circles.,Windows,Free,Circloscope
1594,Enjoy stylish and visualized RSS newsreader with a variety of content for Windows 7 and Touch PC.,Windows,Free to try,newsXpresso
1595,"Collect, organize, and view information from the Web on your terms.",Windows,Free to try,MetaProducts Inquiry Professional Edition
1596,Browse online comics and manga and download whichever you want.,Windows,Free,ComicShelf
1597,Enable context menu if it is blocked by the Web page.,Windows,Free,EnableRightClick
1598,Interact with other users who are on the same Web page.,Windows,Free,Whoislive
1599,Browse the Internet.,Windows,Free,GoGopher Internet Browser
1600,Get FileFlyer password for FREE.,Windows,Free,Free FileFlyer Passwwords
1601,Perform common actions to images with a single click.,Windows,Free,Image Toolbar
1602,Generate 2D barcodes of URLs and read URLs using your mobile phone.,Windows,Free,Mobile Barcoder
1603,Tweak and customize your Firefox Web browser.,Windows,Free,Flexbeta Firetweaker
1604,Block advertising on Web sites when surfing with Opera.,Windows,Free,Adguard for Opera
1605,Split Internet Explorer in two separate fully independent windows.,Windows,Free,IE-Split
1606,Open any blocked Web site like Facebook and Myspace.,Windows,Free to try,TW-Browser
1607,Check spelling for 12 languages in your chrome browser.,Windows,Free,Spell Checker for Chrome
1608,Have a calculator on the browser.,Windows,Free,A Big Calculator
1609,Automate and manage your Web browser functions.,Windows,Free,DigiMode AutoSurfer
1610,Generate disposable e-mail addresses.,Windows,Free,Spambog.com
1611,Browser plugin for moving in 3D environments.,Mac,Free,Virtools
1612,Manage your tab in hierarchical tree structure.,Windows,Free,TabSense
1613,Exchange all cookies and log into multiple Web e-mail accounts.,Windows,Free,CookieSwap
1614,Manage your Internet security settings.,Windows,Free to try,Mantis
1615,"Save or copy entire Web page, visible or just selected portion as picture.",Windows,Free,EasyWeb2Pic Pro
1616,Organize and share the information you find on the Web.,Windows,Free,Queue
1617,Scan your system and search for viruses.,Windows,Free,Bitdefender QuickScan
1618,Visit download manager directly from toolbar.,Windows,Free,Chrome Downloads
1619,The DD News APP is the Mobile Application for the DD News Channel which is the only terrestrial cum satellite News Channel of the country.,Android,Free,DD News
1620,Mark text on a Web page.,Windows,Free,Highlighter
1621,Take a full page screenshot of your current browser window.,Windows,Free,Full Page Screen Capture
1622,Listen to music and create playlists in Google Chrome.,Windows,Free,Trevx Audio Player
1623,"View, explore, and remove Internet cache and history.",Windows,Free to try,Internet Clean
1624,Get RSS and Atom aggregator and search the Web.,Mac,Free to try,iNews
1625,"Apply and customize menu, toolbar, and statusbar settings.",Windows,Free,Quick Locale Switcher
1626,Automatically rotate through open tabs.,Windows,Free,Revolver - Tabs
1627,Create a custom style for Web pages that you view in the Internet Explorer.,Windows,Free,My Style
1628,Save web pages for future use.,Windows,Free,Snippy for Chrome
1629,"Navigate the Internet with a simple, fast, and lean Web browser.",Windows,Free,ParroExplore
1630,Have an Artificial Intelligence bot on the browser.,Windows,Free,The Chat Bot
1631,Identify and fix performance problems in your web applications.,Windows,Free,Speed Tracer
1632,Download videos from youtube with your Internet Explorer browser.,Windows,Free,Vidmaza Video Downloader for IE
1633,Translate Japanese by hovering over words.,Windows,Free,rikaikun
1634,Surf the Web in privacy without an installation hassle.,Linux,Free,"SRWare Iron for Debian, Ubuntu, Mint (64-bit)"
1635,Read displayed Web pages using the selected voice.,Windows,Free to try,Arlington Talking Browser
1636,Browse any site you wish and leave no traces behind.,Android,Free,Protected Porn Browser
1637,Get information about currently playing songs and artists.,Windows,Free,Harmony
1638,"Bring all your blogs, magazines, and social networks at one place.",Windows,Free,Pulse News for Windows 8
1639,Store Web pages as images.,Windows,Free,Screengrab
1640,Perform validation of multiple URLs.,Windows,Free to try,URL Checker
1641,"Retrieve articles out of news headlines, stock market prices, weather, and e-mail.",Windows,Free,NewzCrawl
1642,Generate and view driving directions online.,Windows,Free,Freeway Driving Directions for Firefox
1643,Add a predictive search extension to Safari.,Mac,Free,Inquisitor
1644,Render Web pages and block pop-ups.,Windows,Free to try,Pathfinder
1645,Be among the first to explore future releases of Firefox browser.,Windows,Free,Mozilla Firefox Nightly
1646,Watch Youtube videos in your Chrome browser using flash player instead of default HTML5 player.,Windows,Free,YouTube Flash Video Player
1647,Navigate the Internet with lightweight browser with intuitive GUI.,Windows,Free,Simple Browse
1648,Explore the Web in a safe and secure way.,Linux,Free,Google Chrome Beta for Fedora/OpenSUSE
1649,Highlight terms in Google search results.,Windows,Free,Coogle
1650,Keep yourself updated with current time and the weather on your new tab.,Windows,Free,Currently
1651,Build your own homepage that is tailored to your liking.,Webware,Free,Pageflakes
1652,"""Reporter"" is a bi-weekly Amharic and ""The Reporter"" is a weekly English newspaper published by Media and Communications Center with the motto of...",iOS,Free,Amharic Ethiopian Reporter News
1653,Read news and e-mails while screensaver is running.,Windows,Free,RSS Reader cum Screen Saver
1654,Access to local content from the location you choose right from the browser toolbar.,Windows,Free to try,GeoSurf for Internet Explorer
1655,Fix various issues with Internet Explorer.,Windows,Free,IE Tweaker
1656,"Browse WAP sites, view source code of WML documents, and access HTTP headers and query.",Windows,Free to try,WAP Proof 2008 Lite
1657,Find documents on a Web page automatically.,Windows,Free,Find As You Type for Internet Explorer
1658,Get the most out of social networking and the Web.,Mac,Free,Flock
1659,"Connect, read, and post comments on any Web pages.",Windows,Free,2006 Netmite Communities FireFox Extension
1660,Keep your children safe online with our Kid Safe Internet Browser.,Windows,Free,TUKI Scout Kid Safe Browser
1661,Highlight web pages with multiple colors.,Windows,Free,Diigo Web Collector 
1662,"News24 is now available in a brand new design, optimised for phone, phablet and tablet.",Android,Free,News24
1663,Use your personal emoji in Gmail.,Windows,Free,Bitmoji
1664,"Instantly share favorite Web pages in Facebook, Twitter, MySpace, Digg, Google Gmail, and StumbleUpon.",Windows,Free,Shareaholic
1665,View the latest world news and Arabic news.,Windows,Free,Akhbarakom
1666,"Edit HTML easily, right inside your browser.",Windows,Free,Chrome Editor
1667,Perform anything you might actually need to do with cookies.,Windows,Free,EditThisCookie
1668,Get a basic Web browser.,Windows,Free,DJweb
1669,Detect and check Rapidshare files on currently browsed page.,Windows,Free,RS Tool
1670,Search and browse Web sites easily.,Mac,Free,Sinbad
1671,Plan your study schedules and keep them updated.,Windows,Free,My Study Life for Chrome
1672,Add a clear cache button to your toolbar.,Windows,Free,Clear Cache Button
1673,Explore the world with Google Earth.,Windows,Free,Quick Earth
1674,Save to Google Keep in a single click.,Windows,Free,Google Keep Chrome Extension
1675,"Rip pictures, video, audio and more from the web, or entire websites for offline browsing.",Windows,Free,NCollector Studio Lite
1676,Display Web gadgets in your online browser.,Windows,Free,Gadget Explorer Bar
1677,Read RSS feeds directly from your desktop.,Windows,Free,Tickr
1678,Learn the latest news without having to surf to a massive number of Internet sites.,Windows,Free,iLook
1679,Surf the Internet with a browser.,Windows,Free,Michaelsoft Browser
1680,Customize the web pages.,Windows,Free,Webpage Decorator
1681,Be in the know about the latest events with NBC Nightly News.,Windows,Free,NBC Nightly News
1682,"Converts .webloc, text, and .url bookmark files.",Mac,Free,Web Location Converter
1683,Manage regular URL bookmarks and links to files and folders in Safari Web browser.,Mac,Free to try,Concierge
1684,Get breaking news in your IE toolbar.,Windows,Free,News Ticker Toolbar
1685,Have a real-time translation tool when you browse a foreign language site.,Windows,Free,ImTranslator for Firefox
1686,Readdle is client forr RSS service Inoreader.,Windows,Free,Readdle for Windows 10
1687,Navigate the Web with fast and simple browser.,Windows,Free,Zinger Websurf
1688,Invite all friends on Facebook in one click.,Webware,Free,Facebook Invite All Friends in One Click
1689,Get a completely customizable and free start page for your browser.,Windows,Free,Startpage24
1690,Search and analyze different Web sites' ranking.,Windows,Free to try,LinkSurvey
1691,"Send text, images, videos and links from your browser to any mobile in India.",Windows,Free,Textme (for Google Chrome)
1692,"Get a browser, download manager, player, presentation editor, and viewer all in one.",Windows,Free to try,Fileloader
1693,"Navigate the Internet with versatile browser with form filler, popup blocker, and download manager.",Linux,Free,SlimBoat Web Browser for Ubuntu (32-bit)
1694,Place RSS news feed headlines and Podcast content to your Web sites and blogs.,Windows,Free to try,Attensa for Outlook
1695,Keep track of ever-expanding reading list of Web contents.,Webware,Free,Google Reader
1696,Get a Web browser with multiple features.,Windows,Free,SWBrowser
1697,"Create powerful Firefox add-ons using just HTML, CSS, and JavaScript.",Windows,Free,Add-on Builder
1698,"A full featured, fully customizable digital flip alarm clock with weather forecast application.",Windows,Free,Sense Clock for Windows 10
1699,"Simplify, categorize, and sort search engine results.",Windows,Free,Axioma Searcher
1700,Let a page reload Automatically.,Windows,Free,ChromeReload 
1701,Recognize personalization of ads that user see on the web. ,Windows,Free,Keep My Opt-Outs
1702,"Discover, retrieve, and display Internet text information with heuristics ranking.",Windows,Free,WordsEx
1703,Save all downloaded files while surfing the Web.,Windows,Free to try,AutoSaver for IE
1704,Browse the Internet with this simple and easy-to-use Web browser.,Windows,Free,Ecran Internet
1705,"Ajit - Online News updates on business, politics, sports, fashion, films, national and international news reports.",iOS,Free,Ajit
1706,Download videos from youtube with your Firefox browser.,Windows,Free,Vidmaza Video Downloader for Firefox
1707,Watch the same movie on Netflix with your friends or loved ones.,Windows,Free,Showgoers for Netflix
1708,Find your personal lucky numbers for playing roulette.,Windows,Free,Roulette Lucky Number Generator
1709,Customise facebook with an extension in your browser.,Windows,Free,Better Facebook Fixer
1710,FileMaker Pro plugin to define dynamic popup menus.,Windows,Free to try,SCRIPTit
1711,"MSN for Windows Phone was rebuilt from the ground up to bring you a clean, simple and fast way to stay in the know.",Windows,Free,MSN for Windows 10
1712,Manage passwords of your Web sites.,Windows,Free,LogOnceToolbar
1713,Convert dates and timestamps in Firefox.,Windows,Free,TimeStamp Converter
1714,Block ads on the right hand side of the screen.,Windows,Free,WebMail Ad Blocker for Firefox
1715,Recommend any page on the web in Facebook.,Windows,Free,Facebook Likes
1716,"Design search forms and enhance searches on a local network, computer, or over the Internet.",Windows,Free,VAST
1717,Browse the Web without any restrictions.,Windows,Free,Yasfib
1718,Browse Web Sites and portals sized for the Sony PSP on your PC.,Windows,Free,PSP Web Browser Simulator
1719,Add RSS reading and organizing capabilities to Internet Explorer.,Windows,Free to try,RSS Explorer
1720,Get the top news stories and Live Stream from MSNBC...,Android,Free,MSNBC News App Live
1721,"Your central place to organize, read, and share the information you need to stay ahead of the next big trend in your industry.",iOS,Free,Feedly - Get Smarter
1722,Add an HTML validation feature to your Firefox.,Windows,Free,HTML Validator
1723,Create optimized SEO content for your needs.,Windows,Free to try,WordStream for SEO
1724,Detect trackers and control their ability to view your online behavior.,Mac,Free,Ghostery (for Safari)
1725,Generate random Lorem Ipsum text on your Chrome browser.,Windows,Free,Lorem Ipsum Generator
1726,RSS/RDF/Atom newsreader.,Mac,Free,RSSOwl
1727,Browse and visit only administrator-approved sites.,Windows,Free to try,LanMate Browser
1728,Safari extension to customize your Facebook profile.,Mac,Free,FaceFetti for Safari
1729,Add a eCommerce toolkit toolbar to your Internet Explorer.,Windows,Free,PayPal eCommerce Toolkit
1730,Access the web via TV.,Mac,Free,Kylo Browser for TVs
1731,"Surf the web via tabbed, WebKit-based browser.",Windows,Free,Quantum Browser
1732,Discover great websites based on your interests.,Windows,Free,StumbleUpon
1733,Acquire Usenet binary newsreader with embedded python engine.,Windows,Free,Newsflash
1734,"Display stocks, weather, and news on your desktop in real time.",Windows,Free,RealTime
1735,Automate various tasks on your favorite Web sites.,Windows,Free,WebReplay Free Edition
1736,Manage and develop your business contacts network.,Windows,Free,LinkedIn Firefox Toolbar
1737,Watch and record Web sites as they are viewed in a browser.,Mac,Free to try,GURL Watcher
1738,"Keep your Chrome bookmarks up to date with the Safari bookmarks on your iPhone, iPad, and Mac.",Windows,Free,iCloud Bookmarks for Chrome
1739,Download torrent files using your chrome browser.,Windows,Free,BitLet 4 Chrome
1740,Access and manage Canon cameras remotely from a PC.,Windows,Free to try,DSLR Remote Pro MultiiCamera
1741,Manage file downloads easily.,Windows,Free to try,DownloadIt Toolbar
1742,Watch TV directly from your Firefox browser.,Windows,Free,TV-Fox
1743,Design and customize your Web sites with RSS news feeds.,Windows,Free,FeedWrite
1744,Customizable Google Chrome's new tab page with Metro UI.,Windows,Free,new metroTab for Chrome
1745,Open a feed reader for any enabled page of OPML Autodiscovery.,Windows,Free,OPML Reader
1746,"Manage Your Chrome Browser Sessions.
",Windows,Free,Session Buddy
1747,Restart the Firefox easily.,Windows,Free,Restart Firefox
1748,Manage your cache and monitor chache status.,Windows,Free,Cache Status
1749,"Produce equations WYSIWYG, see the TeX source, and get the URL for the image.",Windows,Free,Sitmo LaTeX equation editor
1750,Read only a selected portion of a Web page.,Windows,Free,Reading Glasses
1751,"Save, organize, and share snippets of Internet Web pages that you find.",Windows,Free,Notefish
1752,Spoof the URL referer easily.,Windows,Free,Refspoof
1753,"Navigate the Web, download files, and make SQL queries.",Windows,Free,Falcon Browser
1754,Boost the volume of any tabs in your Chrome browser.,Windows,Free,Volume Booster Plus: Boost Your Sound
1755,Show your current IP address.,Windows,Free,Show MyIP
1756,Protect your privacy while surfing the web.,Windows,Free,CyberDragon
1757,Extract all links from webpage.,Windows,Free,Link grabber
1758,Browse the web with ease.,Windows,Free,Speedy Browser
1759,Block ransomware popups that lock Safari.,Mac,Free,ScamZapper
1760,Grab a download manager for the Gnome Desktop.,Windows,Free,GWGET
1761,Get an extension for danbooru.donmai.us use.,Windows,Free,danbooru
1762,weekly selection of articles from each week's edition of The Economist.,Windows,Free,The Economist on Windows for Windows 10
1763,Download shows performed during the last 7 days and preview upcoming shows.,Android,Free,Coast To Coast AM Insider
1764,Show latest comments from Picasa Web Album.,Windows,Free,Picasa Web Albums
1765,Access your favorite sites from your Windows 8 device.,Windows,Free,Ninja Browser for Windows 8
1766,"Create, edit, and upload Pbase galleries directly to iPhoto.",Mac,Free to try,iPhoto2PBase
1767,Learn English and speak fluently with the help of diacritical signs on words.,Windows,Free,PIE Transformer
1768,Swap your images into Nicolas Cage.,Windows,Free,nCage
1769,Make your web browsing more secure with an online password manager and Form Filler.,Windows,Free,LastPass for Opera
1770,Protect your computer from pop-up ad windows.,Windows,Free to try,Ad-Sweeper
1771,Take the WMUR News 9 app with you everywhere you go and be the first to know of breaking news happening in Manchester and the surrounding area....,iOS,Free,WMUR News 9 - Breaking news and weather for New Hampshire
1772,Manage previous profiles and enhance your Mozilla Firefox.,Windows,Free,MFMP3
1773,Capture a full size screenshot of the entire Web page in the image format.,Windows,Free to try,IEToolKit
1774,"Share webpages via your social networks, email and blogs.",Windows,Free,Google Share Button
1775,Use the BigBlueButton API from your browser.,Windows,Free,BigBlueButton API Extension
1776,RSS/Atom news ticker,Mac,$10.00,NewsTicker
1777,Search eBooks on freebookzone.com easily.,Windows,Free,Free eBook Search
1778,"Read, add, modify and categorize your RSS feeds.",Windows,Free,Cheetah
1779,Display unobtrusive text advertisements on your IE toolbar.,Windows,Free,Instant Buzz
1780,"A powerful, complete, and easy to use podcast player that will help you manage and listen to podcasts the way you want to.",iOS,$2.99,Downcast
1781,Enable Helium Backup on your Android device.,Windows,Free,Helium Backup
1782,Search for video on the most popular search engines.,Mac,Free,Search Plus for Video (FireFox)
1783,Create RSS feeds for Web pages easily.,Webware,Free,Feedity
1784,Browse the Web at lightning speeds.,Windows,Free,Ellipsis Browse
1785,View copy protected Web pages and embedded media.,Windows,Free,ArtisBrowser
1786,Display web pages using Gecko in Chrome tab.,Windows,Free,Mozilla Gecko Tab
1787,View and extract media/data files from Web browser cache.,Windows,Free to try,Cache View Plus
1788,Explore the Web in a safe and secure way.,Linux,Free,Google Chrome Dev for Debian/Ubuntu (64-bit)
1789,Delete Internet history and other traces from your computer.,Windows,Free,Click&Clean for Desktop
1790,Search the web without ever leaving the page you're on.,Windows,Free,Yahoo Axis Extension for Firefox
1791,Create RSS News feeds or Pod feeds without needing to know RSS or XML.,Windows,Free to try,AggPub
1792,"Improve performance and network tweaks for Firefox, without the Enhanced Prefetching.",Windows,Free,Fasterfox Lite
1793,Unblock Web sites and secure your traffic.,Windows,Free,IP Unblock Free VPN
1794,"Safari extension that sends HTML5 video to QuickTime, AirPlay or disk.",Mac,Free,Media Center
1795,Explore through different web pages with ease.,Windows,Free,BypassIt Browser
1796,Protect your browser from phishings.,Windows,Free,PhishTank SiteChecker
1797,Give your child an e-mail account and keep them from browsing unappropriate Web sites.,Windows,Free to try,Noah's Internet Kid Safe Browser
1798,"Search, download, assemble, and decode Usenet files.",Windows,Free to try,NewsLeecher
1799,Divide the content area of the browser window.,Windows,Free,Split Browser
1800,Add a Dublin theme to your Firefox browser.,Windows,Free,Unofficial Dublin
1801,"Collect, organize, and view information from the Web on your terms.",Windows,Free to try,MetaProducts Inquiry Standard Edition
1802,Automatically get the best price without using a shopping comparison site.,Windows,Free,InvisibleHand
1803,Add a smooth scrolling effect to Google Chrome.,Windows,Free,Smoothscroll
1804,Access Yopmail inboxes without registration and password.,Windows,Free,YOPmail
1805,"Find breaking news on national, World, Africa, sport, entertainment, and technology.",Windows,Free,News24 for Windows 8
1806,Enable and disable the pop-up blocking function.,Windows,Free,Yes Popups
1807,Protect your e-mail from spammers.,Windows,Free,Email Warden
1808,Browse the web opening multiple tabs.,Windows,Free,Towey WebSurfer
1809,Enhance your trading experience with binary options signals service.,Windows,Free,Binary Options Signals
1810,Generate a JavaScript blacklist on your web browser.,Windows,Free,YesScript
1811,Simplify Opera's menus for newbies' ease of use.,Windows,Free,Kiss
1812,Browse the web safely.,Mac,Free,Aviator
1813,CNET is a collective of the tech-savvy and tech-obsessed.,Windows,Free,CNET for Windows 10
1814,"Livestreaming, breaking news notifications, and all the Cleveland and Akron news you want from FOX 8 in a fast, high-performance app.",Android,Free,FOX 8
1815,"Browse popular Web services such as weather, news, eBay auctions, TV listings, and exchange rates.",Windows,Free to try,Terra
1816,Play your own local videos on your Chromecast directly from your computer.,Windows,Free,Videostream for Google Chromecast
1817,Access various SEO tools easily.,Windows,Free,RankQuest SEO Toolbar (Firefox)
1818,Create powerful and effective email signatures.,Windows,Free,WiseStamp Email Signatures
1819,"Look up locations on the map, and explore nearby places.",Windows,Free,Google Maps with Local Search
1820,Block spying ads and invisible trackers automatically as you browse.,Windows,Free,Privacy Badger for Firefox
1821,Manage Internet cookies.,Windows,Free,View Cookies CS
1822,Create and edit animated PNG images directly in your Firefox browser.,Windows,Free,APNG Edit
1823,Publish your articles to different article directories quickly and easily.,Windows,Free,Article Distributor
1824,Block online ads while browsing with Firefox.,Windows,Free,adaware ad block for Firefox
1825,Get a collection of native VCL components that can be compiled into your applications.,Windows,Free,LMD-Tools SE (C++ Builder 2007)
1826,Add a private browsing feature to Mozilla Firefox Portable Edition.,Windows,Free,Private Browsing Portable
1827,Use this Firefox version with additional administrative settings.,Windows,Free,FrontMotion Firefox Community Edition
1828,Delete computer traces.,Windows,Free,Perv Bar
1829,Want to read Newfoundland and Labradors largest daily newspaper on your Apple mobile device? Maybe you leave before the printed version is...,iOS,Free,The Telegram
1830,Optimize your Internet Explorer with a variety of features.,Windows,Free,Automator IE Toolbar
1831,Have an extension to find search result faster.,Windows,Free,Google Quick Scroll
1832,Save downloads automatically to various directories.,Windows,Free,Download Sort
1833,Access all sections of My Naukri and perform key word searches.,Windows,Free,naukri.com Toolbar
1834,Get alerts when new articles are published on CNN.,Windows,Free,CNN
1835,"Get your forecasts on the go with the official Met Office weather application As the UK's national meteorological service, the Met Office provides the most accurate and reliable weather forecasts on TV and radio, in print, and online.",Windows,Free,Met Office for Windows 10
1836,Have an assistant when applying the Pomodoro Technique.,Windows,Free,Chromodoro
1837,Search for information from any Web site.,Windows,Free,eClickz Toolbar
