,Description,Platform,Price,Product
4367,RSS news feed toolbar items for any web browser,Windows,Free,FeedBot
4368,Your gateway to the latest news and information on Pope Francis.FULL ACCESS FREE APPThe Pope App gives you the latest news and information on the...,iOS,Free,The Pope App The Official Pope Francis App
4369,Add support to the Omnibox to search UNIX manual pages.,Windows,Free,UNIX Manual Pages
4370,Hide chat and invite box from Gmail.,Windows,Free,Hide chat for Gmail
4371,Open a link in a new tab easily.,Windows,Free,No-Referrer
4372,See Pokemon base stats and ability information all in one place.,Windows,Free,Battle Insights For Pokemon Lite
4373,"RssRadio is an advanced Podcast playback app, available on the App Store since 2010.",iOS,Free,RSSRadio Podcast Player
4374,Bangladesh- Bangala News from more than 220 news papers,Android,Free,Bangladesh News Papers-
4375,"Canada TV Live is an application Channels Free, With Canada Live TV app you can watch free TV...",Android,Free,TV Canada
4376,Add import and export functionality for your Firefox Bookmarks manager.,Windows,Free,OPML Support
4377,Open and launch bookmarks in a dock mode.,Windows,Free,FDock
4378,Access your Chrome history through a sohortcut.,Windows,Free,Chrome History Button
4379,"iNTD for iPad,iPad24,iNTD for iPad is a free app that allows iPad users to watch both New Tang Dynasty (NTD) Television international channel and...",iOS,Free,iNTD for iPad
4380,"Newspaper delivers comprehensive live news, business and sports headlines from around the World.",iOS,Free,Newspaper
4381,Show the latest xkcd comic on your desktop.,Windows,Free,XKCD comics for Chrome
4382,Get an Atom protocol client for creating and managing Atom feeds.,Windows,Free,Atomic
4383,Update links and upload and check pictures in publishing blog.,Windows,Free,OakFlickr4PFF
4384,Browse and manage your RSS feeds from a dashboard attached to your browser.,Webware,Free,Feedly
4385,Have Google Translate on the right click menu.,Windows,Free,Select n Translate
4386,Access Google products with Google shortcuts.,Windows,Free,Shortcuts for Google Products
4387,Explore new and popular vehicles through AutoTrader.com's editorial.,Windows,Free,AutoTrader.com
4388,"The CBS 21 News app offers the best in local news, weather, and sports for central Pa at home or on the go. Count on CBS 21 News to provide all the...",Android,Free,WHP TV21
4389,"Blijf op de hoogste van het laatste nieuws rondom de PlayStation game consoles/games!Het nieuws wordt verzorgt door PSX-Sense, hier zijn wij...",iOS,Free,PSX
4390,View a web page through Google's eyes.,Windows,Free,Google Eyes by Blue Fountain Media
4391,Sky News - First for Breaking News.,iOS,Free,Sky News
4392,Manage storing and sharing content while you surf the Web.,Windows,Free,The Hordit Toolbar
4393,Surf the web without any ads.,iOS,Free,Block Ad
4394,View a web page through Google's eyes.,Windows,Free,Google Eyes by Blue Fountain Media
4395,Sky News - First for Breaking News.,iOS,Free,Sky News
4396,Experience the brand new WATE 6 On Your Side news app.,iOS,Free,WATE 6 On Your Side - Knoxville News and Weather
4397,"Khmer Browser by KhemaraSoft allows you to read all Unicode Khmer Web Sites from iPhone, iPod Touch or iPad.",iOS,Free,Browser Khmer
4398,Save all your highlights made across mobile and desktop.,Windows,Free,LINER - Private Web/PDF Highlighter
4399,"MyRadar is a fast, easy-to-use, weather application that displays animated weather radar around your current location, allowing you to quickly see what weather is coming your way.",Windows,$2.99,MyRadar Ad Free for Windows 10
4400,Save and restore previous Safari Sessions.,Mac,Free,SessionRestore
4401,Organize apps and extensions and launch them from browser toolbar.,Windows,Free,AppJump App Launcher and Organizer
4402,"The World in 2016, the latest in The Economist's annual collection of predictions, identifies and explores the issues that will shape the year...",iOS,Free,"The World in 2016: Insights & Predictions on Politics, Business & Finance"
4403,"Your free STV News app lets you see whats happening across Scotland. It brings you all the breaking news, opinion, latest sport, weather and so...",iOS,Free,STV News
4404,"Suivez toute l'actualit Sngalaise, de l'Afrique et du Monde en VidosDes mises jour quotidiennes de tout ce qui se passe au Sngal, en Afrique et...",iOS,Free,SENVIDEO - Le Senegal en Video
4405,Keep yourself informed on breaking news and the latest developing stories from around the world.,iOS,Free,CBS News: Live Breaking News
4406,See the building of CCT and blog using an extension.,Windows,Free,CCT
4407,"If you love magazines, you'll love Readly.",Android,Free,Readly
4408,"Up to the second stories, video and news from the staff of FOX 4 NEWS in Dallas-Fort Worth.",iOS,Free,FOX 4 Dallas-Fort Worth
4409,Enable safe online browsing within your home network.,Windows,Free to try,weNetOK for Home Networks
4410,Search Amazon.co.uk without wasting your time.,Windows,Free,Amazon UK Search
4411,Flip text upside-down within your browser.,Windows,Free,FlipText
4412,"Explore the brand new KOIN 6 app and stay informed with the latest local news, weather and sports, wherever you go. Experience everything you love...",iOS,Free,KOIN 6 News - Portland News and Weather
4413,The famous and highly rated Amharic Radio App in the Android Play Store is now available for iOS.Amharic Radio is an easy to use application that...,iOS,Free,Amharic Radio
4414,Get an Amazon search box for Google Chrome.,Windows,Free,Amazon Search bar
4415,Puthiya Thalaimurai TV is a 24x7 Live News Channel.,Windows,Free,Puthiya Thalaimurai for Windows 10
4416,Open text areas in an external application.,Windows,Free,Texto for Firefox
4417,Telex Land Mark Apps is only for Shri Dhanera & Khimat Jain Samaj in which it will Broadcasting the Social News & InformationDont delay to get...,iOS,Free,Telex Landmark
4418,Resume YouTube videos and start from wherever you want.,Windows,Free,Video Resumer
4419,"Creates a PDF or eBook out of newspaper RSS feeds, optimized for Kindle, iOS, or Sony eBook layouts.",Mac,Free,SmallNews
4420,Creates a .m3u playlist from all linked music files on a website.,Windows,Free,Play Them All
4421,Edit your HTML code in a real time HTML editor.,Windows,Free,HTMLTIE for Chrome
4422,"Al Jazeera for iPhone, iPad and Apple Watch brings you curated top stories, live and on-demand video and personalisation from Al Jazeera English...",iOS,Free,Al Jazeera English
4423,"Its easier than ever to enjoy this groundbreaking monthly on your iPad. Its the WIRED vision of how innovation is shaping the future, featuring...",iOS,Free,WIRED Magazine
4424,Access scientific journals using procy.,Windows,Free,NUS Library EzProxy
4425,Get latest India news from Times of India.,Windows,Free,Times of India Quick-view
4426,'Outlook' is India's most vibrant weekly newsmagazine with critically and globally acclaimed print and digital editions.,iOS,Free,Outlook
4427,"Get current futures for crude oil, gas, heating oil, natural gas, and propane gas.",Windows,Free,Market Watcher (Energy)
4428,Get a new look for the browser.,Windows,Free,Ninelooks
4429,Aplikasi untuk http://www.pudgenetwork.com/ Pudge Network merupakan sebuah laman perkongsian maklumat dan teknogi yang berkaitan dengan Microsoft dalam bahasa Malaysia.,Windows,Free,Pudge for Windows 10
4430,Search for Google news with an exclusive search extension.,Windows,Free,SkyTeam News Search
4431,Add a simple stopwatch and countdown timer to the browser.,Windows,Free,Quickrr Stopwatch and Countdown
4432,List recent expenses in Torch Project Management.,Windows,Free,Expenses in Torch
4433,The Villages Daily Sun is now in your pocket.,iOS,Free,The Villages Daily Sun Mobile
4434,Discover a new and rewarding way to surf the Internet,Windows,Free,DeltaBar
4435,Enhance the function of the right click of your mouse.,Windows,Free,Select Search
4436,Pause your music or audio stream when you play a video.,Windows,Free,Be Quiet
4437,Track your time on the Internet.,Mac,Free,WebWatch Safari Extension
4438,View all your News sites at one place.,Windows,Free,News Hub
4439,Browse the web up to 8x faster.,Mac,Free,Maiar
4440,"Discover a whole new way to listen to stories, shows, and podcasts from NPR",Android,Free,NPR One
4441,Play or stop Hitradio FM Plus or set any radio you like.,Windows,Free,Your Favorite Radio
4442,"HW News Network, India's only news channel that renders an UNBAISED, REAL and HONEST take on the happenings occurring all across the nation and...",Android,Free,HW News Network
4443,Listen to police feeds on your iPhone.,iOS,Free,Police Radio Free for iPhone
4444,Be connected to all of your social networking sites.,Windows,Free,Social Buddy
4445,Submit pages that contain offensive content.,Windows,Free,BHave Toolbar
4446,Trim the context menu on the fly for simplicity and easy access.,Windows,Free,Ffchrome
4447,Get a new look for your chrome browser.,Windows,Free,Midnight Glow (Spectrum)
4448,Record and playback songs from kSolo.com site.,Windows,Free,KarClient
4449,Generate a Web page with a unique URL instantly.,Windows,Free,ShortText
4450,Find bus timings and Locate your Bus in Chicago.,Windows,Free,CTA-Keep Track Of Your Bus in Chicago
4451,Watch Aaj Tak Live for free on your Windows 10 mobile or laptop.,Windows,Free,Aaj Tak Live for Windows 10
4452,Do wobble an oppai with a single click.,Windows,Free,Oppai Extension
4453,Receive alerts when new articles are published on Daily Mail.,Windows,Free,Daily Mail News Notifier
4454,Lesen Sie die DIGITALE WAZ auf Ihrem Smartphone oder Tablet und testen Sie zu Beginn kostenlos alle Funktionen.,Android,Free,Waz Zeitung Digital
4455,Create async scripts by extracting files to extension directory.,Windows,Free,BlogEngine.NET Google Analytics Extension
4456,Add a context menu to open a link in a new foreground tab.,Windows,Free,Open link in foreground tab
4457,Be a part of a network where the quality of the idea matters.,Android,Free,Medium
4458,Share Web pages with friends and connections.,Windows,Free,Grazeit
4459,Get the expanded form of short urls.,Windows,Free,Explode
4460,Create web review for a web site.,Windows,Free to try,SmElis Web Previewer
4461,Safari extension for the FreshBooks online invoicing and time-tracking app.,Mac,Free,FreshTime
4462,Analyze the P3P policies of web sites that you visit.,Windows,Free,Privacy Bird for Chrome
4463,Get the latest news and stats from expert bloggers for your Browser.,Windows,Free,Pickemfirst for Internet Explorer
4464,Find what's for sale at Woot.,Windows,Free,Woot
4465,Double Player for Music is FREE today with AppGratis.com.,iOS,$0.99,Double Player for Music with Headphones Pro
4466,Find bus timings and Locate your Bus in Chicago.,Windows,Free,CTA-Keep Track Of Your Bus in Chicago
4467,Watch Aaj Tak Live for free on your Windows 10 mobile or laptop.,Windows,Free,Aaj Tak Live for Windows 10
4468,Lesen Sie die DIGITALE WAZ auf Ihrem Smartphone oder Tablet und testen Sie zu Beginn kostenlos alle Funktionen.,Android,Free,Waz Zeitung Digital
4469,Create async scripts by extracting files to extension directory.,Windows,Free,BlogEngine.NET Google Analytics Extension
4470,Add a context menu to open a link in a new foreground tab.,Windows,Free,Open link in foreground tab
4471,Keep all the separate parts of your online life neatly contained in different tabs.,Windows,Free,Firefox Multi-Account Containers
4472,Get male models when you open new tab.,Windows,Free,Hunk of the Day
4473,Open Live RSS feed and other data easily from your sidebar.,Windows,Free,22Pixels Sidekik
4474,Make the credit card login work in Chrome.,Windows,Free,Fix Asda Credit Card Login
4475,Access to the info and related links to the web page.,Windows,Free,Max Site Info
4476,View dozens of images all in one page.,Windows,Free,Instagram Pinterest Theme
4477,Take the WCVB NewsCenter 5 app with you everywhere you go and be the first to know of breaking news happening in Boston and the surrounding area....,iOS,Free,WCVB NewsCenter 5 - Breaking news and weather for Boston
4478,Kill as many robots as possible to free the Earth.,Windows,Free,Ultimate Crisis
4479,Do better tweeting plus Tweet.,Windows,Free,PBTweet+
4480,"Find .NET news, tips, tricks, and blogs from your Windows 8 device.",Windows,Free,.NET World for Windows 8
4481,Check your sites on regular interval.,Windows,Free,Browse Periodically
4482,"Read offline. Bookmark anything. With no ads. Welcome to a brand new way to experience The Atlantic, wherever you go: Our redesigned app...",iOS,Free,The Atlantic Magazine
4483,Develop original skinned and non-skinned business or media applications.,Windows,Free,AlphaControls
4484,Convert text area to vi editor and execute commands.,Windows,Free,wasavi for Firefox
4485,Change Firefox preferences to fit the mode of popup blocking.,Windows,Free,Simple Popup Blocker
4486,The Olympian E-edition for the iPad lets you read the Olympian as it appears in print. You can flip thru the pages or skim Thurston Countys number...,iOS,Free,"The Olympian Newspaper e-Edition App Local News, Weather, Sports, Politics & Traffic for the Olympia, Washington Area"
4487,Keep your self up to date with the mobile industry updates.,Windows,Free,MobileCrunch for Windows 8
4488,NOTE: Please click news headline to read detail news. The click to read button at the bottom section is getting hidden but you can simply click the...,iOS,Free,"All India News - Samachar, Khabar, Patrika, Vaarta"
4489,Be notified in your browser about offers from Big Fish Games.,Windows,Free,Big Fish Coupons for Google Chrome
4490,"Shrook is a news reader for subscribing to RSS and Atom news feeds from your iPhone, iPad or iPod Touch.Use the in-app Feed Guide to quickly...",iOS,Free,Shrook RSS News Reader
4491,"Nairaland Forum App let You View Latest Topics, View and Make Comments.",Android,Free,Nairaland Mobile
4492,Send SMS to Venezuelan mobile operator Movilnet.,Windows,Free,Moxilnet
4493,Manage Diamond Store with online Database.,Windows,Free,Diamond DB
4494,Add an anti-phishing tool to your Firefox.,Windows,Free,iTrustPage
4495,Get all the latest Episodes from dlfresh.com.,Windows,Free,Watch Your Favorite Tv-Show Online
4496,Create a color palette from any image.,Windows,Free,Chrome Palette
4497,The Olympian E-edition for the iPad lets you read the Olympian as it appears in print. You can flip thru the pages or skim Thurston Countys number...,iOS,Free,"The Olympian Newspaper e-Edition App Local News, Weather, Sports, Politics & Traffic for the Olympia, Washington Area"
4498,Keep your self up to date with the mobile industry updates.,Windows,Free,MobileCrunch for Windows 8
4499,Menu bar item that streams items from Y Combinator news.,Mac,$2.99,Hacker Bar
4500,Show chrome desktop notifications on campfire events.,Windows,Free,Chrome Campfire Notifications
4501,"Access your favorite games, wherever you are on the web.",Windows,Free,GamesBar
4502,Put a Hebrew calender in your browser.,Windows,Free,HCalendar
4503,Save Web pages in Internet Explorer with a single click.,Windows,Free,OrderImage
4504,Get to know whether you are logged in to facebook.,Windows,Free,Facebook Status
4505,Danmarks bedste app til at se alarmer fra ODINs 112 puls. Responstid ned til 2 1/2 minut! - SenesteSe seneste alarmer til 112 redningsberedskabet i...,iOS,Free,ODIN Alarm - 112 alarmer fra Beredskabsstyrelsen
4506,Here are some of the highlights of the brand-new Lifeline App: QUOTE OF THE DAY.,iOS,Free,VGR Lifeline
4507,Let your friends experience the web through your eyes.,Windows,Free,Doodle all over the web
4508,Set different colors to tabs for your Firefox browser. ,Windows,Free,FabTabs
4509,Latest All Gujarati Newspapers ( Gujarat ) In One App,Android,Free,Gujarati Newspapers
4510,Attach files from other cloud websites to Gmail.,Windows,Free,Cloudy for Gmail
4511,"Get the information about a Website's SEO, SEM Social Media and Web site Metrix.",Webware,Free,SEO Extension For Firefox
4512,Add price history charts and price watch features to Firefox when viewing product pages on Amazon.,Windows,Free,The Camelizer - Price Tracker
4513,Read all Marathi News Paper and ePaper in a single app. Now you don't need to bookmark the websites of your daily newspapers and ePapers.,Android,Free,Marathi ePaper - All Marathi Newspaper and ePapers
4514,Improve YouTube experience in Chrome browser with video effects and other valuable features.,Windows,Free,YouTube Video Effects
4515,WBRC TV News FOX6,Android,Free,WBRC TV News FOX6
4516,"Die aktuelle Ausgabe von Certo finden Sie ab sofort auf http://www.certo-app.deCerto, das Magazin fr Sicherheit und Gesundheit, ist das...",iOS,Free,Certo
4517,"Visit Web sites, watch YouTube videos, and use search engines.",Windows,Free,Snowser PC
4518,Track your browsing time and number of tabs opened.,Windows,Free,Chrome Timer
4519,T24 helps you be up to date with news in your hand wherever you go.,Android,Free,T24
4520,"Browse web pages without leaving any traces, enhancing your privacy & information security.",Android,Free,Zahid Maxthon Browser
4521,Introducing the DTN/The Progressive Farmer agriculture app for the iPadGet the agriculture industrys most powerful content app specifically...,iOS,Free,DTN/The Progressive Farmer: Agriculture News
4522,"Push files, links, notes, lists, reminders, addresses, and more between your devices and computers in a snap.",Windows,Free,Pushbullet for Chrome
4523,"Powerful feed reader for use with or without Google Reader.Search & preview feeds; read offline with images, mobile view, customizable...",Android,$1.89,FeedR News Reader
4524,Get full story of the current entry in google reader.,Windows,Free,Google Reader Full Feed
4525,Get alerted when new articles are published on Huffington Post.,Windows,Free,Huffington Post News Notifier
4526,View posts without leaving the page.,Windows,Free,IITG Newsgroup Quickview
4527,"Get comparisons, alerts, and real-time price tracking as you browse and share your shopping.",Windows,Free,Digital Folio for Firefox
4528,"The NDTV HD app sports a smart design that highlights content, giving the user a seamless news experience.",iOS,Free,NDTV HD
4529,Search quickly through the site you are visiting.,Windows,Free,Quickrr Site Search
4530,This updated WESH app has been completely redesigned to be your real-time feed of news and weather straight from the WESH 2 News team. It's like...,Android,Free,WESH 2 - news and weather
4531,Find popular consumer electronics news on your Windows 8 device.,Windows,Free,Ubergizmo for Windows 8
4532,Watch Youtube videos in your Firefox browser using flash player instead of default HTML5 player.,Windows,Free,YouTube Flash Player
4533,"Do tab organization, bookmarks, history, and speeddial in your Chrome.",Windows,Free,Ultimate New Tab
4534,Closes multiple instances of the Facebook home page.,Windows,Free,Facebook Excess Tabs
4535,"Stay up-to-date with news, weather and traffic in the Greensboro Triad area.",Android,Free,WFMY News 2
4536,"MSNBC is your destination for full episodes of your favorite MSNBC shows, including new episodes available the day after they air.",iOS,Free,MSNBC
4537,Get the latest chicagotribune.com news on your Windows 8 device.,Windows,Free,Chicago Tribune for Windows 8
4538,Find local and global news on your Windows 8 device.,Windows,Free,Associated Press for Windows 8
4539,Discover the most Retweeted articles on the current site.,Windows,Free,Twitter Pulse
4540,instant messenger,Windows,$24.99,Causerie Messenger
4541,Stay ahead of the competition with the app that's as ambitious as you are.,iOS,Free,The Wall Street Journal.
4542,Generate the MD5 hash of a string in security.,Windows,Free,MD5 Hash Calculator for Chrome
4543,Allow you to get online cash back.,Windows,Free,Cashback Automator
4544,Have a twitter extension in Google Chrome.,Windows,Free,Conwitter
4545,Get a light grey theme for Chrome.,Windows,Free,ChromePlay Theme
4546,"Searching for PressReader for your Honeycomb operated tablet? Please visit ""PressReader for Honeycomb"" https://market.android.com/details?id=com.ne...",Android,Free,PressReader
4547,Active Weather powered by DarkSky is the first software by PaperSoft.,Windows,Free,Active Weather for Windows 10
4548,Search for products and quickly get price comparison for your selected product.,Windows,Free,Price Compare
4549,Filter unwanted comments from YouTube comment threads.,Windows,Free,YouTube Comment Snob
4550,Report phishing sites to Google for Safe Browsing.,Windows,Free,Safe Browsing
4551,Chat with your friends using gabbly.com in your Firefox sidebar.,Windows,Free,Gabbly Chat Sidebar
4552,Surf the Web and navigate local PC from one app.,Windows,Free,NotJustBrowsing Desktop
4553,Learn about binary options trading in Firefox.,Windows,Free,Binary Options A-Z Guides
4554,Open Non-Activated text links from a web site.,Windows,Free,LinkIt
4555,Open every bookmark of a selected folder in a new tab.,Windows,Free,Open all in tabs
4556,"Save all of your content in one place, so you can view it anytime, on any device.",Windows,Free,Pocket for Opera
4557,Integrate a meeting scheduler with Gmail.,Windows,Free,Meeting Scheduler for Gmail
4558,Retina graphics for your website.,Mac,Free,Retina graphics 
4559,"Save, collect, organize, and share anything you like on the Web.",Windows,Free,Minilogs
4560,Retina graphics for your website.,Mac,Free,Retina graphics 
4561,NPR News: The portable NPR and public radio station player for your Android.,Android,Free,NPR News
4562,Get a list of active window's ALT tags.,Windows,Free,ALTintext
4563,Get alerts when new articles are published on The New York Times.,Windows,Free,The New York Times
4564,Switch Web site you want to dark mode to help devices save battery and reduces eyestrain.,Windows,Free,Super Dark Mode
4565,Keep your self up to date with the enterprise updates.,Windows,Free,EnterprisePRO for Windows 8
4566,"Drudge Reader is the best Drudge Report reader App for Windows Phone, optimized for quick access & straightforward viewing of the Drudge Report linked articles at the tap of your finger.",Windows,Free,Drudge Reader for Windows 10
4567,Block ads in Google Chrome.,Webware,Free,Goodblock
4568,Start and stop the time tracking system from your browser toolbar.,Windows,Free,MinuteDock
4569,Get address or postal code of a your place.,Windows,Free,Ask Address
4570,Submit your product to software distribution sites.,Windows,Free to try,Soft Submit Browser
4571,Quickly access many of your favorite Yahoo.com sites.,Windows,Free,Yahoo Services
4572,Report suspected pedophile and suspected predator websites.,Windows,Free,Report pedophile
4573,Get a tool kit for all your online productivity needs.,Windows,Free,Quickrr Productivity Kit
4574,Retrieve movie ratings from Rotten Tomatoes and IMDB.,Windows,Free,Movie Ratings
4575,Browse the internet through QtWebKit browser.,Linux,Free,QupZilla for Linux (64-bit)
4576,Synchronize your calendars and events with Evernote.,Windows,Free,KanMeet Google Calendar Synchronizer for Evernote
4577,RSS reader with keyboard controls and Google Reader sync.,Mac,$7.99,NewsRack
4578,Create a new Google Document with one click.,Windows,Free,New Doc
4579,Send row as a table to an OneNote new page.,Windows,Free to try,Row to OneNote
4580,Hide almost 50 interface elements and add custom logos to Google Calendar.,Windows,Free,Minimalist for Google Calendar
4581,"Vastly improves YouTube by converting video comments to ""herp derp.""",Mac,Free,Herp Derp
4582,Compare prices automatically while you shop on the online shops.,Windows,Free,The Best Price
4583,Access the chrome extensions quickly.,Windows,Free,Quick Extensions
4584,"Experience the brand new WALA FOX10 app. Get more news, more weather and more video. It's everything you love about FOX10tv.com right at your...",iOS,Free,FOX 10 WALA - Mobile News and Weather
4585,"EHI public service information, from your town of residenceEHI allows you to be updated about all the information of the public interest from your...",iOS,Free,Ehi
4586,Add a clock to your browser.,Windows,Free,Clock
4587,Get Craigslist ad preview on mouseover.,Windows,Free,CraigsPreviewer
4588,"Save traffic, battery, and browse the Internet securely.",Android,Free,OceanX Browser - Chrome
4589,Access your wishlists in wishpot.com with a button.,Windows,Free,Wishpot
4590,E-mail management tool,Windows,Free to try,AceMail
4591,Access and manage Del.icio.us bookmarks.,Windows,Free,SimpleDelicious
4592,Remove formatting from copied text. ,Windows,Free,Copy As Plain Text
4593,"All Malayalam News papers, All Malayalam Magazines, Live Malayalam TV Channels.",Android,Free,"Malayalam news yono-All Malayalam Newspapers, yono"
4594,Stay connected with social emails on your mail box.,Windows,Free,PowerInbox for Firefox
4595,"Get the latest local news for Muncie with The Star Press Andriod app. A subscription to The Star Press is required and includes access to this app,...",Android,Free,The Star Press
4596,"Get daily coupons from Groupon, LivingSocial, Tippr and Adility Deal. ",Windows,Free,Groolu
4597,Share and add Notes and Bullets to Web sites.,Windows,Free,Fleck - Annotate the Web
4598,"The NTV News app delivers news, weather and sports in an instant.",Android,Free,NTV News
4599,Improve the scrollbars of Google Chrome.,Windows,Free,Professional Scrollbars
4600,Generate short urls for YouTube videos.,Windows,Free,Short YouTube
4601,Acquire travelling-oriented Web browser.,Windows,Free,ValmaTravel
4602,Get today`s comics from Explosm.,Windows,Free,Explosm comics
4603,Authenticate a Web page.,Windows,Free,Validaty
4604,View the current viral threat level of the Internet.,Windows,Free,Viral Threat Level
