,Description,Platform,Price,Product
3131,Next Issue is now Texture -- an all-access pass to world's best magazines.,Windows,Free,Texture - Unlimited Magazines for Windows 10
3132,Explore the Web in a safe and secure way.,Linux,Free,Google Chrome Dev for Fedora/OpenSUSE (64-bit)
3133,Get the Latest News Anywhere 24/7. Spend less on the Internet.,Android,Free,YEN  News: Ghana Breaking & Trending News App
3134,Access Chrome downloads in an easy way.,Windows,Free,Downloads
3135,Follow changes to any website in your RSS reader.,Windows,Free,Page2RSS 
3136,Enable StrikeThrough in Gmail or Google Apps Mail.,Windows,Free,Gmail StrikeThrough
3137,app version of Lynx text web browser,Mac,Purchase,Lynxlet
3138,"Read posts on RSS feeds with ease in English, German, and Dutch.",Windows,Free,Royal::RSS Reader
3139,Turn your address bar into a search engine and browse suggested Web sites and keywords.,Windows,Free,Smart Address Bar (Firefox)
3140,Add rows to store tabs in your Firefox.,Windows,Free,TooManyTabs
3141,"Patrika epaper Hindi for your iPhone and iPad. Latest news update for you anytime, anywhere. This free Patrika online newspaper App gives you the...",iOS,Free,Patrika ePaper
3142,"Share content to Twitter, Facebook and LinkedIn from anywhere on the web.",Windows,Free,Buffer
3143,Download Web sites and view them offline.,Linux,Free,WebCopier for Linux
3144,"Share content to Twitter, Facebook and LinkedIn from anywhere on the web.",Windows,Free,Buffer
3145,Disable the extension of URLs.,Windows,Free,Highlander
3146,Convert telephone numbers on your webpage to clickable links.,Windows,Free,Telify
3147,"Learn Spanish, French, German, Italian or Japanese.",Windows,Free,Popling 
3148,Access your current optionsXpress stock.,Windows,Free,optionsXpress for Chrome
3149,"Made to fit the fast-pace of the 21st century, it is the best paperless paper you can buy, providing an exact digital reproduction of the newspaper...",iOS,Free,Daily Mirror Newspaper App
3150,Provide your Opera Web browser with real MAPI support.,Windows,Free to try,MAPI4Opera
3151,Access Minecraft news hub and wiki from your Google Chrome browser.,Webware,Free,Minecrizzy
3152,Receive notifications when new messages arrive on Yammer.,Windows,Free,Yermah
3153,Open new tab with a background clock.,Windows,Free,New tab with clock
3154,multi-page MTML internet browser,Windows,Free,Intuition
3155,Inspect the meta data inside Web pages in Google Chrome.,Windows,Free,META inspector
3156,Read Kindle books in your browser.,Windows,Free,Kindle Cloud Reader
3157,Save selected Web contents to Google Drive.,Windows,Free,Save to Google Drive
3158,Read all unread tweets in easy manner.,Windows,Free,Reverse Timeline
3159,Navigate the Internet in a user-friendly browser.,Windows,Free,HanExoft Browser
3160,Have a simple to-do list extension.,Windows,Free,ToDo List
3161,Set your wallpaper in the windows PC.,Windows,Free,Set image as wallpaper
3162,Assembles your RSS feeds into a personalized newspaper.,Mac,$9.99,Pulp
3163,MP3 ringtone/callerID & call notes manager,Windows,$24.95,Lightwav 2
3164,Listen content from Internet sources.,Android,Free to try,Talking Browser Lite
3165,Safari extension for sending URLs to your iOS devices.,Mac,Free,Handoff
3166,Check the latest version of Chrome and Portable.,Windows,Free,Check all Chromium version
3167,"Browse faster with Turbo, Speed Dial, mouse gestures, and spell checker.",Linux,Free,Opera for Gentoo Linux
3168,"Podbean Podcast App is top trending podcast apps of global best 2016 in iTunes Store and also nominated as ""Top podcast player apps, 50 best...",iOS,Free,"Podbean Podcast App, Podcast Player"
3169,Create OneNote object node in mind map and save.,Windows,Free to try,Pons for MindManager and OneNote
3170,Translate web pages with unknown languages automatically in opera.,Windows,Free,Translate
3171,TV app on your phone.,iOS,Free,Unlimited TV App:Live TV Shows & News
3172,Filter Facebook posts with a comma-separated list of words and phrases.,Windows,Free,Hide That Post Facebook Filter
3173,Logical game,Windows,$12.50,Noughts & Crosses
3174,Show or hide images and Flash applets while browsing.,Windows,Free,Web Picture Toolbar
3175,NewsDog is the SMALLEST Indian news app that keeps you informed of daily news from Republic of India in a most efficient way.,Windows,Free,News Dog - India News for Windows 10
3176,Browse the Web with ease.,Windows,Free,Greenhorn Web Browser
3177,Export Safari bookmarks to del.icio.us.,Mac,Free to try,safarilicious
3178,Create your Chrome theme online.,Windows,Free,Theme Creator
3179,Chat with you friends or co-workers using RSS feeds.,Windows,Free,ZipLine FeedMail
3180,Watch videos with your friends on social networks using Firefox browser.,Windows,Free,myCircle TV
3181,Countdown to the next Formula 1 race.,Windows,Free,F1 countdown timer
3182,Stop receiving spam mails from any web site.,Windows,Free,Tempomail for Chrome
3183,Download a Web site to local directory for offline browsing.,Android,Free,HTTrack Website Copier
3184,Give a meaning to all your online purchases.,Windows,Free,Sharingpet
3185,Get the Hex and RGB value of a color.,Windows,Free,Color Generator
3186,This is the most powerful cyber security app in the world.,Android,Free,National Cyber Security 5.0
3187,"The KY3 News app offers local news, weather and sports experience at home or on-the-go. You can count on KY3 News to provide the latest news,...",Android,Free,KY3 News
3188,"Have a tool for on page translation, transliteration and dictionary lookup.
",Windows,Free,Dynamic Language Tools
3189,"Track the real location of your Web Server, IP, and Datacenter with your browser.",Windows,Free,WorldIP for Firefox
3190,Change your browser quick-launch or desktop icon.,Windows,Free,AntiBrowser 
3191,Generate slide show of images located on current Web page.,Windows,Free,Web Slide Show for Firefox
3192,"Shows the number of times you've visited a web site in a day.
",Windows,Free,Back Again for Chrome
3193,"Track the real location of your Web Server, IP, and Datacenter with your browser.",Windows,Free,WorldIP for Firefox
3194,"Have a tool for on page translation, transliteration and dictionary lookup.
",Windows,Free,Dynamic Language Tools
3195,Generate slide show of images located on current Web page.,Windows,Free,Web Slide Show for Firefox
3196,Design diagrams and make GUI prototyping on your Firefox browser.,Windows,Free,Pencil for Firefox
3197,Save and run arbitrary bits of JavaScript code on selected web pages in Safari.,Mac,Free,Quickscript
3198,"Search in Google and YouTube simultaneously at the click of a button, saving time and typing.",Windows,Free,GoogTube
3199,Hindustan Times now brings you the best news experience on Windows 8.,Windows,Free,Hindustan Times for Windows 10
3200,Shop till you drop at the all-purpose Amazon online stores across the globe.,Windows,Free,Amazon FireFox Button
3201,Clip content into popup windows.,Windows,Free,Portal
3202,Establish and improve global conversation online.,Webware,Free,Globalvoices
3203,Get the latest local news and weather for the metro Columbia area with News 19s Android app. - Local news for the Columbia area- Current weather...,Android,Free,WLTX
3204,Correct the misspelled words and phrases.,Windows,Free,WinSpell for IE
3205,Search for news sources from multiple Web sites.,Webware,Free,Content Keyword RSS
3206,Submit content and keep track of Digg.com events.,Windows,Free,Digg Toolbar
3207,Enhance your Internet Explorer.,Windows,Free,CDAC San-kshaepauk
3208,Remove audio ads from the web sites while you browse.,Windows,Free,DeezerAdBlock for Firefox
3209,Get an online MP3 Player with playlist and lyrics.,Windows,Free,Online Music Player
3210,Display all Google services as buttons or as a space-saving dropdown menu next to your address bar.,Windows,Free,Firefox Google Shortcuts
3211,Interact with anyone else viewing the same webpage.,Windows,Free,Chaggle
3212,Do PHP logging and debugging in Chrome console.,Windows,Free,ChromePHP
3213,Create your own easy-to-remember links to any site.,Windows,Free,StickyThis Toolbar for IE
3214,Customize the Google search by adding or removing different options or features.,Windows,Free,Clean up for Google
3215,"Stores your Chrome, Firefox or Safari bookmarks in the cloud on Evernote servers.",Mac,Free,Booknote Importer
3216,Search using any Search Engine directly from selected text.,Windows,Free,Flexi Search
3217,"Stores your Chrome, Firefox or Safari bookmarks in the cloud on Evernote servers.",Mac,Free,Booknote Importer
3218,"Browse the World Wide Web with ease and fun, using a Piano Instrument.",Windows,Free,Piano Browser
3219,Get All Latest News From Tanzania and All the World Through Muungwana Blog.,Android,Free,Muungwana Blog
3220,Use single sign-on and identity management for cloud computing.,Windows,Free,OneLogin for Google Chrome
3221,Check highlighted text on your directories and files.,Windows,Free,Dupe Checker
3222,Monitor the usage and sites that are browsed by a computer's users.,Windows,$10.00,BrowserSpy
3223,Remove all the traces of internet activities from your PC.,Windows,Free,History Eraser App
3224,Store all of your logins and passwords while keeping them synced between all your devices.,Windows,Free,Bitwarden - Free Password Manager
3225,Add Jabber features to your Firefox.,Windows,Free,Xmpp4moz
3226,Create cross-organization collaboration and discussion.,Webware,Free,Social Sites 2.0
3227,Download the latest script to tweak the layout and features of Google+.,Windows,Free,Google+ Tweaks
3228,Add context menus to an installed synology download redirector.,Windows,Free,Synology Download Redirector Context Addon
3229,"Publish, monetize, and advertise your email newsletters.",Webware,Free,FeedBlitz
3230,Stay up to date on what's happening in the world.,Windows,Free,News Republic for Windows 8
3231,Reduce the data gathered by tracking companies.,Windows,Free,Privacy Possum
3232,Maximize online productivity with effective Web browser.,Windows,Free,Epsilon
3233,Enhance your New Tab Page with the ultimate customizability and power. ,Windows,Free,Awesome New Tab Page for Chrome
3234,Experience the brand new ABC27 News app.,iOS,Free,"ABC27 News - WHTM-TV Harrisburg, PA"
3235,Add favicons to links by Google search.,Windows,Free,Faviconize Google
3236,"Donate a percentage of your purchase amount every time you shop online.
",Windows,Free,We-care Reminder
3237,Remove the left hand side bar on iGoogle.,Windows,Free,No Bar iGoogle
3238,Offer famous news websites available worldwide on your Windows 8 device.,Windows,Free,News Site Launcher Windows 8
3239,Get weather report for Greece.,Windows,Free,Weather Forecast for Greece
3240,Turn your computer into kiosk with Web navigation and touchscreen support.,Windows,Free to try,Kiosk Web Browser
3241,Add frequently used pages to the tab for quick access.,Windows,Free to try,OneNote Gem - Favorites
3242,Sputnik tells the untold.,Android,Free,Sputnik
3243,Keep track of your passwords and automatically log in on any Web site.,Windows,Free,Dashlane
3244,Import a game from Lexulous on Facebook into Scrabulizer.,Windows,Free,Scrabulizer Importer
3245,"Access Bookmarks, History, Plugins, Extensions, Downloads, DNS, Memory and Cache.",Windows,Free to try,Mega Button
3246,"Opera News is a completely personalised news app that lets you follow trending topics, share and view the latest videos, and keep current with...",Android,Free,Opera News - Trending news and videos
3247,weather prediction app,Windows,Free to try,F5 Data
3248,Search by speaking.,Windows,Free,Voice Search
3249,"Get the latest news, study materials for competitive exam preparation, and books in India.",Android,Free,Dailyhunt (NewsHunt) News
3250,Check all your plugins Periodically to keep them up-to-date.,Windows,Free,Secbrowsing
3251,Add icons to buttons or menus for your browser.,Windows,Free,CuteButtons
3252,Read news from the Assap's Web site on your desktop.,Windows,Free,Kechsoft ANT
3253,Connect to local neighborhood businesses with Web-based videos and links.,Windows,Free,Fave
3254,Get alerts when new articles are published on The Daily Telegraph.,Windows,Free,Telegraph
3255,Delete babies from your newsfeed permanently--by replacing them with awesome stuff.,Windows,Free,Unbaby.me
3256,Read email on your Palm device.,Windows,Free to try,One-Touch Mail
3257,Take the KOAT Action 7 News app with you everywhere you go and be the first to know of breaking news happening in Albuquerque and the surrounding...,iOS,Free,KOAT Action 7 News - Breaking news and weather for Albuquerque
3258,Do Google Search in Books.,Windows,Free,SkyTeam Book Search
3259,"Change links in Google Cache, and won't leave Google Cache when you click links in the cached pages.",Windows,Free,Google Cache Link Protector
3260,Back up and synchronize your bookmarks.,Windows,Free,Xmarks for Windows 8
3261,Download videos from Facebook.,Android,Free,Video Downloader For Facebook
3262,"iDownloadBlog keeps you in touch with everything Apple!Stay up to date with the latest Apple news, tips, apps, and accessory reviews, directly from...",iOS,Free,iDB app
3263,"Don't you wish you had a trusty pal to tell you all about the coolest free apps, the best Apple news, and answer every question about your...",iOS,Free,AppAdvice
3264,"Browse faster with Turbo, Speed Dial, mouse gestures, and spell checker.",Linux,Free,Opera for Red Hat (32-bit)
3265,Correct spelling mistakes and grammar errors on texts to enhance your learning skills.,Windows,Free,TwinMarker
3266,browser for TidBITS newsletters,Mac,Free to try,XBit
3267,"The NTV News app delivers news, weather and sports in an instant.",iOS,Free,NTV News
3268,"Browse all the gossips in EDMW, troubleshoot your PC in Infotech Clinics and more! Optimized mobile experience through redesigned user interface.*...",iOS,Free,GAGT
3269,Access instantly to the best sites related to the current one.,Windows,Free,SimilarWeb 
3270,Get a personal preference-based feed reader.,Webware,Free,FeedHub
3271,Take the KSBW Action News 8 app with you everywhere you go and be the first to know of breaking news happening in Monterey and the surrounding...,iOS,Free,KSBW Action News 8 - Breaking news and weather for Monterey Central Coast
3272,Highlight and right click the text for World of Warcraft players.,Windows,Free,Search Thottbot
3273,Write long expressions by easy-to-type text.,Windows,Free,Easy Smiley
3274,Bring an API Test Console into the Chrome browser.,Windows,Free,Apigee's API Test Console
3275,Follow the USA Judo Olympic team with the official desktop news reader.,Windows,Free,USA Judo Desktop Communicator
3276,ABN AndhraJyothy is a Telugu news channel which was launched on 15 October 2009 from the stable of the Telugu daily - AndhraJyothy.,iOS,Free,ABN AndhraJyothy
3277,Ghost incognito make sure that some domains always open in incognito mode.,Webware,Free,Ghost incognito
3278,Save pages directly to Instapaper with a click.,Windows,Free,Instapaper
3279,Search Free Stock Photos and Illustrations from over 200 free imagery websites.,Windows,Free,The Ultimate Free Stock Photo Search Addon
3280,Provide an organizational framework for writing your papers.,Webware,Free,Citelighter
3281,"Established on 1 November 2006 AD, onlinekhabar.com is number 1 news portal from Nepal, has made a landmark achievement in reaching Nepalese...",Android,Free,Onlinekhabar
3282,Develop and control Web-based applications.,Windows,Free,Geya-92 Black Screen
3283,Create popup windows.,Windows,Free,You Cant Block This
3284,Manage your bookmarks and passwords in IE.,Windows,Free to try,Bandy - The Bookmark Manager
3285,Get a fast and secure web browser using webkit and qt.,Windows,Free,Weltweitimnetz Browser Portable
3286,Explore through information of biologists and bioinformatics people on your browser.,Windows,Free,Biobar
3287,Add a Sinhala popup dictionary for google chrome.,Windows,Free,censitip
3288,Take notes for Office document and web page.,Windows,Free to try,Anchor to OneNote
3289,"Get the latest news, sports, entertainment and more from San Antonio's top news team, KSAT 12.",iOS,Free,KSAT 12 News -- KSAT.com
3290,RSS reader with Google Reader sync.,Mac,Free to try,Caffeinated
3291,Create Google Bookmarks in Google Chrome.,Windows,Free,Add Google Bookmark
3292,"SAMAA TV News App brings you Pakistan News, Breaking News, World News, Entertainment News, Sports News, Twitter Reactions, News Headlines...",Android,Free,Samaa News App
3293,Download files from torrent network to a local sandbox right from your Chrome browser.,Windows,Free,PNaCL Transmission
3294,"The official Prasar Bharati app brings you Live Radio, Live TV, News, Current Affairs as well as Entertainment programs (text, podcast and vodcast...",Android,Free,NewsOnAir PrasarBharati Official app AIR News+Live
3295,Safari extension that lets you hide any element on a web page.,Mac,Free,QuickNuke
3296,View ShopWiki's top product search results and fill up forms at online stores.,Windows,Free,ShopWiki Form Filler Assistant
3297,Access web pages from Google search result directly.,Mac,Free,gDirectLinks
3298,Get realtime football scores from scorespro.com.,Windows,Free,Football LiveScores
3299,Read and view the feeds from Google on your Windows 8 device.,Windows,$2.99,Nextgen Reader for Windows 8
3300,Search the Internet via menu bar item.,Mac,Free,myQuickSearch
3301,"Add, view, and organize your RSS feeds on Window 8 PC.",Windows,$3.49,Rss Reader for Windows 8
3302,Play Web games in your browser.,Windows,Free to try,WebGameBrowser
3303,Never be without your favorite radio station.,Android,Free,Mark Levin Show
3304,Switch between the normal and the incognito mode.,Windows,Free,Incognito Switcher
3305,Drudge Report Plus App is getting feed from Drudge Report (http://www.drudgereport.com/).,Windows,Free,Drudge Report Plus for Windows 10
3306,Get the URL of your photo on Picasaweb.,Windows,Free,PicasaPicker
3307,Insert option to view image width and height in image context menu.,Windows,Free,Image Size Info
3308,Browse the Web without using your mouse.,Windows,Free,Numberedlinks
3309,Upload and share your photos in moments.,Windows,Free,GPhotospace
3310,"Get current values for the S&P500, NASDAQ, and Dow stock market.",Windows,Free,Market Watcher
3311,Enhance patent search experience.,Windows,Free,Aspator
3312,Browse the Internet securely on your own private network hosted in the cloud.,Windows,Free,SageTea Browser
3313,Access and read RSS and Atom feeds easily.,Windows,Free,Beatnik
3314,Encrypt your Gmail messages with Chrome browser.,Windows,Free,SecureGmail
3315,"WindGURU is a service specialized for forecasting weather, mostly used by windsurfers, kitesurfers & sailors.",Windows,Free,Windguru for Windows 10
3316,Enrich Web pages with personalized links reflecting your interests.,Webware,Free,MashLogic
3317,Create and edit your own Feeds.,Windows,Free,Easy Feed Editor
3318,Dainik Bhaskar Group brings you the best most engaging news experience for your Android device in Gujarati.,Windows,Free,Divya Bhaskar - Gujarati News for Windows 10
3319,Add chat sounds to your social media chat.,Windows,Free,BuzzSounds
3320,Add smooth scrolling for the middle mouse button.,Windows,Free,MiddleButtonScroll
3321,Find latest software news from FileHippo.com.,Windows,Free,FileHippoNews for Windows 8
3322,Simplify voting at Dzone.,Windows,Free,DZone Voting
3323,Daily Thanthi news app will provide all the latest happening round the clock. With this app you can keep yourself up-to-date on what is happening...,iOS,Free,Thanthi News 24x7
3324,Access instantly to the best sites related to the current one.,Windows,Free,SimilarWeb for Firefox
3325,Add button to your Firefox browser  and download and convert Youtube content with a single click.,Windows,Free,YouTube to MP3 Converter - YTBmp3
3326,"Offline reader downloads Wikimedia projects contents, with or without pictures, in order to then access it offline.",Mac,Free,Okawix
3327,Search selected word with encrypted Google.,Windows,Free,Search with Encrypted Google
3328,Get the latest stories on the Web.,Webware,Free,Yahoo Buzz
3329,"The Daily Caller. Breaking news, politics, entertainment and more.",Android,Free,The Daily Caller
3330,"The brand spanking new Mirror app is here! Free to download, this app gives you all the very latest news, showbiz gossip and sport 24/7 in the palm...",Android,Free,The Mirror App
3331,"The Huffington Post app brings you up-to-the-minute articles, photos, videos and blogs in a dynamic and personalized experience.",Windows,Free,The Huffington Post for Windows 10
3332,This is a great app for (Redacted) Coast AM Insiders. **Stream or Download the Episodes**Plays in the Background***Must have a streamline / Coast...,iOS,Free,Coastam
3333,"Scanner Radio application gives you access to over 5, 700+ police, fire/EMS, aviation, rail, marine and amateur radio streams from around the world.",Windows,Free,Scanner Radio for Windows 10
3334,"Extends Safari to zoom, edit, create, save & share web images for free.",Mac,Free,ZoomInto for Safari
3335,Play a prank on your friends.,Windows,Free,Upside Down
3336,Browse the web and play music.,Windows,Free,Thinc ProFile
3337,This is a great app for (Redacted) Coast AM Insiders. **Stream or Download the Episodes**Plays in the Background***Must have a streamline / Coast...,iOS,Free,Coastam
3338,"Extends Safari to zoom, edit, create, save & share web images for free.",Mac,Free,ZoomInto for Safari
3339,"Scanner Radio application gives you access to over 5, 700+ police, fire/EMS, aviation, rail, marine and amateur radio streams from around the world.",Windows,Free,Scanner Radio for Windows 10
3340,Save the passwords from all your sites and access them from any computer.,Windows,Free,Mitto Password Manager Firefox Extension
3341,Browse Internet for data and block inappropriate web content with parental control.,Windows,Free,Net Search Web Browser
3342,Select and open similar links on your Firefox browser.,Windows,Free,Links Like This
3343,Access search results by pressing the number of the search result instead of clicking.,Windows,Free,Search Keys
3344,Fill in the rest of words as you type them in the location bar.,Windows,Free,Prospector: Speak Words
3345,"Get real-time access to Pittsburgh, Pennsylvania local news, national news, sports, traffic, politics, entertainment stories and much more.",Android,Free,WTAE- Pittsburgh Action News 4
3346,Receive new comics every day from Big Nate comics.,Windows,Free,Big Nate
3347,Safari extension that provides keyboard based navigation.,Mac,Free,vimari
3348,with this app you can view all webcams located in Abeton.,Windows,Free,Webcam Abetone for Windows 10
3349,"Right-click on any word, phrase or product, and perform a web search using your favorite providers.",Windows,Free,GoFor-It
3350,Check your Godville Game hero stat.,Windows,Free,Godville
3351,Record and share videos using a Web cam with Google Chrome.,Windows,Free,Nimbb
3352,Get a funny countdown to keep track of time when the world will end.,Windows,Free,2012 Countdown
3353,Fun web browser add-in,Windows,Free,Christmas Cracker
3354,Remove domains from search results.,Windows,Free,Search Filter
3355,Get the latest car news and access vast database of car pictures & information!,Android,Free,NetCarShow - Cars: News & Pics
3356,See the weather condition at you current location or any other place you add.,Windows,Free,Weather Now for Google Chrome
3357,"Open Homepage, Bookmarks, History, URL or Search in new tabs.",Windows,Free,Tab Utilities Lite
3358,Fresh News is the best breaking news application provided in Cambodia. You will never lost any Breaking News even if in minute. Every Breaking News...,iOS,Free,Fresh News
3359,Keep Chinese TV and Radio links for easy access.,Windows,Free,Chinese TV & Radio Online
3360,Convert files and merge docs.,Windows,Free,EasyFileConvert
3361,Hide Sidebar Options in Google Search Engine Results.,Windows,Free,Hide Google Options
3362,Navigate Chrome browser without using mouse.,Windows,Free,Keyboard navigation for Chrome
3363,Scours binary newsgroups for new files and automatically downloads them.,Mac,Free,NewzScape
3364,Get quick access to Clicky Web Analytics.,Windows,Free,ClickyChrome
3365,Show disabled pictures in Internet Explorer by just clicking them.,Windows,Free,TouchPicture
3366,Download a Web site to local directory for offline browsing.,Linux,Free,HTTrack Website Copier for Fedora (64-bit)
3367,"The HuffPost News app for iPhone and iPad brings you brand new topics: Whats Trending, Videos, Podcasts, Blogs, and Alerts that you can customize!...",iOS,Free,The Huffington Post
3368,Take the power of Riight.com anywhere on the Web.,Windows,Free,The Riight.com Toolbar for Firefox
3369,Keep Chinese TV and Radio links for easy access.,Windows,Free,Chinese TV & Radio Online
3370,"The official app of WFAA and WFAA.com, the ABC affiliate in Dallas, Texas.Stay on top of all the latest news, weather, sports and traffic with the...",Android,Free,WFAA
3371,Post your Weblogs easily.,Windows,Free,JustBlogIt
3372,Save web pages to read later with one click.,Windows,Free,ChromeItLater
3373,"The WWMT News 3 app delivers news, weather and sports in an instant.",Android,Free,WWMT News 3
3374,Turn your address bar into a search engine and browse suggested Web sites and keywords.,Windows,Free,Smart Address Bar IE Spanish
3375,Open multiple browser windows on your desktop.,Windows,Free,ValmaPolis
3376,"Play a fighting game of the future, send your droid out to fight your battles and shut them down.",Windows,Free,Chrome Wars
3377,Mobile financial software,Windows,$14.95,MidCast for Samsung I-330
