,Description,Platform,Price,Product
0,"Explore the impeccable Web of tomorrow with highly customizable, blazing fast, and safely secured browsing.
",Mac,Free,Mozilla Firefox
1,"Make the most of the Web with optimized, personalized, synced, and secured browsing.",Mac,Free,Google Chrome
2,"Experience the Web in Apple's signature browser, specifically designed for your Mac.",Mac,Free,Apple Safari
3,"Browse the way you want - faster, more secure, and more customizable.",Mac,Free,Opera
4,"Browse the Web in a modern, customizable and fast browser with a powerful feature set.",Mac,Free,Vivaldi
5,"Plunge into people-first browsing era with impeccably adapted, highly customizable, and safely secured Web experience.",Windows,Free,Mozilla Firefox
6,"Make the most of the Web with impeccably optimized, personalized, synced, and secured browsing.",Windows,Free,Google Chrome
7,"Surf the Web comfortably, relying on speed, safety, and power of customization.",Android,Free,Firefox Browser
8,"Browse with privacy on your side, tracker blocking, history erasure, and ads removal.






",Android,Free,Firefox Focus: The privacy browser
9,Browse and bring your personalized Chrome experience with you anywhere you go.,Android,Free,Google Chrome: Fast & Secure
10,"Personalize your browsing experience with favorites, reading lists and saved passwords.",Windows,Free,Microsoft Edge Legacy
11,Surf the Web and customize your browsing experience.,Windows,Free,Opera
12,"Browse the Internet with a hyper-customizable Web browser that that puts you in control.
",Windows,Free,Vivaldi for Windows 64
13,Protect your privacy and defend yourself against network surveillance and traffic analysis.,Windows,Free,Tor Browser Bundle
14,"Save all of your content in one place, so you can view it anytime, on any device.",Windows,Free,Pocket for Chrome
15,"Compose bold, clear, mistake-free writing with Grammarly's AI-powered writing assistant.",Windows,Free,Grammarly for Chrome
16,Browse faster and safer with automatic ad and tracker blocker.,Windows,Free,Brave
17,Get the Web browser with integrated privacy protection and proxy.,Windows,Free,Epic Privacy Browser
18,Browse the Web with speed and an elegant interface.,Windows,Free,Apple Safari
19,Take back control of your Web experience and plunge into people-first browsing era.,iOS,Free,"Firefox: Private, Safe Browser"
20,Browse with privacy on your side with automated online tracker blocking and history erasure.,iOS,Free,Firefox Focus: The privacy browser
21,Browse fast and private on your iPhone and iPad.,iOS,Free,Google Chrome
22,"Protect yourself against tracking, surveillance, and censorship on the Web.",Mac,Free,Tor Browser
23,"Explore the Web using Google's super-efficient, personalized, synced, and secured browser.",Windows,Free,Google Chrome (64-bit)
24,Surf the Web with the latest browser from Microsoft.,Windows,Free,Internet Explorer
25,"Surf the Web comfortably, relying on speed, safety, and power of customization.",Windows,Free,Mozilla Firefox (64-bit)
26,"Browse continuously across your devices and sync content and data with Microsoft Edge, now on Android.",Android,Free,Microsoft Edge
27,"Browse the Internet with a modern, optimized and feature-rich browser with adblocking support.",Android,Free,Brave Browser: Fast AdBlocker
28,Browse privately and access anonymous services on your Android device.,Android,Free,Tor Browser
29,"Surf the Web on Android devices with a personalized home screen, voice, and gesture control.",Android,Free,"Dolphin Web Browser - Adblock, Safe & Private"
30,"Browse the Web easily on the go, with a browser designed to be compatible and easy to use with just one hand.",iOS,Free,Opera Touch Web Browser
31,"Save articles, videos, recipes, and webpages you find online or from your favorite apps.",Mac,Free,Pocket
32,Bypass censorship and access the Internet and onion services with more safety and privacy.,iOS,Free,Onion Browser - Secure & Anonymous Web with Tor
33,"Surf the Internet faster, even with poor Wi-Fi connection, without wasting your data plan.",Android,Free,Opera Mini - fast web browser
34,"Compose bold, clear, mistake-free writing with Grammarly's AI-powered writing assistant.",Mac,Free,Grammarly
35,Display interactive multimedia Web content in your browser.,Windows,Free,Adobe Shockwave Player
36,Test about-to-be-released browsing features and contribute to putting the finishing touches on performance and functionality.,Windows,Free,Mozilla Firefox Beta
37,Split files into several parts and download them simultaneously.,Windows,Free,Star Downloader Free
38,"Load Web pages, run diverse Web applications, search, navigate, and customize in a snap.",Windows,Free,Google Chrome Portable
39,Surf the Web with download and cloud sync options.,Windows,Free,UC Browser
40,Download entire Web sites for offline browsing.,Windows,Free to try,Teleport Pro
41,Download a Web site to local directory for offline browsing.,Windows,Free,HTTrack Website Copier
42,Browse the Web with the latest version of Communicator.,Windows,Free,Netscape Communicator (32-bit Base Install)
43,"Navigate the Internet using a browser with powerful search, sharing, and multimedia capabilities.",Windows,Free,Torch Browser
44,Get instant contextual information from various content providers on any word in any application.,Windows,Free,1-Click Answers
45,"Get the latest version of this comprehensive set of Internet tools including a browser, chat client and much more.",Mac,Free,Netscape Communicator (PowerPC Complete Install)
46,Preview upcoming features in development and contribute to pushing Web browsing technology boundaries.,Windows,Free,Google Chrome beta
47,Block unwanted ads in Google Chrome.,Windows,Free,AdBlock
48,Optimize your browsing experience with Mozilla Firefox.,Windows,Free,FireTune for Firefox
49,Acquire Web and FTP sites for offline browsing.,Windows,Free to try,Offline Explorer
50,"Control MP3 player from Mozilla Firefox, Thunderbird, or the Mozilla suite.",Windows,Free,FoxyTunes for Firefox
51,Get the most out of social networking and the Web in this browser.,Windows,Free,Flock
52,Browse the Web without ads using Google Chrome.,Windows,Free,Adblock Plus for Chrome
53,Browse the Internet with confidence and speed.,Windows,Free,Baidu Spark Browser
54,Set Web pages to refresh automatically.,Windows,Free,AutoRefresher for IE
55,Download Web sites for offline browsing.,Windows,Free,WinWSD WebSite Downloader
56,Download and convert Web videos from hundreds of YouTube-like sites right from Firefox browser.,Windows,Free,Firefox Video Download Helper
57,Download multiple news articles at once.,Windows,Free,GrabIt
58,Remove spyware and keep them out with a browser sandbox.,Windows,Free to try,SpyWall Anti-Spyware
59,Download video and image files from various sites easily.,Windows,Free,Video DownloadHelper
60,"Experience the Web in Apple's signature browser, specifically designed for your Mac.",Mac,Free,Apple Safari
61,Browse the Web with intelligent compression technology and optimized readability.,Windows,Free,UC Browser for Java
62,Browse Web sites with a Media Center remote control.,Windows,Free,MCEBrowser
63,Add an English Malayalam dictionary to Google Chrome.,Windows,Free,English Malayalam Dictionary
64,Add a button in Facebook messages pages to fast delete them.,Windows,Free,Facebook Fast Delete Messages
65,"Surf the Web comfortably, relying on speed, safety, and power of customization.",Windows,Free,Mozilla Firefox (64-bit)
66,Embed Internet Explorer in Firefox tab.,Windows,Free,IE Tab for Firefox
67,"Surf the Web comfortably, relying on speed, safety, and power of customization.",Android,Free,Firefox Browser
68,Protect youself from annoying advertising in Internet Explorer.,Windows,Free,Adblock Plus for Internet Explorer
69,Search and download YouTube videos.,Windows,Free to try,Youtube Video Downloader
70,Watch high-quality live streaming from users and directly from live events online.,Windows,Free,Veetle TV
71,Search and add Facebook life to your browser.,Windows,Free,Facebook Toolbar
72,"Get your music, movies, TV, news, books, magazines, apps and games all in one place.",Windows,Free,Google Play
73,"Block banners, pop-ups, and cookies, and browse offline.",Windows,Free to try,Ad Annihilator
74,Try out the experimental channel for Mozilla Firefox.,Windows,Free,Mozilla Firefox Aurora
75,Experience the Web with the browser whose source code served the base for Google Chrome.,Windows,Free,Chromium
76,Prevent unwanted pop-up windows from opening.,Windows,Free,PopUpBuster
77,Surf the Internet via browser with innovative dual-core design that uses both Webkit and Trident.,Windows,Free,Maxthon Cloud Browser
78,Read and manage RSS/ATOM feeds and content.,Windows,Free,Snarfer
79,Save YouTube videos.,Windows,Free,Sothink Web Video Downloader for Firefox
80,"Download, decode, and view files from binary newsgroups.",Windows,Free to try,SBNews News Robot
81,Download and decode Usenet messages and images in the background.,Windows,Free to try,News Rover
82,"Use browser uniting rendering engines from Mozilla Firefox, Google Chrome, and Internet Explorer.",Windows,Free,Lunascape
83,"Download, browse, and edit your favorite Web sites offline.",Windows,Free to try,Offline Explorer Pro
84,"Automatically download and save files, or entire Web sites.",Windows,Free to try,SuperBot Offline Browser
85,Save all visited Web pages with your favorite browser to be used online and offline.,Windows,Free to try,MM3-WebAssistant Professional
86,Customize the way Web pages look and function by using small bits of JavaScript.,Windows,Free,Greasemonkey
87,Download multiple files from various Web pages.,Windows,Free,DownThemAll
88,Browser plugin to view rich multimedia web content.,Mac,Free,Adobe Shockwave Player
89,View and manage downloads from a tidy status bar.,Windows,Free,Download Statusbar
90,"Overcome geo-restrictions, protect your privacy and enjoy all content.",Windows,Free,ZenMate VPN for Chrome
91,Obtain download manager to work with Mozilla Firefox.,Windows,Free,FlashGot
92,Block pop-up windows and Messenger spam.,Windows,Free to try,IEJet - Popup Killer & Ad Stopper
93,View SVG files using a browser plug-in.,Windows,Free,Adobe SVG Viewer
94,Protect your privacy by cleaning up the tracks of your computer activities.,Windows,Free to try,System & Internet Washer Pro
95,Wrap a secure shield around Internet Explorer.,Windows,Free to try,Secure IE
96,Get albums on Facebook easily using Mozilla Firefox.,Windows,Free,Facebook Photo Album Downloader
97,Navigate the Internet with simple and easy-to-use browser.,Windows,Free,Spark Browser
98,"Discover Web sites, photos, videos, and blogs according to your interests.",Windows,Free,StumbleUpon for Internet Explorer
99,Transform your Gmail account into a Web drive.,Windows,Free,Gspace
100,Watch Online TV Stations with automatic list updates.,Windows,Free,LiveTV Toolbar
101,Download binary files from Usenet.,Windows,Free to try,NewsShark
102,"Browse multiple Web pages, block pop-up windows, and get Web updates and e-mail alerts.",Windows,Free to try,27 Tools-in-1 Wichio Browser
103,Browse the Web with Mozilla-based rendering system.,Windows,Free,K-Meleon
104,Combine powerful browsing with media downloading and sharing.,Mac,Free,Torch Browser
105,Browse the Web with a version of Chrome that's more cutting-edge than the developer's build.,Windows,Free,Google Chrome Canary
106,Surf the web using a specially optimized 64-Bit browser.,Windows,Free,Waterfox (64-Bit)
107,Browse multiple sites at the same time.,Windows,Free,GoSuRF Browser
108,Remove spyware from your PC and prevent unwanted software from being installed without your knowledge.,Windows,Free,Microsoft Windows Defender (64-bit)
109,Preview Web links via an Internet Explorer toolbar.,Windows,Free,Girafa
110,Refresh the Web page automatically in a given time interval.,Windows,Free,Refresher
111,Surf the Web without a concern for your privacy and security.,Windows,Free,SRWare Iron
112,"Enjoy a faster, more stable and safer Internet.",Windows,Free,Comodo Chromodo
113,Add a Web browser plug-in for accessing rich interactive applications.,Windows,Free,Microsoft Silverlight (64-bit)
114,Download Web sites for offline browsing.,Windows,Free to try,Website Extractor
115,"Grab, share, and organize video, pictures, and files from any Web site for background download.",Windows,Free to try,PimpFish 2007
116,Explore world of RSS from your desktop.,Windows,Free,FeedDemon
117,"Block pop-up windows, banner advertising, adult sites, and privacy abuse.",Windows,Free to try,FilterGate
118,Clean up traces of your online and computer activities.,Windows,Free,Asmw Eraser Pro
119,Download your favorite videos from the Internet with ease.,Windows,Free,ArcSoft Video Downloader
120,Download Web sites or their parts and save for later offline browsing.,Windows,Free to try,Website Ripper Copier
121,Display your favorite RSS feeds and stock information in a scrolling ticker on your desktop.,Windows,Free,Desktop Ticker
122,Surf the Web using a multitabbed Internet browser with multiple features.,Windows,Free,Acoo Browser
123,Scan and delete your cookies and Internet cache.,Windows,Free,Cookie Monster II
124,Add a retro videogame theme to Mozilla Firefox.,Windows,Free,Super Mario Bros. 3 Firefox theme
125,Delete cached and temporary cookies and manage Internet caches in real time as you surf the Web.,Windows,Free to try,RealTime Cookie & Cache Cleaner
126,"Surf the Net, block popups, search multiple engines, translate pages, and store favorites on the Web",Windows,Free,UltraBrowser
127,View the latest 3D content or build and play games on the Web with Unity.,Windows,Free,Unity Web Player
128,"Access websites blocked in your country, company or school.",Windows,Free,Hola for Firefox
129,"Personalize your browsing experience with favorites, reading lists and saved passwords.",Windows,Free,Microsoft Edge Legacy
130,Copy or download online content for offline browsing.,Windows,Free,WebStripper
131,Rich media content plugin for the web.,Mac,Free,Microsoft Silverlight
132,Download embedded videos from a variety of Web sites.,Windows,Free,Ook Video Ook
133,"Block unwanted pop-up ads, junk e-mail spam, and spyware.",Windows,Free,Ad Nuker Popup Blocker & Spam Filter
134,Display international weather from AccuWeather.com via Firefox.,Windows,Free,Forecastfox Weather
135,Automate repetitious tasks of checking the same Web sites and filling out of Web forms.,Windows,Free,iMacros for Internet Explorer
136,Get a multi-feature Web browser.,Windows,Free,The World Browser
137,"Explore the Web with optimized built-in smart tools for secured, ad-free browsing.",Windows,Free,Google Chrome dev
138,Delete Internet history and other traces from your computer.,Windows,Free,Click&Clean for Firefox
139,Add a find function to password manager.,Windows,Free,Password Finder
140,"Create backups of Mozilla, Mozilla Firefox, Mozilla Thunderbird and Netscape profiles.",Windows,Free,MozBackup
141,"Protect your passwords, payments, and privacy.",Windows,Free,Blur (formerly DoNotTrackMe) for Firefox
142,Watch and convert any video files into portable format.,Windows,Free,Sompy MovieEncoder
143,"Quickly switch among sidebars, and view dialog windows for downloads and extensions.",Windows,Free,All-In-One Sidebar
144,"Browse the Web faster, securely, and intuitively.",Windows,Free,360 Browser
145,"Search, download, assemble, and decode Usenet files.",Windows,Free to try,NewsLeecher
146,Access 45 tools from the desktop toolbar.,Windows,Free,A-ToolBar
147,"Receive warnings about risky Web sites that try to scam visitors, deliver malware, or send spam.",Windows,Free,WOT (Web of Trust) for Firefox
148,"Keep your bookmarks safely, browse the Web, and enhance the Internet experience on PC.",Windows,Free,CometBird
149,Download entire Web sites for offline browsing.,Mac,Free to try,Web Devil
150,View 3D/VRML content in your Internet browser.,Windows,Free,Cortona3D Viewer
151,Experience cutting-edge browser features and contribute to putting the final tweaks on performance and functionality.,Mac,Free,Mozilla Firefox Beta
152,"Connect with friends, preview search results, and get website updates.",Mac,Free,RockMelt
153,"Download embedded objects like movies, MP3s, and Flash and QuickTime files from Web pages.",Windows,Free,Download Embedded
154,Suppress pop-ups and make your Web-browsing experience more satisfying.,Windows,Free to try,PopUpCop
155,Find items for bid on eBay.,Windows,Free,eBay Toolbar
156,Usenet newsgroup client,Mac,Purchase,MT-NewsWatcher
157,Save any Flash file and create your own collection offline.,Windows,Free to try,Save Flash
158,Save all visited Web pages with your favorite browser to be used on- and offline.,Windows,Free,MM3 WebAssistant - Proxy Offline Browser
159,"Provide newsreader with NZB and RAR support, plus custom settings for each newsgroup.",Windows,Free to try,Binary Boy
160,"Download files with resume, recover, and accelerate functionalities, even in batch mode.",Windows,Free to try,GetBot
161,Block advertising on Web sites when surfing with Google Chrome.,Windows,Free,Adguard for Google Chrome
162,Receive alerts about risky Web sites trying to scam visitors and deliver malware.,Windows,Free,WOT (Web of Trust) for Internet Explorer
163,"Browse, review, and share sites with like-minded people in Firefox.",Windows,Free,StumbleUpon
164,Run mobile Internet browser and services on your Windows PC.,Windows,Free,WinWAP for Windows
165,Get quick access to the United States Web site.,Windows,Free,US-Browser
166,Use a safe and multi-language Mobile browser.,Windows,Free,QQ Browser 2012 for Nokia Phone
167,Chat with Facebook friends from your Mozilla Browser.,Windows,Free,Facebook Messenger
168,Block annoying advertisements on your Web pages.,Windows,Free,Adblock Plus for Internet Explorer (64-bit)
169,Chat with Facebook friends from your Mozilla Browser.,Windows,Free,Facebook Messenger
170,Watch Web television with over 1500 channels in different languages.,Mac,Free to try,iTube
171,Listen to hundreds of radio stations from around the world while browsing the Internet.,Windows,Free,Internet Radio
172,Get videos from your favorite video Web sites in one click.,Windows,Free,IE DownloadHelper
173,"Open up enhanced opportunities for productive, lightning-fast, synced, and personalized browsing experience.",Mac,Free,Google Chrome dev
174,Force Web sites to load in HTTPS.,Windows,Free,HTTPS Everywhere for Firefox
175,Browse the Internet using a Chrome-based browser with automation features.,Windows,Free,Coowon Browser
176,Download websites automatically for offline viewing.,Mac,$4.99,SiteSucker
177,Protect your computer from Java vulnerabilities while surfing with Firefox.,Windows,Free,NoScript
178,"Debug, modify, and monitor CSS, XML Http Requests, HTML, and JavaScript.",Windows,Free,Firebug
179,View news items and synchronize read and unread states across multiple PCs.,Windows,Free,RSS Bandit
180,Download an entire Web site full of images.,Windows,Free to try,SBWcc WebCam Corder
181,View and edit HTTP or HTTPS headers and post parameters.,Windows,Free,Tamper Data
182,Turn your Wi-Fi-enabled laptop into a virtual GPS device.,Windows,Free,Loki for Internet Explorer
183,"Protect your privacy by blocking ads, hiding your IP address, and using a proxy chain.",Windows,Free to try,Get Anonymous Personal Edition
184,"Download the contents of Web sites for offline viewing, including images, JavaScript, and Flash objects.",Windows,Free to try,HTTP Weazel
185,Block ad elements in Safari.,Mac,Free,Safari AdBlocker
186,"Save, email, snapshot, and categorize Flash files.",Windows,Free to try,Flash Capture
187,View pictures in newsgroups with this program.,Windows,Free to try,AllPicturez
188,Download and browse through newsgroup images.,Windows,Free to try,PCast
189,Get the meaning of words from directly within Firefox.,Windows,Free,Dictionary Tooltip
190,Block all annoying ads on the web.,Mac,Free,Adblock Plus for Chrome
191,Modify proxy configuration of Firefox.,Windows,Free,FoxyProxy
192,Download a Web site to local directory for offline browsing.,Windows,Free,HTTrack Website Copier (64-bit)
193,Search torrent files on the Internet.,Windows,Free,ExtraTorrent Toolbar
194,"Surf the Web in Aqua style with multiprocessor support, customizable toolbars, ad-blocking features, and many other powerful tools.",Mac,Free to try,OmniWeb Test
195,"View, edit, and browse your favorite Web sites offline.",Windows,Free to try,Offline Explorer Enterprise
196,Protect your privacy and defend yourself against network surveillance and traffic analysis.,Linux,Free,Tor Browser Bundle Beta for Linux (32-bit)
197,Surf the Web using multithread frame browser with various features.,Windows,Free,TheWorld Browser
198,Flash Player preview version with new video hardware acceleration for Internet Explorer,Windows,Free,Adobe Flash Player Beta 64-bit for Internet Explorer
199,Protect your privacy and security while surfing the Web with Mozilla Firefox.,Windows,Free,Cocoon for Firefox
200,"Reveal, refine, and take full advantage of high-performance, all-in-one Internet application suite.",Windows,Free,SeaMonkey
201,Download Web sites to your hard drive.,Windows,Free to try,Leech
202,Add a set of language-specific resource files to Windows with Internet Explorer 7 installed.,Windows,Free,Windows Internet Explorer 7 MUI Pack for Windows XP SP2
203,"Download and handle all file types in Internet Explorer, and play movies and slide shows.",Windows,Free to try,Download Toolbar for Microsoft Internet Explorer
204,Translate entire Web pages into a selected language.,Windows,Free,Google Translate
205,Surf the Internet faster using enhanced navigation.,Windows,Free,Offline Navigator
206,"Try out upcoming features and stay involved in creating beautiful, unique Web browsing experiences.",Windows,Free,Google Chrome beta (64-bit)
207,"Browse, view, and read Web feeds and monitor Web site changes.",Windows,Free,Active Web Reader
208,Keep your surfing private while stopping annoying pop-ups and Flash ads.,Windows,Free to try,RIP Killer Popup Blocker
209,"Browse multiple pages in a visual map, search multiple engines, and tame pop-ups.",Windows,Free to try,iRider
210,"Block pop-ups, search Google, and use ScamBlocker to protect yourself from fraudulent Web sites.",Windows,Free,EarthLink Toolbar
211,Surf the Web via your mobile device.,Windows,Free,The Best UC till now
212,Hide you true internet identity through a proxy while using Firefox browser.,Windows,Free,AnonymoX
213,"Rip pictures, video & audio from the Web.",Windows,Free,WebRipper
214,Play Kalydo powered games online.,Windows,Free,Kalydo Player
215,"Add saved searches, a filter assistant, and conversation previews to Gmail.",Windows,Free,Better Gmail
216,Navigate the Web using a smart browser with built-in ad blocker and enhanced privacy protection.,Windows,Free,Slimjet
217,Transform Firefox into a 3D experience for viewing photos and videos.,Windows,Free,Cooliris for Firefox
218,"Download and view images, including GIF and JPEG files.",Windows,Free to try,QuadSucker-News
219,Back up and restore Google Chrome profile.,Windows,Free,Google Chrome Backup
220,Chat using Gtalk in Google Chrome interface.,Windows,Free,Gtalk for Google Chrome
221,Surf the Web faster and more securely.,Windows,Free,Windows Live Toolbar
222,Browse the Web with enhanced browser based on Gecko 1.9.1.6.,Windows,Free,Orca Browser
223,Get a graphical Web browser for kids.,Windows,Free,KidZui - The Internet for Kids
224,"Find, preview, and download videos, mp3, and software with just a few clicks.",Windows,Free to try,Ozum All-in-One Newsreader
225,"View preview images of Web sites in Google, Bing, and Yahoo search results.",Windows,Free,SearchPreview
226,"Connect with people, express yourself, and discover more about all the things you love.",Android,Free,Twitter
227,Transform Internet Explorer into 3D experience for viewing photos and videos.,Windows,Free,Cooliris for Internet Explorer
228,Convert your DVDs to small video files for whatching them on your PDA.,Windows,Free to try,CarryDVD
229,Access your favorite sites quickly and view more pages using less data.,Android,Free,Opera browser with free VPN
230,"Search and track torrent sites.
",Windows,Free,Torrent Finder Toolbar
231,"Tweak simultaneous connections, pipelining, cache, DNS cache, and initial paint delay in Firefox browser.",Windows,Free,Fasterfox
232,Search newsgroups for prespecified information.,Windows,Free to try,PictureAgent
233,Create tabbed windows with this browser.,Windows,Free,Xana Web Browser
234,E-mail selected text via Internet Explorer with right click.,Windows,Free,SnipIT
235,Enhance Mozilla s Firefox search engine and browsing features.,Windows,Free,Ideal Browser Firefox Edition
236,Search and get instant answers on your PC.,Windows,Free,DuckDuckGo for Firefox
237,Zoom in on photos in Facebook using Google Chrome.,Windows,Free,Facebook Photo Zoom
238,"Surf the Web on Android devices with a personalized home screen, voice, and gesture control.",Android,Free,"Dolphin Web Browser - Adblock, Safe & Private"
239,Surf the Internet with customizable browser.,Windows,Free,Sleipnir
240,Download entire Web sites for offline viewing.,Windows,Free to try,QuadSucker/Web
241,Browse and download web-sites.,Mac,Free,Netscape X
242,Block annoying advertisements while surfing the Web via Internet Explorer.,Windows,Free to try,Del Ad for Internet Explorer
243,Watch TV channels and listen to online radio.,Windows,Free,Geo TV Live
244,Add Google Voice notifications and additional features to Google Chrome.,Windows,Free,Google Voice
