,Description,Platform,Price,Product
1527,Run a SMS text messaging server in your own private cloud using GSM modems and SIM cards.,Windows,Free,CommzGate Messaging Server
1528,Repair forgotten or lost account details for Outlook Express email client.,Windows,Free to try,Password Recovery Toolbox for Outlook Express
1529,Implement your everyday e-mail handling tasks.,Mac,Free,GNUMail.app
1530,Chat with your friends over the Internet or LAN.,Windows,Free,EasyChat
1531,Synchronize your contacts from XLite-4.,Windows,Free,Xlite4synC
1532,Backup and transfer all your Outlook Express data.,Windows,Free to try,SafeMail
1533,Monitor your e-mail box and protect it from spam.,Windows,Free,Spam Sleuth Lite
1534,Send bulk Email messages from your PC.,Windows,Free to try,Super Email Sender
1535,Manage your webcam with ease.,Windows,Free,Yawcam
1536,Create and send mobile marketing campaigns via SMS messages with keywords.,Windows,Free to try,SMS Mobile Marketing Pro
1537,Duplicate the video stream for multiple applications.,Windows,Free to try,WebCamSplitter Pro
1538,Gain easy and efficient access to your remote cameras.,Windows,Free,Visionica 1
1539,Chat with your friends and set up video conferences over a secure connection.,Windows,Free,Jitsi (64-bit)
1540,Log in to accounts on multiple chat networks simultaneously.,Mac,Free,Pidgin
1541,"Chat with AIM, Jabber, ICQ, IRC, MSN, and Yahoo messengers.",Windows,Free,Miranda IM (64-bit)
1542,Chat and meet people online.,Windows,Free,Vortec IRC
1543,Use e-mail marketing in your organization.,Windows,Free to try,Email Marketing Director
1544,Send unlimited emails using gmail and hotmail smtp server.,Windows,$79.95,Easy Inbox Mailer
1545,Build up a client-server instant messaging network.,Windows,Free,Gossip Corporate Messenger
1546,"Access your Gmail, Google Apps, Zimbra, and Office 365 from desktop.",Windows,Free to try,Affixa
1547,Repair OST files and convert OST file into PST file.,Windows,Free to try,Infixi OST Converter Software
1548,Access radio stations and view song information and lyrics on your iPhone.,Webware,Free,iRadio App
1549,Build the Email and collaboration server for SMB.,Windows,Free to try,Kerio Connect (64-bit)
1550,Repair your e-mail attachments and Links Tab links.,Windows,Free to try,Link Magic
1551,Use your broadband Internet connection as regular phone line.,Windows,Free,iConnectHere Dialer
1552,Recover data from Outlook OST files.,Windows,Free to try,SysTools OST Recovery
1553,"Create, edit, and manage your own mobile applications.",Windows,Free to try,Personal Mobile App Maker
1554,Find public records and view people information.,Webware,Free,People Search & Background Checks (Stealth Insight)
1555,Synchronize your Google Calendar and Microsoft Outlook Calendar.,Windows,Free to try,Calgoo Connect
1556,Get your own personal toll-free number and voicemail service.,Windows,Free to try,800-Works Service
1557,Organize and automate all the mailing list management tasks.,Windows,Free to try,AMS Enterprise
1558,Send mass e-mail with ease.,Windows,Free to try,MailTrain Express
1559,"Secure, manage and archive your instant messages in MSN, Yahoo, AOL, or ICQ sevices.",Windows,Free,NetworkTwister
1560,Zalo is the new market-leading messaging app with amazing features.,Android,Free,Zalo - Video Call
1561,Send and receive text from your PC to mobile device.,Windows,Free to try,SMS Text to Mobile
1562,Access your Yahoo E-mail using the IMAP protocol.,Windows,Free to try,Yahoo IMAP Connector
1563,"Carry out video, audio, and text chat.",Windows,Free,Sada Private Messenger
1564,"Repair, modify, and bring back Windows Live Messenger.",Windows,Free,Messenger Reviver
1565,Finding people & businesses at home or when traveling.,Android,Free,Whitepages People Search
1566,Convert message files from EML to MSG format.,Windows,Free,Convert EML to MSG for Outlook
1567,Make voice and video calls between computers.,Windows,Free,Express Talk Free VoIP Softphone
1568,Copy and share your documents using your digital camera or camera phone.,Webware,Free,Qipit
1569,Send bulk SMS messages to any phone via your computer.,Windows,Free,Web Based sms messenger
1570,Sending short messages from your PC to any GSM network.,Windows,Free to try,MessageUnlimited
1571,"Copy your AOL e-mail, address book and favorites to Outlook, Gmail, iCloud or Mac Mail.",Windows,Free to try,ePreserver
1572,"Protect your PC against phishing, malware, and spam attacks.",Windows,Free,SaferSurf
1573,Allows users to converse with both AIM and ICQ users,Windows,Free,Odigo
1574,"View, browse, and share media content all in one interface.",Webware,Free,Radus
1575,Look up and insert contact information from WhitePages.com into Microsoft Word or Outlook.,Windows,Free,WhitePages.com InfoFinder
1576,Send HTML personalized newsletters or any kind of e-mail to your subscribers.,Windows,Free to try,Newsletter
1577,Decrease the size of Outlook storage file by saving e-mail attachments and replacing them with links.,Windows,Free to try,Attachment Save
1578,Get Topalt Emoticons for Outlook and bring more emotions to your emails.,Windows,Free,Topalt Emoticons for Outlook
1579,"Filter spam in Outlook, Office 365, Outlook Express, and Live Mail.",Windows,Free to try,SpamBully
1580,Provide a professional and stable VoIP system.,Windows,Free,VOS3000
1581,Send and receive fax from single computer or network.,Windows,Free to try,32bit Fax
1582,Recover lost or forgotten pst password.,Windows,Free to try,Stellar Phoenix Outlook Password Recovery
1583,"Push to talk, text, send photos, and locations to people and groups across platforms.",Android,Free,Voxer Walkie-Talkie
1584,Protect your information and distribute documents that can't be compromised by recipients.,Windows,Free,Kinar KeepSafe FreeMail
1585,Add live chat room with video to Web sites.,Windows,$299.00,123 Flash Chat Software (64-bit)
1586,Extract email addresses from website.,Windows,Free,Stupid Spam Stopper
1587,Chat with other people on LAN or Internet.,Windows,Free,AM Messenger
1588,"Delete all junk mail, spam, trojans, and viruses with big attachments easily.",Windows,Free to try,Junk Mail Remover
1589,Call between PCs and mobile phones.,Windows,Free,vPhone
1590,Use this chat program with interface in Albanian.,Windows,Free,Antena
1591,Manage your e-mail accounts and filter your messages.,Windows,Free to try,Chaos Intellect
1592,Secure chat client with self-destructing messages and encrypted connections.,Mac,Free,Wickr
1593,"Protect your Microsoft Outlook from spam, fraud, and phishing mails.",Windows,Free to try,Official Spam Filter for MS Outlook
1594,Make faxes and have an answering machine on your PC.,Windows,Free to try,VentaFax
1595,Manage your account right from your phone with the tracfone my account app.,Android,Free,TracFone My Account
1596,Find geographic location of IP numbers.,Windows,Free to try,WhereIsIP
1597,"Extract, pack, or unpack attached files in Outlook messages automatically.",Windows,Free to try,Attachments Processor for Outlook
1598,Access and manage Google Voice from your desktop.,Windows,Free,GVNotifier
1599,Convert LiveMail message files and attachments to PST format.,Windows,Free to try,Live Mail to Outlook Transfer
1600,Convert all your E-mails from Apple Mail to PST format. ,Windows,Free,Gladwev Mail To PST Converter
1601,Test and report your broadband Internet connection speed.,Windows,Free,Line Speed Meter
1602,Recover lost e-mails in Mozilla Thunderbird.,Windows,Free to try,Advanced Thunderbird Email Recovery
1603,"Chat with family, friends, or colleagues using HTML5 based cross-device chat client.",Windows,Free to try,123 Flash Chat
1604,Communicate and share video/audio documents through VCN networks.,Windows,Free,VSEEN  Client
1605,New. Support for Gallery Share. see how its done: https://www.youtube.com/watch? v=IZFvnGcFRWE. + Fast. + Completely free. + Support Gallery...,Android,Free,WiFi Direct +
1606,Display phone model and manufacturer of entered IMEI number.,Android,Free,ShaPlus IMEI Info
1607,Calls Blacklist is both a call blocker and an SMS blocker.,Android,Free,Calls Blacklist - Call Blocker
1608,Encrypt your instant messaging sessions when using standard IM clients.,Windows,Free to try,Brik IM
1609,"Search actors, movies, tv shows, and characters on your iPhone.",Webware,Free,IMDb Mobile
1610,Extract email addresses from text files.,Windows,Free,Identify Emails - Collect emails
1611,"Convert Lotus Notes e-mails to Outlook Express, Mozilla Thunderbird, and Windows Mail formats.",Windows,Free to try,EML Converter for Lotus Notes
1612,Find new friends from all over the world.,Windows,Free,Video Chat For Facebook
1613,Protect your online identity and privacy with this email security tool.,Windows,Free,Ciphire Mail
1614,Integrate your MS Outlook contact lists to your Cisco IP phone.,Windows,Free,Netelligent Unified Outlook Dialer
1615,Bring VoIP to your tablet or phone and make WiFi calls.,Android,Free,VoIP Tablet and Phone
1616,Use various calendaring systems to estimate busy or free time information.,Windows,Free,iCal Connector for Lotus Notes
1617,Share Files Offline in your LAN.,Windows,Free to try,Feem
1618,"Apply text communication, file transfer, voice chat, and monitoring in corporate network.",Windows,Free to try,Windows Communicator
1619,Integrate MailEnable with Microsoft Outlook.,Windows,Free,MailEnable MAPI Connector for Microsoft Outlook (32-bit)
1620,Use advantages in the Spanish version of IRC client.,Windows,Free,Juerguistaz Script
1621,Send free SMS to any one in India from your PC,Windows,Free,Win2SMS
1622,"Manage, view, and share webcams over the Internet from iPhone, Android, and Facebook.",Windows,Free,Seedonk
1623,Manage and store your private messages in vBulletin forums.,Windows,Free,vBulletin PM Reader
1624,"Send bulk and personalized e-mail, SMS, and fax to unlimited group of recipients.",Windows,Free to try,Email Director .NET (64-bit)
1625,Receive e-mail messages and read news.,Windows,Free,Sylpheed
1626,Type in Myanmar on your iOS device.,iOS,Free,Myanmar Keyboard
1627,"Send multiple e-mails, attachments, and embedded images from your command line.",Windows,Free to try,AbsoluteTools-Sendmail - CMD
1628,Add AIM/ICQ buddies to your MSN Messenger's contact list.,Windows,Free,IMTiger
1629,"Protect your computer against spam, fraud, and phishing mails.",Windows,Free to try,Official Spam Filter for Outlook Express
1630,Extract e-mail addresses from many PDF Files and save into Excel.,Windows,Free to try,PDF File Email Extractor
1631,Delete all the cookies but the ones that you want to keep.,Mac,Free to try,Cookie Muncher
1632,"keep a multimedia diary of the items
that you collect with your phone device.",Windows,Free,Nokia Lifeblog
1633,Migrate e-mail messages from Mac Mail to Outlook.,Windows,Free to try,Mac Mail to Outlook Transfer
1634,"Get a connection to Internet, and simplify the process.",Windows,Free,IYSoft Dial-Up Connection
1635,Create and deliver personalized mails.,Windows,Free to try,Campaign Enterprise
1636,"Access Gmail on your desktop with this free, third-party app.",Windows,Free,GeeMail
1637,"Store phone contacts, pictures, text messages, and calendar events online.",Webware,Free,ZYB
1638,See who is calling during the calls without having number in contacts.,Android,Free,Mobile Number Address Tracker
1639,Send newsletters instantly to groups or individuals.,Windows,Free to try,Bulk SMS From PC
1640,Move Gmail e-mails to Outlook.,Windows,Free to try,Gmail to Outlook Transfer
1641,"Recover your Windows Mail, Live e-mails, and Windows contacts.",Windows,Free,Mail Undelete Recovery Toolbox Free
1642,Perform in-depth analysis of PST file contents.,Windows,Free to try,Data Extraction Kit for Outlook
1643,"Use myMail to manage your Gmail, Yahoo., AOL, iCloud, Hotmail, Outlook.com, GMX and other IMAP or POP3-enabled mailbox.",Android,Free,"myMail - Email for Hotmail, Gmail and Outlook Mail"
1644,Play a card game on your iPhone.,Webware,Free,Solitaire
1645,Enhance your communications with a powerful email client.,Mac,Free,Eudora OSE
1646,Send messages and transfer files on your local network.,Windows,Free to try,SnapTalk
1647,Take control of your company inbox to allow mission critical e-mail management.,Windows,Free to try,Cerberus Helpdesk
1648,Answer and record calls and share your music in a conversation.,Windows,Free to try,"PrettyMay-Best Skype recorder,answering machine"
1649,"See the sky for any date, time, and location on your iPhone.",Webware,Free,Starry Night Mobile
1650,macam based free web cam app with ftp support and auto imag saving,Mac,Free,BT Cam
1651,Send multiple e-mails from Excel form using your Outlook address book.,Windows,Free,Excel Bulk Mailer
1652,Migrate eudora/thunderbird to mail/thunderbird.,Mac,Free,Eudora Mailbox Cleaner
1653,Capture and save images from your Webcam.,Windows,Free,Webcam Capture
1654,"Manage your SIM and Outlook contacts, make and receive mobile calls from your notebook or PC.",Windows,Free to try,.Mobile
1655,Get a study guide with concise explanations and multiple features.,Windows,Free to try,Human Nervous System - Anatomical Perspective
1656,Protect and manage your mails.,Windows,Free,Koma-Mail
1657,Access full e-mail routing service.,Windows,Free to try,Mail Exchange
1658,Get an Arabic messenger tool.,Windows,Free,Ahwar Messenger Arabic Version
1659,Create and insert text templates into Microsoft Outlook messages.,Windows,Free to try,Quick Templates for Outlook
1660,ScanMaster Lite is an application for vehicle diagnostics to OBD-2/EOBD standards.,Android,Free,ScanMaster for ELM327 OBD-2 ScanTool
1661,Convert MSG files to Outlook format.,Windows,Free to try,MSG to Outlook Transfer
1662,Apply various effects to your webcam video feed.,Windows,Free to try,Webcam Jester
1663,Record Skype Webcam video during your Skype conversation.,Windows,Free to try,Camersoft Skype Video Recorder
1664,Capture full screenshots of Web pages and save them in different file formats.,Mac,Free to try,SnapWeb
1665,Perform mail merge processing.,Windows,Free to try,AutoMailMerge Plug-in
1666,TEMS is a mail program which is able to read aloud the mail to its user.,Windows,Free,TEMS
1667,Unsubscribe form unwanted e-mail automatically.,Windows,Free,UnsubSafe Toolbar
1668,Create interactive data applications using SMS text messaging.  ,Windows,Free to try,DataNow
1669,Connect to the IRC chat network.,Windows,Free,AdiIRC
1670,Perform e-mail migrations from Entourage to Outlook.,Windows,Free to try,Entourage to Outlook Transfer
1671,Get access to all your POP based e-mail accounts and domains over the Internet.,Windows,Free to try,Just WebMail
1672,Add a virtual web cam to your PC.,Windows,Free to try,VaryCam
1673,Manage e-mails and news from multiple sources.,Windows,Free to try,Gemini
1674,Add effects onto your Web cam video.,Windows,Free,VideoSkin.Net
1675,Filter spam and scan for viruses in your e-mails.,Windows,Free to try,Policy Patrol for Exchange/Lotus
1676,Junk mail filter for Apple Mail.,Mac,Free,JunkIt
1677,Make VoIP and video-over-IP calls.,Windows,Free to try,Max Phone
1678,"Manage, export, and backup the contact details of your friends on Facebook.",Windows,Free,My FB Contacts
1679,Record and playback audio/video during MSN chat sessions.,Windows,Free to try,Supertintin MSN Webcam Recorder
1680,"Export messages, attachments, contacts, tasks and other items to text, mailbox, or message files.",Windows,Free to try,Exporter for Outlook
1681,Send large files as e-mail links to friends and colleagues.,Windows,Free,Docstoc OneClick
1682,"Extract e-mail address from Mozilla Thunderbird e-mails.
",Windows,Free to try,Thunderbird Email Extractor
1683,Send bulk e-mail messages.,Windows,Free,123 Bulk Email Direct Sender 2006
1684,Retrieve any information you want from your PC quickly.,Windows,Free to try,Enfish Find
1685,Send SMS right from your desktop.,Windows,Free,2-Way SMS Messenger
1686,Receive and send SMS to GSM mobile phones using your MS Outlook.,Windows,Free,TexSMS
1687,"Assign a random image, screenshot, or album art as your MSN picture.",Windows,Free,Messenger Slideshow
1688,Cheap Voip Calls: The Mobile VOIP dialer lets you make cheap calls to national or international destinations.,Android,Free,MobileVOIP Cheap international Calls
1689,Now international calls from your Android device are included with your Vonage home service. If your Vonage home service includes unlimited*...,Android,Free,Vonage Extensions
1690,Manage e-mail lists and prepare direct marketing campaigns.,Windows,Free to try,ListMotor
1691,Check and print your e-mail messages automatically.,Windows,Free to try,Automatic Print Email
1692,Send MIME type of e-mail messages to local host and client.,Windows,Free,XPertMailer
1693,Establish an administrated instant messaging system for your organization.,Windows,Free to try,Mirador Instant Messenger
1694,"Take control of your e-mails, Projects and tasks in Outlook.",Windows,Free to try,ClearContext Professional
1695,Make and receive external calls on the network via SkypeIn and SkypeOut services.,Windows,Free to try,PeerioBiz
1696,Record video from IP Cameras and capture cards for robust surveillance systems.,Windows,Free to try,NVR+
1697,Use comical voices for online RPG.,Windows,Free,Personality Voices - MorphVOX Add-on
1698,Send customized SMS in bulk with a unique sender ID directly from an Excel sheet.,Windows,Free,SMS Studio
1699,Get Opt-In e-mail list worldwide.,Windows,Free to try,Opt-In Email List Download
1700,Record all dial-up networking calls and data transfer.,Windows,Free,TICK
1701,Keep track of your modem statistics.,Windows,Free,Modem Logger
1702,Send around 600 to 750 SMS per hour.,Windows,Free to try,Air SMS (GSM Modem)
1703,"Create and maintain mailing lists, eliminate duplicate and invalid addresses.",Windows,Free to try,Alias Email List Manager
1704,"Organize your e-mails, view messages per correspondent. ",Windows,Free to try,Neo Pro
1705,Set up a button in Outlook to send mass mail to your contacts with just one click.,Windows,Free to try,AdvMassMailer for Outlook 2000/XP/2003/2007
1706,Please note: This app is for licensed Amateur Radio operators only.,Android,Free,EchoLink
1707,"Fix Exchange database issues, recover EDB, and perform EDB to PST conversion.",Windows,Free to try,Kernel for Exchange Server
1708,Supply a client-server chat for LAN or Internet with video chat support.,Windows,Free,CommFort for Client
1709,Create backups of your important Outlook data.,Windows,Free to try,OutBack Plus
1710,Combine database records with VB scripts to create personalized e-mails.,Windows,Free to try,eMill
1711,"ReverseTether allows you to access your computer's internet connection on your device via USB, thus, reverse tethering. It's the first and only app...",Android,Free,Reverse Tether [Trial]
1712,Set up home security by means of any video device.,Windows,Free to try,123Motion
1713,Find bounce/invalid e-mail ID.,Windows,Free to try,Bounce Detector
1714,Extract e-mail addresses from Outlook e-mail folders.,Windows,Free to try,Outlook Email Address Extractor
1715,Recover damaged PST files and Outlook objects from your Outlook account.,Windows,Free to try,Inbox Repair Tool for PST
1716,Service for saving your chat history online,Windows,Free,IM-History
1717,Compose and send group text SMS from your PC.,Windows,Free,Cute SMS Manager
1718,Add SMS functionality to your applications.,Windows,Free to try,SMS Gateway
1719,"Protect and control your e-mail, passwords, and important files.",Windows,Free,VaultletSuite 2 Go
1720,"Eliminate spam e-mails before downloading, stop pop-up windows and banner ads.",Windows,Free to try,X-Spam
1721,Record and monitor ICQ chat conversations.,Windows,Free to try,Ultra ICQ Spy Monitor
1722,Create e-mail auto response systems for an unlimited number of mailboxes.,Windows,Free to try,FollowUpExpert Business
1723,"Send instant messages using a chat client that supports AIM, ICQ, MSN, and Yahoo Messenger.",Windows,Free,BuzzIM
1724,Delete duplicate info in Google Contacts and Google Calendar.,Windows,Free to try,GG Duplicates Cleaner
1725,Keep your e-mail account free from spam.,Windows,Free to try,Spam-Aware
1726,Chat and share with anime fans.,Windows,Free,Hikari Anime Chat
1727,Avoid unsolicited e-mail messages before they get in your inbox.,Windows,Free to try,EClean
1728,"See, hear, and chat one on one via LAN or Internet.",Windows,Free to try,NetTalk
1729,Manage your bulk E-mail campaigns.,Windows,Free to try,Thunder Mailer
1730,Create and edit your computer's personality and chat with it.,Mac,Free to try,iChatbox
1731,Send and receive SMS to/from Pakistan.,Windows,Free,SMSDAAK Messenger
1732,Block spam and pick up useful E-mail from your inbox.,Windows,Free,Spamcc
1733,"Scan, view, compose, and e-mail multi-page TIFF and PDF files using drag-and-drop flexibility.",Windows,Free to try,Documax
1734,"Send, receive, and manage your email.",Windows,Free to try,Courier Email
1735,Send SMS messages without connecting to the Internet.,Windows,Free to try,ADC - Bulk SMS
1736,Send and receive SMS messages from your computer.,Windows,Free,RoutoMessaging Desktop Sender
1737,Protect your Outlook inbox from spam.,Windows,Free,E-mail Redemption for Outlook
1738,"Make your Android device a convenient, cost-effective RSA SecurID authenticator.",Android,Free,RSA SecurID Software Token
1739,Check and manage your e-mail before you download it.,Windows,Free to try,Casper Spam Hunter
1740,Get a complete PBX in software.,Mac,Free,Asterisk
1741,Exhange messages with your colleagues and neighbors,Windows,Free to try,Flashdeli
1742,Usb Tethering is a simple application that shares Internet connection from your smartphone to your computer through usb connection.,Android,Free,USB Tethering
1743,Verify single or multiple email addresses.,Mac,Free to try,eMail Verifier
1744,"Communicate instantly, chat in real time, and share media, all with complete privacy.",Android,Free,Signal Private Messenger
1745,Filter spam automatically while running Eudora.,Windows,Free to try,Antispam/MAX for Eudora
1746,Design robots for remote controlling in Yahoo Messenger.,Windows,Free,RoYa
1747,"Backup, re-install, and share your MSN Winks, Dynamic Pictures, and Dynamic Backgrounds.",Windows,Free to try,MSN Backup
1748,Send instant messages over Wi-Fi without a server or Internet connection.,Mac,Free to try,Softros LAN Messenger
1749,Monitor your serial ports.,Windows,Free,COMM Utility
1750,Chat with new people and make friends with people in your area.,Android,Free,MeetMe
1751,"ALL IN ONE APP. Below are the main features. + STICKER MAKER: Create any sticker whatever you can think of using text, images, emoticons...",Android,Free,Stickers For Whatsapp & Facebook
1752,Add a virtual webcam and apply cool effects to your video chats.,Windows,Free to try,ShineCam Pro
1753,The Xfinity WiFi Hotspots app for Android is available exclusively for Xfinity Internet customers and contains WiFi security features to improve...,Android,Free,Xfinity WiFi Hotspots
1754,Use a customizable chat server.,Windows,Free,Dragon Chat
1755,Chat online and share files using a full-featured IRC client. ,Windows,Free,X-Chat 2
1756,Play Sudoku on your iPhone or iPod Touch.,Webware,Free,Enjoy Sudoku
1757,Deploy SIP registrar and proxy for IP phones.,Windows,Free to try,TekSIP
1758,Check multiple Gmail accounts for new mail and display notifications.,Windows,Free to try,Gmail Notifier Pro Portable
1759,shows WAN/LAN IP address in the menu bar,Mac,Free,BwanaDik
1760,Automate your response to many types of e-mail.  ,Windows,Free,Virdi Advanced Mail Processor
1761,"Find, upload, and share photos online.",Webware,Free,Picasa Web Albums
1762,Broadcast live video from a Webcam onto your Web pages.,Windows,Free to try,Web Page Broadcaster
1763,Get SMS messages and e-mails about Craiglist's new posted items on your cellphone.,Windows,Free to try,CL Buddy
1764,Link to a host with the Telnet or SSH-2 protocol and emulate a VT220 terminal.,Windows,Free to try,Mocha Telnet for Vista
1765,Open and recover corrupted DBX files.,Windows,Free to try,DBX Open File Tool
1766,"Acquire, extract and decrypt WhatsApp communication history.",Windows,Free to try,Elcomsoft eXplorer for WhatsApp
1767,Return all email addresses found on the adverts.,Windows,Free,CraigsCrawl
1768,Send and receive fax from single computer or network.,Windows,Free to try,32bit Internet Fax
1769,Manage and process mailing lists automatically.,Windows,Free,Dra&Drop E-mail List Manager
1770,Maintain your own e-mail lists and send personalized messages.,Windows,Free to try,GMail2
1771,Chat on Windows and Android platforms with encryption and message history.,Windows,Free to try,Bopup Communication Server
1772,Backup and restore your e-mail messages from an IMAP server.,Windows,Free,Symphony IMAP Backup
1773,Deliver live video with your AOL Instant Messages.,Windows,Free to try,PVS (Personal Video Server)
1774,Identify and remove invalid e-mail addresses.,Windows,Free to try,Live Email Verifier
1775,"Protect your mail from spam, virus, and worms.",Windows,Free to try,MailCarrier Mail Server
1776,Turn your Windows machine into a VOIP service system.,Windows,Free to try,mini SIP Server (100 clients)
1777,Coming to Google Play Store for the First Time. Fuzz is worlds first Gay Men Video Chat and Live Streaming Network.,Android,Free,Fuzz - Gay live stream entertainment
1778,Get connected to various IM networks.,Windows,Free,Instan-t Messenger
1779,Send SMS to mobile network via SMTP Mail Server.,Windows,Free to try,StarLink Suite x86
1780,"Send HTML/HTM/MHTML, image, e-mail, or TXT files to multiple e-mail address.",Windows,Free to try,eMailer
