,Description,Platform,Price,Product
4533,"Simple email client for your Android: Supports Mail. Ru, Hotmail, Gmail and more.",Android,Free,Mail.Ru - Email App
4534,auto set Yahoo! Messenger status to current iTunes song,Mac,Free,YahooTunes
4535,Install a set of filters to protect your mail server from spam.,Windows,Free to try,CleanMail Home
4536,Mobile number tracker / locator app is working through Phone GPS to track phone or device current location and address.Phone tracker can identify.,Android,Free,Find Mobile Number Location: Mobile Number Tracker
4537,"Record snapshots from your IP camera, upload to Web site, and make timelapse video.",Windows,Free to try,IPTimelapse
4538,Provide support for group chat on your Linux system.,Linux,Free,SparkWeb for Linux
4539,Install a set of filters to protect your mail server from spam.,Windows,Free to try,CleanMail Home
4540,Protect your organization's sensitive information in e-mails.,Windows,Free to try,SSNProtector
4541,Search and view current flight information.,Webware,Free,Travelocity for iPhone
4542,Connect Facebook & Messenger easily.,Android,Free,Lite for Facebook & Messenger
4543,Create your personalized WebUpdate projects and update them automatically.,Windows,Free to try,Webupdate Builder
4544,Manage subscriber lists and send bulk HTML e-mails.,Windows,Free to try,HTeMaiLer
4545,Protect your corporate e-mail network.,Windows,Free to try,Mail-SeCure
4546,Use various Facebook functions without starting up your browser.,Windows,Free,ReMo Messenger
4547,Convert vCard files to different formats.,Windows,Free to try,Turgs vCard Wizard
4548,"Cash Chat is a Worldwide Social media App that has embedded financial services in the Chat as the extra additions for easy accessibility, flexibil...",Android,Free,CASH CHAT
4549,Stay in touch with your students and their parents via the Internet.,Webware,Free,Online Room for Educators
4550,View info about incoming phone calls and block unwanted ones.,Windows,Free,PhoneMondo
4551,Open your email messages in plain text format.,Windows,Free to try,PocketKnife Peek
4552,"Wi-Fi PCAP Capture is a utility for capturing raw 802.11 frames (Monitor mode, or sometimes referred to as Promiscuous mode).",Android,Free,Wi-Fi PCAP Capture
4553,Customize Outlook views and Outlook forms with any .NET controls.,Windows,$199.00,Add-in Express Regions for Outlook and VSTO Standard
4554,Chat with your friends on tens of thousands of Minecraft servers.,Android,Free,PickaxeChat for Minecraft
4555,find easiest and quick way to reach destination from GPS route finder.,Android,Free,GPS Route Address Finder
4556,Upgrade your system with ENUM Server.,Windows,Free to try,TekENUM
4557,Boost the popularity of your Web sites by adding live chat functionality.,Windows,Free to try,123 Flash Chat Server
4558,converts phone numbers on the Web to hyperlinks,Windows,Free,BlackPhone Desktop
4559,Monitor your food intake and achieve your desired weight.,Webware,Free,Mindful
4560,Make simultaneous phone calls and stay connected with your people.,Windows,Free to try,Auto Dialer Standard (5 Lines)
4561,"Create, access, and edit SharePoint contents.",Windows,Free to try,Colligo Contributor Client (32-Bit)
4562,Available now + 290 Stickers for WhatsApp about Supernatural series.,Android,Free,Supernatural Stickers for WhatsApp
4563,"Import Multiple MBOX, EML, Maildir files to Mozilla Thunderbird.",Windows,Free to try,SysTools Thunderbird Import Wizard
4564,Be a responsible driver and stay connected by reading your email messages to you as they are received.,iOS,Free,TXT'nDrive Lite for iPhone
4565,Add a live chat room to Dolphin.,Windows,Purchase,123 Flash Chat Module for Dolphin/Boonex 
4566,Calculate and display BMI value.,Webware,Free,BMI Calculator
4567,PLEASE NOTE: This app requires a premium TorGuard VPN account from torguard.,Android,Free,TorGuard VPN
4568,Host VoIP phone system server for Windows working on SIP protocol.,Windows,Free to try,Billion PBX
4569,Get a mobile marketing application.,Windows,Free to try,Textatize
4570,The stickers Snoopy WAStickerApps for Whats-App have finally arrived. offers you the best experience to feel the real sense of Snoopy stickers.,Android,Free,Cute Snoopy Stickers For Whatsapp
4571,"Telegraph Messenger is an UNOFFICIAL messaging app that uses Telegram's API and add new features like real multi account system, download manager ...",Android,Free,Telegraph Messenger
4572,Convert EML files to other formats.,Windows,Free to try,Turgs EML Wizard
4573,Call hundreds or thousands of telephone numbers.,Windows,Free to try,GroupDialer Basic
4574,Stop receiving unwanted calls.,Android,Free,Call Blocker Lite
4575,"Play a 'Rock, Paper, Scissors' game.",Webware,Free,TheMacBox  Roshambo
4576,"Generate reports on the cell phone usage.
",Windows,Free,EmailCellUsage
4577,Play a puzzle game on your iPhone.,Webware,Free,PIGS A POP'N
4578,Decrease the size of Outlook storage file by saving e-mail attachments and replacing them with links.,Windows,Free to try,Attachment Save for Outlook 2010 (64-bit)
4579,Punch the smileys on your screen.,Webware,Free,Attack of the Evil Smileys
4580,Record and transcribe Skype voice calls in 40 languages.,Windows,Free to try,Eleven
4581,VSP menjadikan telefon pintar sebagai mata dan telinga pihak polis.,Android,Free,VSP
4582,Access a portal for Los Angeles Lakers basketball fans.,Webware,Free,iLakers
4583,Get real phone numbers with cheap local and international calls - Enjoy 1-week Free trail.,Android,Free,Numero eSIM
4584,script to assign a message to each person,Mac,Free,AIM Multiple Away Messages
4585,Allow you to communicate with people from around the world. ,Windows,$2.49,IRC Explorer for Windows 8
4586,OBD diagnostic scanner to read and reset trouble codes/errors. Uses ELM adapter.,Android,Free,Obd Arny - OBD2 | ELM327 simple car scan tool
4587,Advance chat-on App with Updated Features Based on Telegram's open source API.,Android,Free,Q Messenger [   |   ]
4588,"Tag, find, view, and share email and attachments in SharePoint.",Windows,Free to try,Colligo Email Manager (64-Bit)
4589,Protect privacy of your e-mail by encrypting mail boxes and address books.,Windows,Free to try,e-Capsule Private Mail HD
4590,Access a portal for Los Angeles Lakers basketball fans.,Webware,Free,iLakers
4591,Avaya Equinox integrates your Android device with your office Avaya Aura communications environment and delivers mobile voice & video VoIP...,Android,Free,Avaya Equinox
4592,Synchronize all Microsoft Outlook items on multiple PCs.,Windows,Free to try,SimpleSYN Business
4593,Talk to your computer and send emails.,Windows,Free to try,Noisy Emailer
4594,200+ Whatsapp Stickers with Tom and Jerry.,Android,Free,Tom and Jerry Stickers for WhatsApp
4595,"Post directly to Twitter from Safari, including the current URL.",Mac,Free,Safari140
4596,"Airtime Sharing app offers the best callings rates to all mobile phones in Africa - for example Zimbabwe (12c/min), Zambia and Malawi (19c/min) an...",Android,Free,Airtime Sharing
4597,"TalonView offers integrated technology, efficiency, interactivity and realtime actionable data, all delivered at the time of need.",Android,Free,TalonView
4598,Love funny memes. Then this one is for you.,Android,Free,Dank Memes Stickers For WhatsApp
4599,Send messages via email and view all your conversations on a single Web page.,Webware,Free,9cays
4600,Communicate with your friend via chat and transfer files.,Windows,Free,Sipear
4601,Handcent SMS Skin (iOS7)iOS7 style skin for new Handcent SMS 5.0. Install it and apply it from handcent services->skin->active*** App2SD ***This...,Android,Free,Handcent 5 Skin iOS7
4602,Send SMS from your Desktop at low cost rates.,Windows,Free,SMS Boogie
4603,Set icons to Gmail address book by drag and drop from browsers/Explorer/Finder.,Mac,Free,Photo Drag
4604,Check your Outlook e-mails and be warned if you forget to add attachments.,Windows,Free to try,Onlooker
4605,Download mail from POP3 server and deliver to recipients on Microsoft Exchange.,Windows,Free to try,MAPILab POP3 Connector
4606,NetShare + is a lite version of NetShare but the main difference is that NetShare + work on rooted devices to support devices not supported in...,Android,Free,NetShare+  -- Wifi repeater from NetShare
4607,Export the complete data from the Access database to Excel spreadsheet.,Windows,Free to try,SysTools Access to Excel Converter
4608,Send quick e-mails.,Windows,Free,QuickMail
4609,NetShare + is a lite version of NetShare but the main difference is that NetShare + work on rooted devices to support devices not supported in...,Android,Free,NetShare+  -- Wifi repeater from NetShare
4610,Export the complete data from the Access database to Excel spreadsheet.,Windows,Free to try,SysTools Access to Excel Converter
4611,"Dialer+ is a smart, beautiful and free dialer app.",Android,Free,Dialer +
4612,Send personalized e-mails to multiple recipients.,Windows,Free to try,Bulk Email Sender
4613,Make video calls and chat with your friends easily.,Android,Free,ChatGame
4614,Free offline Hindi shayari collection,Android,Free,71000+ Hindi Shayari Dukan
4615,Perform company researches and background checks.,Webware,Free,Kelzen Employer Check
4616,Secure messenger: Confidentiality of business and personal communication.,Android,Free,Secure messenger SafeUM
4617,"Manage contacts, messages, calendar, and file system of your mobile phone.",Linux,Free,"Gammu for openSUSE, Fedora, Mandriva, and CentOS"
4618,Helper app that lets you view the archive of text messages collected by The Missing Sync series of applications.,Mac,Free,SMS Log
4619,Convert your online Backupify emails to Outlook mail format.,Windows,Free to try,Backupify Converter
4620,Discover the awesome opportunity of receiving Breaking News,Android,Free,LibanCall
4621,search the Internet for anything from any app,Mac,$9.95,Search Monkey Pro
4622,Take control over both your incoming and outgoing emails.,Windows,Free to try,QuickFile
4623,Find and remove Outlook contact duplicates.,Windows,Free to try,Outlook Duplicate Contact Remover
4624,Convert Outlook PST -emails to MBOX files in batch with or without folder hierarchy.,Windows,Free to try,SysTools Outlook to MBOX
4625,Save and convert your email messages to many formats.,Windows,Free to try,MessageExtract 
4626,Calendar photo frame 2019.,Android,Free,Calendar Photo Frame 2019
4627,Private 2 way videochat between web and mobile clients.,Android,Free,2Way VideoChat - private rooms
4628,Export important mails and convert them to messages.,Windows,Free to try,MailExporter Desktop
4629,"Start business chat with video call, documents sharing, and schedule integrated. ",Windows,Free,Chat&Messenger
4630,Project v2ray: https://www.v2ray.com.,Android,Free,v2rayNG
4631,Read and compose your emails without a browser.,Mac,Free,Mia for Gmail
4632,Find and remove Outlook contact duplicates.,Windows,Free to try,Outlook Duplicate Contact Remover
4633,Convert your online Backupify emails to Outlook mail format.,Windows,Free to try,Backupify Converter
4634,"Send text, image, voice messages, and files from your Windows 8 device.",Windows,Free,Global Chat for Windows 8
4635,Koch morse trainer pro is the ultimate way to learn morse code on android.,Android,$3.13,Koch Morse Trainer Pro
4636,"Unblock any site with XXNXX VPN BROWSER 100% unlimited, the fastest VPN and provide a new experience for surfing the internet.",Android,Free,XXNXX - VPN Browser
4637,AntiPhone - try the new Anonymous SMS beta app from the Founders of Anonymous Chat Rooms app.,Android,Free,AntiPhone - Free Anonymous SMS
4638,"Set up home security and surveillance system, manipulate your webcam.",iOS,Free,Willing Webcam
4639,"Chat with ICQ, AIM, MSN, Jabber, Yahoo, and IRC messengers.",Windows,Free,Miranda NG Portable
4640,Wifi Free Connection Everywhere with you free wi-fi connect internet enables any android smart phone to search for open WiFi network wi fi the...,Android,Free,Free WiFi Connect Internet Connection Find Hotspot
4641,Download Yahoo backup and convert to more than 10 popular file formats.,Windows,Free to try,Advik Yahoo Backup
4642,"Export all the items of NSF files into EML, PDF, or MSG file formats.",Windows,Free to try,SysTools NSF Converter
4643,Get a P2P Web cam reciever tool.,Windows,Free,Mermaid Webcam Reciever XP64BitSP2
4644,Provision PnV2 is the leading application for all PnV cameras by Provision-ISR.,Android,Free,PnV2
4645,Now you can send your favorite Fortnite Stickers to your friends via WhatsApp Messenger.,Android,Free,WAStickerApps For Fortnite - Stickers For WhatsApp
4646,Save specified Outlook e-mails as text files at once.,Windows,Free to try,Outlook Download Multiple Emails To Text Files Software
4647,Outlook 98 security update,Windows,Free,Microsoft Outlook 98 Update: E-mail Security
4648,Organize your email by keeping related emails together.,Windows,Free to try,Incoming Mail Organizer for Outlook 2007/Outlook 2010 (32-bit) 
4649,"Control and display data from MQTT enabled devices and apps (IoT, Smart Home).",Android,Free,MQTT Dash
4650,"Does not work with GBWhatsapp, Whatsapp Plus or any unofficial apps.",Android,Free,Meme Stickers for WhatsApp
4651,"All Famous Basketball Lgendd Meme Stickers have finally arrived on WhatsApp, Strikr Againnn....",Android,Free,NBAidol Meme Troll Sticker for Whatsapp
4652,Open and read the Disk Image files.,Windows,Free to try,SysTools Disk Image Viewer
4653,Convert Mac Outlook OLM files to PST format.,Windows,Free to try,DataHelp OLM to PST Wizard
4654,"Split large PST files by size, folder, and year.",Windows,Free to try,Split PST Pro
4655,Enhance productivity of Microsoft Outlook and its integration with other applications.,Windows,Free to try,CW Tools for Outlook
4656,View news feeds on your iPhone.,Webware,Free,NewsGator Mobile
4657,Send e-mail via secure encrypted channel.,Windows,Free,Shazzle Mail Client
4658,Get an email client and news reader on your Linux system.,Linux,Free,Claws Mail for Linux
4659,Create and control video surveillance systems.,Windows,Free,VideoNet 9 Prime Server
4660,The wonderful collections of Malayalam stickers...,Android,Free,Malayalam Stickers for Whatsapp (WAStickerApps )
4661,Add a video chat to your website.,Windows,Free,123 Cam Show
4662,Play a mind sharpening game on your iPhone.,Webware,Free,MindDojo
4663,True Phone has arrived to replace your stock dialer & contacts app and bring your dialing experience to the next level. It's the only one dialer...,Android,Free,True Phone Dialer & Contacts
4664,Mobile Secure FTP Client which is based on Putty SFTP library.,Android,Free,Mobile SFTP(Secure FTP Client)
4665,"Manage all your accounts in PLDT, Smart, TnT, and Sun with myPLDT Smart your one-stop app. Monitor your data-usage in real-time, check your...",Android,Free,myPLDT Smart
4666,Convert USB Webcam to online monitoring software with Alerts.,Windows,Free to try,AlertWebcam
4667,Convert IncrediMail e-mail data to different formats.,Windows,Free to try,BitRecover Incredimail Converter Wizard
4668,Get a webcam application. ,Mac,$10.00,SimpleWebCam
4669,Donald Trump stickers for WhatsApp is a WAStickerApps app that offers 3 sticker packs of various Donald Trump faces & memes.,Android,Free,Funny Trump Stickers for WhatsApp - WAStickerApps
4670,"MoreCard is designed to use with matching BLE gadget, to enable Single SIM card mobile to be Dual SIM Dual Standby, for phone call and SMS...",Android,Free,MoreCard
4671,Manny Anonymous Stranger Chat is purely Gay chat application where you can easily talk with any other gay person or any other 3rd gender.,Android,Free,MANNY - Anonymous Stranger Gay Chat
4672,"Convert NSF mails, calendar, and contacts from Lotus Notes to Google apps.",Windows,Free to try,Express Migrator for Google Apps
4673,"The app""Easy English to Urdu translator and dictionary allows you to translate from any Urdu word to English and any English word to Urdu.",Android,Free,Easy English Urdu Translation App Free Download
4674,Convert Outlook PST Files to different files format.,Windows,Free to try,GainTools PST Converter
4675,"Talk via Bluetooth with whoever you want, with no charge!",Android,Free,Walkietooth
4676,Synchronize all Microsoft Outlook items on multiple PCs.,Windows,Free to try,SimpleSYN Business (64-Bit)
4677,Show True ID Caller name app is the most accurate mobile number locator and very easy to use caller ID Location tracker app which can help you...,Android,Free,True ID Caller Name Address Location Tracker
4678,"Recover lost Outlook Express e-mails from raw drives, disks, or storage media.",Windows,Free,DataNumen Outlook Express Drive Recovery
4679,Communicate and share with other users on IRC networks around the world.,Windows,Free,Spectral IRC
4680,Change the status of Skype whenever you want.,Windows,Free,Skype Status Changer
4681,Search for property information in US.,Webware,Free,HouseFront
4682,Place the peg at the correct position.,Webware,Free,MasterMind
4683,Nepal television is the first tv channel of nepal.,Android,Free,NTV LIVE TV
4684,Establish an automated response system with Google Voice.,Windows,Free,GVAutoResponder
4685,Convert NSF files to PST format and migrate Lotus Notes to Outlook.,Windows,Free to try,eSoftTools NSF to PST Converter
4686,IX Mobile is an Aiphone IX Sub Master Station for your smartphone or tablet.,Android,Free,IX Mobile
4687,Send multiple E-mails with unlimited number of recipients.,Windows,Free to try,Mass Mail Sender PRO
4688,Send screenshots & attachments via e-mail with drag & drop simplicity in a tiny 100KB mail client.,Windows,Free,Yascu Mail
4689,Send SMS messages from your PC with a GSM modem.,Windows,Free,Fast SMS Send
4690,Delete attachments from EML files in the specified folder. ,Windows,Free,Remove Attachments from EML for Outlook
4691,Manage your calls directly from Outlook.,Windows,Free to try,Asterlook
4692,Check Outlook emails for certain conditions before sending them automatically.,Windows,Free to try,Outgoing Email Checker for Outlook
4693,Reduce e-mail volume and leave more time for important tasks.,Windows,Free to try,Postware
4694,"Repair corrupt database and analyze data from SQL Server MDF, NDF, and LDF.",Windows,Free to try,SysTools SQL Server Recovery Manager
4695,Add fun to your chats with funny politician stickers. The number of stickers will grow by time.,Android,Free,Politician Stickers for Whatsapp - WAStickerApps
4696,Import PST to Gmail to access Microsoft Outlook e-mails in Gmail account.,Windows,Free to try,Advik PST to Gmail Import
4697,Block viruses and spam messages from accessing your server.,Windows,Free to try,MailSite Collaborator SE
4698,Welcome to Amharic keyboard Ethiopic -  Amharic keyboard is built on the latest technologies to help you write in Latin and Geez scripts.,Android,Free,Amharic Keyboard - Ethiopic Amharic Keyboard
4699,Watch your pet online even from cell phone.,Windows,Free to try,Rogo
4700,"Enjoy news, messages, tweets and comments; delivered to your screen as a beautifully rendered up-to-the-second display of social content. ",Mac,$3.99,Spout
4701,Convert Novell Mailboxes into Microsoft Outlook PST file.,Windows,Free to try,SysTools Export GroupWise
4702,"Synchronize your appointments, tasks and contacts in Microsoft Outlook with MailEnable.",Windows,Free,MailEnable Synchronization for Microsoft Outlook
4703,Access your business e-mail account from anywhere.,Webware,Free to try,MailQuatro
4704,"Secure, fast, free, multi-touch vnc client for windows, linux, mac with ssh.",Android,$4.49,bVNC Pro: Secure VNC Viewer
4705,"Ease the process of working with GSM engines.
",Windows,Free,4Engine
4706,Import EML and MSG files into 64bit MS Outlook easily.,Windows,Free to try,outlookFiller64
4707,Make Outlook connect to groupware IMAP servers just like Exchange.,Windows,Free to try,Bynari Outlook iCal Connector 64-bit
4708,Access your business e-mail account from anywhere.,Webware,Free to try,MailQuatro
4709,"Synchronize your appointments, tasks and contacts in Microsoft Outlook with MailEnable.",Windows,Free,MailEnable Synchronization for Microsoft Outlook
4710,"Stay in sync with friends when meeting up, see where they are in real time, send group messages.",iOS,Free,FlockThere
4711,Search for MAPI stores through win32 MAPI API's. ,Windows,Free,MAPIViewer (32-Bit)
4712,"Create your most common phrases and sort them by categories.
",iOS,Free,Phraseboard - messaging made easy
4713,"Cut-n-paste images using Gmail, Hotmail, or Yahoo accounts.",Windows,Free,Ideal Email
4714,Manage your digital life on the go.,iOS,Free,Gusto for iOS
4715,Create subscription forms and maintain subscription messages.,Windows,Free,Subscription Manager - Free Version
4716,Get an extendable multiple protocol instant messaging system.,Linux,Free,Kopete for Linux
4717,Add standard branding onto your companies' e-mails.,Windows,Free to try,HypeMail
4718,"Turn your home device, PC, smartphone, or tablet into security camera.",Windows,Free,Home Eye
4719,Exchange secure and stealthy peer-to-peer instant messages.,Windows,Free to try,Private Messenger
4720,"View, print, and export Outlook messages without outlook.",Windows,Free to try,Revel reView 2012
4721,Fill in the correct from address based on the current mailbox.,Windows,Free to try,RightFrom for Microsoft Outlook 2010
4722,"Virtual Card is an innovative, mobile application for creating, storing, and sharing virtual business cards, as well as scanning traditional...",Android,Free,Vcard
4723,"Synchronize your Outlook mails, contacts, appointments, tasks, notes, and journal entries with different databases.",Windows,Free to try,Outlook Sync Db (32 bit)
4724,Receive tray alerts on new mail dropped to your Gmail accounts.,Windows,Free,Spiffy Portable
4725,Repair corrupt Outlook PST files.,Windows,Free to try,PST Repair Kit
4726,Get an e-mail client for your Linux system.,Linux,Free,Sylpheed for Linux
4727,Convert MSG to PST to combine multiple MSG files into single Outlook PST file.,Windows,Free to try,Zook MSG to PST Converter
4728,Communicate via Google Hangouts on your Windows device.,Windows,$2.99,GMessenger
4729,Get an e-mail client for your Linux system.,Linux,Free,Sylpheed for Linux
4730,Pack individual email files into mbox files.,Windows,Free to try,mboxPack
4731,"Create, present, and respond to polls. Use in conjunction with desktop apps.",Android,Free,Poll Everywhere
4732,Convert OST and PST files to different formats.,Windows,Free to try,Softaken Complete Converter for OST to PST
4733,E-mail whenever you want and wherever you are without wasting your time,Windows,Free,Mail It
4734,"Open, read, and view OST files.",Windows,Free to try,MailsDaddy Free OST Viewer
4735,"Explore a modular VOIP PBX with voicemail, VPN, firewall, address book, and fax.",Webware,Free,NBLADE
4736,"We offer magnum 4D, toto, DAMACAI 4D JAGUAR lottery record.",Android,Free,4D jaguar
4737,Enhance your website with an enterprise-grade live chat.,Windows,Free to try,Comm100 Live Chat Visitor Monitor
4738,Allow management of both JMS and Tibco Rendezvous messages.,Windows,Free,Opensphere Message Detector (64-bit)
4739,Send personalized HTML and text e-mail from a Delphi application.,Windows,Free to try,MarshallSoft Client Mailer for Delphi
4740,Play an assortment of puzzle games.,Webware,Free,iFifteen
4741,Improve Outlook performance by splitting very large PST files.,Windows,Free to try,Kernel for PST Split
4742,Olafone is a SIP-based Soft Phone for Android Mobile to make VoIP Calls.,Android,Free,Olafone Itel
4743,Write notes and send messages to other computer user.,Windows,Free,KNot
4744,Make cheap calls to national or international destinations.,Android,Free,Jamisi Caller
4745,Convert Outlook e-mails to PDF format.,Windows,Free to try,SysVare Outlook to PDF Converter
4746,Extract and export e-mail address from Microsoft Outlook mail client software.,Windows,Free to try,Outlook Email List BackUp
4747,Send bulk MMS and SMS via PC.,Windows,Free to try,SMS Deliverer Ultimate
4748,Send your email with added security.,Windows,Free to try,The Bat Voyager
4749,"Extract e-mail addresses from MBOX files to CSV, vCard format by From, To, Cc and E-mail body.",Windows,Free to try,MBOX Email Address Extractor Wizard
4750,Rule your Wi-Fi.,Android,Free,Wi-Fi Ruler (a WiFi Manager)
4751,Fill out start and destination of German Train Stations.,Webware,Free,Ask Deutsche Bahn for Timetable Information
4752,Antivirus for Android Tablet Security PRO version with advanced features and facilities for the perfect operation of your Tablet and Web...,Android,$9.99,AntiVirus Tablet
4753,Export OST data into Outlook PST format.,Windows,Free,QuickMigrations for OST to PST
4754,Create and maintain e-mail marketing campaigns.,Windows,Free to try,Mailman Max
4755,Play a card game on your iPhone.,Webware,Free,Solitaire
4756,ProCaller - Robo Call Blocker & SMS Blocker -Block Unwanted Calls and block SMS.,Android,Free,ProCaller - Robo Call Blocker and SMS Blocker
4757,Stay up-to date with your emails all the time.,Windows,Free,Ultimate Email Checker (64-Bit)
4758,"Scan, recover and export all items of an Outlook PST into PDF format.",Windows,Free to try,SysTools Outlook PST to PDF Converter
4759,enable desktop/ web based apps for 2-way SMS,Windows,$99.00,mCore
4760,Chat and share files with friends in a rich chatting environment.,Windows,Free to try,Lilypad Chat
4761,Offers VoIP Calls from mobile phones to any landline or mobile devices.,Android,Free,Play Talk
4762,Connect Outlook with your favorite cloud services.,Windows,Free,Yasoon
4763,Command-line tool for yEnc & UU binary download & decoding.,Mac,Free,newslite
4764,Prevent bot and spam attacks with our superior CAPTCHA solution.,Windows,Free,NuCaptcha Basic
