,Description,Platform,Price,Product
3043,Introduction. Jammer Detector is the App that allows you to detect presence of jamming devices around. In that situation your mobile phone loses...,Android,Free,Jammer Detector
3044,Verify e-mail accounts automatically.,Windows,Free to try,Email Confirmer
3045,iPhoto plugin for uploading to Kodak gallery,Mac,Free,KODAK Gallery Upload Plug-in
3046,Back up E-mails and settings in Mozilla Thunderbird.,Windows,Free,Backup Thunderbird
3047,"Scan, search, find and extract e-mail addresses from a selected directory.",Windows,Free,FastExtractor
3048,Make new friends by using video chatting.,Android,Free,Freygo-Video Chat
3049,Scan and discover networks and find security flaws.,Android,Free,Net Scan
3050,Ham radio software transceiver.,Mac,Free to try,HamSphere
3051,"Log in to numerous accounts within multiple IM networks concomitantly from a single application.

",Linux,Free,Pidgin for Linux
3052,"Transfer Android SMS to Mac for backup and later restore, manage SMS on Mac.",Mac,Free to try,Apolsoft Android SMS Transfer (Mac)
3053,Send free SMS and call for long distance from your Windows 8 device.,Windows,Free,Free Talk for Windows 8
3054,"Caller Name Announcer Pro, the top caller name announcer for incoming messages and calls for your Android phone.",Android,Free,Caller Name Announcer Pro
3055,Find and remove duplicate e-mails in Microsoft Outlook.,Windows,Free to try,Kernel for Outlook Duplicates
3056,"Archive your e-mails, files, and calendar entries.",Windows,Free to try,GFI Archiver
3057,Provide an instant messaging (IM) service that lets you chat with your colleagues using your. official ID.,Windows,Free,Pingpong
3058,Extract emails from web pages given a start URL.,Windows,Free to try,Email Plucker
3059,"Connect via dial-up with IPv6 for Windows XP, Vista and Win7.",Windows,Free to try,cFos IPv6 Link
3060,"extract email addresses from files, mail & web sites",Mac,$25.00,eMail Ripper
3061,Create and share your flashcards.,Webware,Free,iFlipr
3062,"Filter email, trace and report spam, works with virtually every email product.",Mac,Free to try,Purify
3063,Detach email attachments and save them.,Windows,Free to try,emlDetach 
3064,Set up a bot for your IRC channel.,Windows,Free,Cop13 IRC Bot
3065,Internet Relay Chat client,Windows,Free,Visual IRC
3066,Save your emails and attachments into PDF.,Windows,Free to try,Save As PDF for Outlook 2013 (64-bit)
3067,Create Microsoft Outlook reports and extract e-mail addresses.,Windows,Free to try,Topalt Reports for Outlook
3068,Record digital live video from your webcamera up to 30 fps.,Windows,Free to try,Efficient Motion Control Studio
3069,Monitor every e-mail that leaves your company.,Windows,Free to try,Silent BCC for Microsoft Outlook
3070,Create and send personalized mass e-mail messages for your successful marketing campaigns.,Windows,Free to try,ezMailer
3071,"2ndLine is a second US or Canada phone number that works on your smartphone, tablets as a full-featured business phone system, designed for...",Android,Free,2ndLine - Second Phone Number
3072,"Read and use the email with ease.

",Windows,Free to try,Agent by Forte
3073,"With the new BOSS Revolution App, you can make cheap and free international calls, chat with unlimited free text messages when using Wi-Fi or...",Android,Free,BOSS Revolution - Cheap Calls
3074,Remove blocks as many as you can to score more points.,Webware,Free,Collapsing Blocks
3075,Replace the connection request timeout in Safari with a different value.,Mac,Free,SafariNoTimeout
3076,"Make free calls, free text, share funny stickers, and secret chat.",iOS,Free,RingID
3077,Call over WiFi or 3G/4G to US/Canada at ultra low-cost international calling.,Android,Free,NetTalk App
3078,Split large PST file into multiple smaller parts.,Windows,Free to try,SysInfoTools PST Split
3079,Manage Outlook e-mail attachments access.,Windows,Free to try,Outlook Attachment Security Administrator
3080,View and/or change passwords for your email accounts.,Windows,Free to try,PASSyourself
3081,Play a dice game.,Webware,Free,Let It Roll
3082,Send SMS directly from the PC.,Windows,Free,DesktopSMS
3083,Call your friends using ISDN adapters or the Internet connection for VoIP.,Windows,Free,Phoner Portable
3084,Provide a voice chat service with games.,Windows,Free,LIvVE4u Client
3085,Gmail client for the menu bar.,Mac,Free,Mailbox
3086,"Send bulk and personalized e-mail, SMS, and fax to unlimited group of recipients.",Windows,Free to try,Email Director .NET (32-bit)
3087,Convert MBOX files to PST format.,Windows,Free to try,MailsDaddy MBOX to PST Converter
3088,Establish multiple instant messaging conversations in a single window on your Microsoft Lync.,Windows,Free,Tabbed Conversations for Microsoft Lync 2010
3089,"Delete, copy, move multiple Outlook folders in Outlook or to another computer.",Windows,Free to try,Folder Master for Outlook
3090,Host group video conferences over the Internet or LAN.,Windows,Free to try,VideoPort VCS
3091,Detect outbound e-mails when including attachments and revise the e-mail before being sent.,Windows,Free,Missing Attachment PowerToy
3092,Send emoticons and images with a single tap to your WhatsApp contacts.,Android,Free,Smileys Whats App
3093,Record MSN webcam video and audio into AVI.,Windows,Free to try,Camersoft MSN Webcam Recorder
3094,"XIQ Mobile CMS is a surveillance software, which support live video stream, video record and playback, video remote playback, snapshots and PTZ...",Android,Free,XIQ Mobile CMS - XIQCMS
3095,View soccer game results and information.,Webware,Free,German Soccer Results
3096,Encrypt and decrypt e-mail attachments within Microsoft Outlook automatically.,Windows,Free,OutlookCrypto
3097,Turn Sony PlayStation Eye camera into a slow motion Webcam for your PC.,Windows,Free to try,ProAm
3098,Manage and organize your customers' e-mail addresses and send e-mail messages.,Windows,Free to try,YL Mail Man
3099,Backup the contacts & text messages on your phone to your computer.,Mac,Free,Syncfony
3100,"Interact with new people over text-chat, webcam and mic.",Windows,Free,Chatroulette
3101,Turn your phone / tablet in a free hotspot tethering.,Android,$2.90,WiFi Tether Router
3102,Use your computer for Internet telephony.,Windows,Free,PhonerLite Beta
3103,Enjoy two-way communications from the Web to any mobile phone and back.,Webware,Free,Joopz
3104,"Convert OST files to PST, EML, MSG, MBOX formats.",Windows,Free to try,Ignissta OST Converter
3105,Find a best name for your WhatsApp group.,Android,Free,Whatsapp Group Names
3106,This Application Advice you for success face to face live video calling.,Android,Free,Free Girls Cam Live Girls Chat & Showing tip
3107,"Connect, Communicate, and coordinate with people you care about.",Windows,Free,Mail and Calendar
3108,Extract valid e-mail addresses from virtually any kind of text file.,Mac,Free to try,eMail Address Extractor
3109,Recall e-mails sent by mistake.,Windows,Free to try,WinDeveloper Message Recall
3110,Advanced softphone with video.,Mac,Free to try,iSoftPhone Pro
3111,Translate Skype chat messages from English and French to Bulgarian or vice versa.,Windows,Free to try,SkypeTrance
3112,Control your Lego Mindstorms NXT robot from your phone via Bluetooth.,Android,Free,NXT Remote Control
3113,Call Free is a free wifi calling app with free call & free text & call identification.,Android,Free,Call Free - Free Call
3114,Back up your e-mail messages at online storage.,Windows,Free,VOSI.biz Email Backup
3115,Identify active and inactive e-mail addresses on your mail list.,Windows,Free to try,Send-Safe Email Verifier
3116,Add live chat room with video to Web sites.,Linux,Free to try,123 Flash Chat Software (Linux)
3117,Play a puzzle game.,Webware,Free,MetaSquares
3118,Make phone calls from within a webpage.,Windows,Free,Doddle WebPhone
3119,"message priorities, coloring & read receipts for Mail",Mac,Free,MailPriority
3120,Connect to AOL instant messenger easily.,Windows,Free,AimCC
3121,Internet phone with clear voice quality,Mac,Free,Megafon
3122,Play Socoban game on your iPhone.,Webware,Free,ipSokoban
3123,Chat with your friends with your favorite IRC server.,Windows,Free,MetroIRC
3124,Synchronize your avatar on iChat.,Mac,Free,iChartwork
3125,Import messages from EML format to the specified Outlook folder.,Windows,Free,Import EML to Outlook
3126,This is an application that allows you to quickly start and enable your portable Wi-Fi hotspot and your data mobile (3G/4G).,Android,$0.99,Hotspot 4G
3127,Send and receive SMS messages using a modem.,Windows,Free,GXSMS (64-bit)
3128,Connect with your friends by clicking on their picture.,Android,Free,Contacts Dialer
3129,Open and view MSG files.,Windows,Free,Softaken Free MSG Viewer
3130,"Caller ID, text and email spoofing service.",Mac,Free,SPOOFEM Desktop Application
3131,"Apply rules to messages that have been in your inbox for a given number of hours, days, or weeks.",Windows,Free to try,Auto-Mate Add-in for Outlook
3132,"This is the official Application provided by Newroz 4G, and with this application you can manage your subscription and enjoy high internet service...",Android,Free,Newroz 4G LTE
3133,Remove old messages from your exchange server.,Windows,Free,Mailremover
3134,Send email of PDF with dynamic watermark from Excel.,Windows,Free to try,A-PDF Mailer
3135,Synchronize objects and Free/Busy data between multiple Exchange organizations,Windows,Free to try,GALsync
3136,Get a P2P Web cam receiver tool.,Windows,Free,Mermaid Webcam Reciever Vista32Bit
3137,"Bring the functionality of your SPA IP Phone to your desktop, click to dial, search phone number.",Windows,Free to try,Call Ctrl
3138,Cisco Network Setup Assistant is used to connect devices securely to networks utilizing Cisco Identity Services Engine.,Android,Free,Cisco Network Setup Assistant
3139,Split large PST files into smaller files.,Windows,Free to try,SysInfoTools PST Split (64-Bit)
3140,Recover your lost or deleted emails.,Windows,Free to try,Advanced Eudora Recovery
3141,Repair corrupted Outlook PST files.,Windows,Free to try,Outlook Repair Kit
3142,Make your calls and messages secure and private.,Android,Free,"CoverMe Private Texting, Calls"
3143,Create a MSN Messenger group with various functions.,Windows,Free to try,TeamMSN Enterprise
3144,Schedule your sending of e-mail in advance.,Mac,Free to try,Mail Scheduler
3145,View detailed US weather information and maps.,Webware,Free,Wx
3146,View predictions of Nostradamus on your iPhone or iPod Touch.,Webware,Free,Nostradamus: The Centuries
3147,Organizer and archiver for Apple's Mail.,Mac,Free to try,MailWing
3148,"Export yahoo e-mails to EML, PST, MSG or MBOX format with attachments.",Windows,Free to try,SysTools Yahoo Backup
3149,Zip and send files via e-mail and create distribution list.,Windows,Free to try,ZnS
3150,Task-oriented e-mail client.,Mac,$14.99,Mail Pilot
3151,Shoot and share fun messages with Instagram users faster than ever before.,Android,Free,Direct from Instagram
3152,"Chat from anywhere and never miss a message.

",Webware,Free,IRCCloud
3153,Create e-mail appliance for your real or virtual gateway to protect your e-mails from threats.,Windows,Free to try,SpamTitan
3154,Get the latest firmware for IP Video phone series.,Windows,Free,IP Video Phone-VP-2009P
3155,"Forward, relay, or divert your SMS.",Android,Free,SMS Bounce
3156,client for the Microsoft Exchange system,Mac,Purchase,Microsoft Outlook 2001
3157,Create a live cam network that includes cross platform live flash streaming.,Webware,Free,LiveCyberCash Video Chat
3158,Put markers on Google Map and show current location or places of interest on the fly.,Webware,Free,Tap & Go
3159,Schedule conference calls and and share information using Office Communicator 2007 R2 with your PC.,Windows,Free to try,Microsoft Office Live Meeting Addin for Outlook
3160,"Monitor, detect motion, record 1-64 cameras.",Windows,Free to try,SpiffCam
3161,SysInfo Outlook PST Recovery Software to Repair Outlook PST files,Windows,Free to try,SysInfoTools PST Recovery
3162,Verify and clean up your mailing lists.,Windows,Free to try,YL Mail Verifier
3163,Provide cost-effective Web-based e-mail and calendaring capabilities to your entire organization.,Webware,Free to try,IBM LotusLive iNotes
3164,Remove extraneous characters from forwarded e-mails or other documents that need cleaning.,Windows,Free to try,Text Monkey Pro
3165,Transfer files to your device using Wi-Fi and your web browser.,Android,Free,WebSharingLite File/Media Sync
3166,Synchronize your Microsoft Office Outlook contacts with your co-workers.,Windows,Free to try,TeamContacts
3167,Big Belly Cat.,iOS,$0.99,Animated Funny Fat Cat Sticker
3168,Big Belly Cat.,iOS,$0.99,Animated Funny Fat Cat Sticker
3169,"Organize Outlook e-mails, rename, export, and import Outlook categories.",Windows,Free to try,Category Manager
3170,Print many Gmail messages to the printer.,Windows,Free to try,Gmail Print Multiple Emails Software
3171,Check your list of e-mails and block unwanted e-mails.,Windows,Free,Oceantiger Mail
3172,Organize and perform all your e-mail communications right from your browser.,Windows,Free,NetZero Message Center
3173,Experience your own ghost box without having to pay big money to own one.,Android,Free,Paranormal Live Ghost Box
3174,Deliver real time customer support through love chat.,iOS,Free,Live2 Support Chat Application
3175,Send e-mails quickly from your desktop.,Windows,Free,Universal Emailer
3176,"Organize and manage your e-mails, tasks, and appointments.",Windows,Free,ClearContext Personal
3177,Make phone calls from your PC.,Windows,Free,Yap Softphone
3178,Develop your own SIP based VoIP Server for IP telephony and call-centers.,Windows,Free to try,VaxTele SIP Server SDK
3179,Allow you to group messages in threads in exactly the same way as online gmail.,Windows,$7.99,GMail Connect for Windows 8
3180,Connect Windows PCs to IBM iSeries AS/400 via TN5250 terminal emulator.,Windows,Free to try,Hosaka TN5250
3181,Filter out your email. ,Windows,Free to try,Purify
3182,Send free SMS worldwide.,Webware,Free,Free Text Online
3183,"Change ""No"" to a ""Yes"".",iOS,$0.99,Yes No Reverse Stickers
3184,Check your Google mail from your desktop environment easily.,Windows,Free,MyGoogleMail
3185,Split and merge Outlook PST file on your windows machine.,Windows,Free to try,PST Magic 
3186,Bookmark manager for browsers & rich Safari features,Mac,Purchase,Safari XTra
3187,Send text messages to cell phones with your Gmail account.,Windows,Free to try,Gmail Send Text Messages To Multiple Recipients Software
3188,Free messages and more.,Android,Free,LINE Lite: Free Calls & Messages
3189,Outlook 2000 security update,Windows,Free,Microsoft Outlook 2000 Collaboration Data Objects (CDO)
3190,"Test new functions, features, extensions, and other applications before they are officially made available.",Android,Free,Chrome Dev
3191,Share your WiFi and receive free connectivity.,Webware,Free,FON
3192,View live cricket series scores on your iPhone.,Webware,Free,Cricket score for iPhone
3193,Speak out the contact name of the callers and the senders of the incoming messages.,Android,$2.99,Tell2Me Speak SMS and Calls
3194,Take care of a monkey virtually.,Webware,Free,Virtual Monkey
3195,Send free messages worldwide.,Windows,Free,SMS Sender
3196,Solve Ahwar messenger issues.,Windows,Free,Ahwar VPN
3197,set up an anonymous network,Mac,Purchase,Quidam
3198,Capture MPEG online video from your Web camera up to 30 fps.,Windows,Free to try,Optimal Webcam Record Pack
3199,Chat with your friends and see how many users are currently logged on.,Windows,Free,Mjewchat Chat Software
3200,Improve sales and support with ease.,Windows,$599.00,123 Live Help
3201,Add live chat rooms for phpBB forums in order to boost traffic as well as revenue to your Web site.,Windows,$299.00,123 Flash Chat Module for phpBB
3202,Send free text messages in the US.,Mac,Free,Free SMS US
3203,This is the official Sony application for SmartWatch 2 SW2.,Android,Free,SmartWatch 2 SW2
3204,Send e-mails via any SMTP server while using MS Exchange.,Windows,Free to try,ChooseFromOWA for MS Exchange 2003
3205,Send large emails by splitting them up over several attachments.,Windows,Free to try,Splitmailer
3206,Display a name tag on your iPhone.,Webware,Free,Name Tag for iPhone
3207,Compress content and send Web pages to final users.,Windows,Free to try,SmartIIS Compress Content
3208,Capture still images from a webcam.,Windows,Free to try,OK-Cam
3209,Cccess various stickers for love and sexy chatting.,iOS,$0.99,Adult Emojis - Flirty Emoji Stickers
3210,Fongo World Edition is the best way to Call Canada and the World.,Android,$4.99,Fongo World Edition
3211,Improve reconstruction of mail database files.,Mac,Free,Apple Mail Server Update
3212,"The internet, less than an arm's length away.",Android,Free,Web Browser for Wear OS (Android Wear)
3213,"Kiwi Browser is made to read news, watch cricket videos, movie trailers, listen to music, without annoyances.",Android,Free,Kiwi Browser - Fast & Quiet
3214,Filter spam and manage your e-mails.,Windows,Free to try,AntispamServant plugin for The Bat
3215,Communicate with your friends with voice and text.,Windows,Free,VoiceChatAlpha
3216,Access the Hotmail mobile website by Microsoft.,Android,Free,Hot Email
3217,Get instant messaging buddies on your Android device.,Android,$9.97,BeejiveIM
3218,Chat through Internet or LAN.,Windows,Free,NetCommunicator
3219,Islamic stickers is Wastickers for whatsapp.,Android,Free,Islamic Sticker For Whatsapp 2019  
3220,The app will allow users to make low cost high quality calls to all destinations,Android,Free,Digicel Call International
3221,Archive your IM messages on Dexrex.com.,Windows,Free,Dexrex IM Backup
3222,Find your perfect date on the go.,Android,Free,FastMeet
3223,Make cheap international VoIP phone calls.,Windows,Free,DialTrixPhone
3224,Set up 13 add-ins to enhance the work of Microsoft Outlook.,Windows,Free,Turbo Add-in Package for Outlook
3225,Operate your robotic webcam from anywhere on your Android device.,Android,Free,And Rovio Lite
3226,Send SMS messages for free.,Windows,Free,Way2SMS
3227,Convert Outlook PST files to common e-mail file types and messages.,Windows,Free to try,BitRecover PST Converter Wizard
3228,Check multiple e-mail addresses safely and securely,Windows,Free to try,Pooka [XC]
3229,Send instant messages to other Kangun.com members.,Windows,Free,Kangun Instant Messenger
3230,Manage e-mail lists and gather statistics in real time.,Webware,Free to try,1-2-All Email Marketing Software
3231,spam/virus protection & content filtering,Windows,Purchase,MailFender for Exchange
3232,Get eGreetings with medieval Georgian enamel images.,Windows,Free to try,Medieval Georgian Enamels - eGreetings
3233,Improve and measure the efficiency of your DNSBL servers.,Windows,Free,BL-Monitor
3234,"Take, print, e-mail, and synchronize notes.",Windows,Free,ResophNotes Portable
3235,Restore and backups corrupted Outlook Express DBX files.,Windows,Free to try,DBX Backup
3236,Add and share WhatsApp statuses.,Android,Free,WhtsappStatus
3237,Create and share virtual sticky notes through the Web or with your mobile phone.,Webware,Free,Socialight
3238,Convert many Gmail e-mails into PDF format.,Windows,Free to try,Gmail Export To Multiple PDF Files Software
3239,Vodi is the only financial app with a mission to give back to our users.,Android,Free,Vodi
3240,Look for nearby wifi hotspots and connect to open one automatically.,Android,Free,Free WiFi Connect
3241,Mailing list software with dynamic content customization.,Mac,Free to try,RoboPostman
3242,Record all your phone conversations.,Windows,Free to try,TRx Phone Recorder
3243,Send messages with official college emojis & stickers for your team.,Android,Free,College Stickers & Emojis 2017
3244,Reach new contacts and keep existing clients.,Windows,Free to try,MailQueen Pro for Windows
3245,Check any POP3 email account without using up large amounts of system resources.,Windows,Free,MWB POP3 Notifier
3246,Set your default e-mail to popular Web-based services.,Windows,Free to try,"Change Default Email To Gmail, Yahoo! Mail, Windows Live Hotmail or AOL Mail Software"
3247,Convert MS Exchange OST databases into PST files for Microsoft Outlook.,Windows,Free to try,OST2PST Kit
3248,Perform content analysis of received e-mail messages and use automatic responder.,Windows,Free to try,InteliEmail
3249,Send business emails to all your customers,Windows,$98.00,GmailTrain
3250,"Fast, stable IRC client.",Mac,Free,LimeChat
3251,Organize and manage e-mail messages and folders.,Windows,Free to try,Explorer for Windows Mail
3252,Analyse mail server logs and learn how much traffic is being used by e-mail.,Windows,Free to try,Mail Access Monitor for SendMail
3253,Perform wireless and direct push synchronization with Microsoft Exchange Server on your Android device.,Android,$19.99,RoadSync
3254,Type in Gurmukhi on your iOS device.,iOS,Free,Gurmukhi Keyboard Punjabi Language
3255,"Certain websites may be blocked in your country for cultural, religious, or political reasons.",Android,Free,Unblock VPN Browser
3256,Send text messages to locations.,Webware,Free,Wiffiti
3257,Setup and manage e-mail marketing campaigns.,Windows,Free to try,Best Bulk Email Software Pro
3258,Translate your outgoing conversations on Skype.,Linux,Free,Clownfish for Skype (Debian and Ubuntu-64bit)
3259,Track your Web site visitors in real time and invite them for chat online.,Windows,Free to try,Live Chat
3260,Compose and send SMS text messages from your Mac.,Mac,Free to try,Luscious SMS
3261,Set icons to Gmail address book by drag and drop from browsers or explorer or finder.,Windows,Free,Photo Drag
3262,Monitor your Gmail account with this notifier.,Windows,Free to try,MultiG
3263,Send your personalized emails at high-speed.,Windows,Free,RapidSMTP
3264,This is free Android SSH app which is based on OpenSSH and Putty as its backend library.,Android,Free,Mobile SSH (Secure Shell)
3265,Send your personalized emails at high-speed.,Windows,Free,RapidSMTP
3266,Exchange instant messages using simple intetrface with several third-party services support.,Windows,Free,Citron Messenger
3267,Turn on your WiFi hotspot with one click.,Android,Free,WiFi-Sharing
3268,Connect to online video chat room communities from your Windows PC.,Windows,Free,Wempey
3269,Extract email addresses from PST files.,Windows,Free,E-Mail ID Farmer
3270,Recover lost passwords for Outlook PST files.,Windows,Free to try,SysTools PST Password Remover
3271,Send instant messages over Wi-Fi without a server or Internet connection.,Android,Free,Softros LAN Messenger
3272,"Classify, filter, and delete spam or junk e-mails.",Windows,Free,K9F9 Spam Filter
3273,View Emails from Large MBOX Files of Google Takeout and Thunderbird.,Windows,Free,BitRecover MBOX Viewer
3274,Avoid unproductive calls and make low rate calls from your Skype.,Windows,Free to try,Ecsow Dialer for Skype
3275,Get enhanced Web access to Microsoft Exchange.,Windows,Free to try,cbConnect
3276,"Synchronize calendar events between Microsoft Exchange, Lotus Notes and, Google Calendar.",Windows,Free,Kaliro Calendar Sync
3277,"Receive calls, exchange IMs, send and receive voice mails, and trace your contacts' presence status.",Windows,Free,ITooLabs Communicator
3278,"Share your experience, strength, and hope to strangers from your Windows 8 device.",Windows,Free,Talk to Someone for Windows 8
3279,Send a copy of your SMS text messages automatically to any email.,Android,$1.99,TxtForward - SMS to Email
3280,"Sync calendar, contacts, and tasks between Outlook and CalDAV/CardDAV server.",Windows,Free to try,SurGate Outlook DAV Client
3281,"Manage your emails, calendars, and contacts and sync with Gmail, Outlook.com or any other service.",Mac,Free,eM Client
3282,Create and receive video e-mail messages.,Webware,Free,Eyejot
3283,Export messages from specified Outlook folders to EML format.,Windows,Free,Export Messages to EML for Outlook
3284,Optimize file attachments for outgoing e-mails.,Windows,Free to try,MailPackIT
3285,Mobile Tracker - free mobile tracker -is a Android application that show basic mobile information.,Android,Free,Mobile Tracker - free mobile tracker
3286,Validate e-mails and clean and organize e-mail lists.,Windows,Free to try,CheckMail Desktop
3287,Use your Microsoft Windows PC as remote dialer for managing incoming and outgoing calls and for writing and receiving SMS messages.,Android,$5.40,Remote Phone Call
3288,Back up and convert Yahoo e-mails to different formats.,Windows,Free to try,Yahoo Backup Pro
3289,Get an MSN/Live Messenger compatible chat client for Linux.,Linux,Free,KMess for Ubuntu
3290,Track Outlook emails and get notified once your recipient reads your email.,Windows,Free to try,Zendio
3291,Bulk email sender for bulk email marketing & campaign,Windows,Free to try,Email Sender
3292,Manage mailboxes in multiple POP3 accounts.,Windows,Free to try,EF Mailbox Manager
3293,Connect to Exchange server via interactive user interface with rapid identification of all controls.,Windows,Free,POP3conneX
3294,Punch the bouncing snacks to clear them on your screen.,Webware,Free,Snack Attack!
3295,Force VOLTE and 4G on 3G/2G network.,Android,Free,4G Switcher
3296,"Detect, and track any Yahoo Messenger's ID.",Windows,Free to try,IM Robo
3297,Print many Outlook.com Hotmail email messages without opening each one.,Windows,Free to try,Outlook.com Hotmail Print Multiple Emails Software
