,Description,Platform,Price,Product
0,Clean and fix the registry of your computer and optimize its speed and performance.,Windows,Free,Glary Utilities
1,Keep your PC running smoothly with simple and advanced tools for all level of users.,Windows,Free,CCleaner
2,Uninstall and remove unwanted programs and software easily,Windows,Free,Revo Uninstaller
3,"Move, resize, copy, explore, and recover hard disk drive partitions.",Windows,Free,MiniTool Partition Wizard Free Edition
4,Access various information about your computer.,Windows,Free,CPU-Z
5,Monitor network activity and block potential threats with a powerful firewall.,Windows,Free,GlassWire
6,Save your eyes by making your display's brightness adapt to the time of day.,Windows,Free,f.lux
7,"Take full control over RAR and ZIP archives, along with unpacking a dozen other archive formats.",Windows,Free to try,WinRAR (64-bit)
8,Put your PC through one of the most comprehensive hardware and sofware benchmarks available.,Windows,Free,3DMark Basic Edition
9,Take screenshots of a selected area.,Windows,Free,LightShot
10,Archive files in different formats and manage them.,Windows,Free,7-Zip
11,Scan your hard drive or local devices for detailed disk usage statistics.,Windows,Free,WinDirStat
12,"Update device drivers, improve system compatibility, and boost gaming performance with one click. ",Windows,Free,Driver Booster
13,Install the latest operating system from Microsoft.,Windows,$119.00,Windows 10
14,Uninstall apps from your Mac and clean all their left-over files safely.,Mac,Free,AppCleaner
15,"Archive or extract a plethora of modern or old compression formats, like ZIP, TAR, SIT, RAR, and 7-Zip.",Mac,Free,The Unarchiver
16,Snap windows into position by dragging them to the edges and corners of your screen.,Mac,$0.99,Magnet
17,Use an iOS device as a second display for your machine using a Lightning or 30-pin cable.,Mac,Free,Duet Display
18,Preserve your data and the operating system's data impeccably on a bootable volume.,Mac,Free to try,Carbon Copy Cloner
19,Adapt your computer monitor colors to the time current time of the day.,Mac,Free,f.lux
20,"Keep your Mac, and optionally its display, awake while you need it to be.",Mac,Free,Amphetamine
21,"Create strong, unique passwords for all your accounts and login with a click.",Mac,Free,1Password
22,"Powerful general purpose text editor, and Unix and server administrator's tool.",Mac,Free,TextWrangler
23,Install Windows using Intel devices.,Mac,Free,Apple Boot Camp Support Software
24,Use abbreviations for frequently-used text strings and images.,Mac,Free to try,TextExpander
25,Convert brief clips from your video files into GIFs.,Mac,$4.99,GIF Brewery
26,"Open apps, files, and URLs via abbreviation.",Mac,Free to try,LaunchBar
27,"Monitor your computer, from memory usage to Bluetooth status.",Mac,Free to try,iStat Menus
28,Do more with the services you love and bring them together to create new experiences.,iOS,Free,IFTTT
29,"Locate your missing iOS device on a map, remotely lock it, even erase all the data on it to prevent data theft.",iOS,Free,Find My iPhone
30,Use your iPad or iPhone as an extra display to expand your Mac or PC's desktop.,iOS,$14.99,Duet Display
31,"Keep all your passwords and sensitive information in one place, securely.",iOS,Free,1Password - Password Manager and Secure Wallet
32,Sign documents anywhere or get anyone's signature with your iOS device.,iOS,Free,SignNow - Sign and Fill PDF & Word Documents
33,Control all your smart home accessories from all your Apple devices.,iOS,Free,Home app
34,Add an additional layer of security to the process of signing into your account.,iOS,Free,Google Authenticator
35,"Create forecasts for your precise location, giving you minute-by-minute predictions for next day and week.",iOS,$3.99,Dark Sky Weather
36,Create an expressive cartoon avatar and be yourself wherever you go.,iOS,Free,Bitmoji - Your Personal Emoji
37,Turn your iPhone into a digital scanner.,iOS,Free,QR Reader for iPhone
38,"Find quick answers, explore your interests, and get a feed of updates on what matters to you.",iOS,Free,Google - Search made just for mobile
39,Gboard is a new keyboard from Google for your iPhone.,iOS,Free,Gboard -- a new keyboard from Google
40,"Locate your phone, tablet, or watch, then lock it, erase, or show a message.",Android,Free,Google Find My Device
41,Do more with the services you love and bring them together to create new experiences.,Android,Free,IFTTT
42,"Manage your passwords, fill your forms, and store your data safely in the cloud.",Android,Free to try,LastPass Password Manager
43,See what apps are slowing your phone's Internet connection or wasting your mobile data.,Android,Free,GlassWire Data Usage Security
44,"Approve a purchase, close a sale, or sign an agreement with a legally-binding digital signature.",Android,Free,DocuSign
45,"Set up, manage, and control your Chromecast, Chromecast Audio and Google Home devices.",Android,Free,Google Home
46,"Transfer files, access contacts and messages, and remote control your android device wirelessly.",Android,Free,AirDroid
47,Type faster and more effectively with a keyboard program that learns your writing style.,Android,Free,SwiftKey Keyboard
48,Upgrade the launcher on your device to make Google Now one swipe away.,Android,Free,Google Now Launcher
49,"Generate strong, unique passwords for every site and login with a tap.",Android,Free,1Password - Password Manager and Secure Wallet
50,"Measure length, angle, distance, height, direction and sound with your device.",Android,$2.99,Smart Tools
51,Manage your hard drive partitions and improve their performance.,Windows,Free,EaseUS Partition Master Free Edition
52,Install the next Windows OS after Microsoft Vista.,Windows,$149.99,Windows 7 (Professional)
53,"Create screenshots of a selected region, window, or fullscreen, with annotations or highlighting.",Windows,Free,GreenShot
54,Show a PC audit in your browser with details on hardware and software.,Windows,Free,Belarc Advisor
55,Create a copy of your Windows ISO file on removable media.,Windows,Free,Windows USB/DVD Download Tool
56,Keep your Windows 7 PC on the latest support level.,Windows,Free,Microsoft Windows 7 Service Pack 1
57,Run more than one operating system at the same time on one computer.,Windows,Free,Windows Virtual PC (64-bit)
58,Service pack for Microsoft Windows XP.,Windows,Free,Microsoft Windows XP Service Pack 3 
59,Access any Web site privately and securely.,Android,Free,TunnelBear VPN
60,Type faster by sliding your finger from letter to letter.,Android,Free,Gboard - the Google Keyboard
61,Scan your installed programs and categorize them by their security update status.,Windows,Free,Secunia Personal Software Inspector
62,Protect your online privacy and secure your computer by cleaning unnecessary info.,Mac,Free,CCleaner
63,"Rediscover your best photos, shop faster and conveniently online, and even Siri makes its debut on the latest OS update for Mac.",Mac,Free,Apple MacOS Sierra
64,Play and stream Android games and apps on PC.,Windows,Free,BlueStacks App Player
65,"Download, update, back up, or restore Windows drivers and boost overall PC productivity.",Windows,Free,DriverMax
66,Emulate a physical CD/DVD drive virtually.,Windows,Free,Virtual CloneDrive
67,Find and fix incorrect or obsolete information in the Windows registry.,Windows,Free,Wise Registry Cleaner
68,Extract files from your RAR-archives with a support for spanned archives.,Windows,Free,Free RAR Extract Frog
69,Defragment your disks and improve computer performance and stability.,Windows,Free,Auslogics Disk Defrag
70,Clean and optimize your PC.,Windows,Free to try,TuneUp Utilities 2019
71,"Back up and restore photos, music, videos, documents, hard disk, and partitions.",Windows,Free,EaseUS Todo Backup Free
72,"Expand over 30 formats: StuffIt, Zip, RAR, 7z, tar, open encrypted segmented or split files easily.",Mac,Free,StuffIt Expander
73,Get the latest updates for Office 2010 and enhance your document management system.,Windows,Free,Microsoft Office 2010 Service Pack 2 (32-Bit)
74,Optimize your system performance and realize advanced hardware monitoring and diagnostics.,Windows,Free to try,Everest Ultimate Edition
75,Create a copy of your Windows ISO file on removable media.,Windows,Free,Windows USB/DVD Download Tool
76,"Boost your Windows system speed, boot time, application speeds, extend storage drive life.",Windows,Free to try,Diskeeper Professional
77,"Speed up, maintain, and protect your PC.",Windows,Free to try,Glary Utilities Pro
78,Protect your entire family's digital life.,Windows,Free to try,Norton Security Premium
79,Compress large files to share them online.,Windows,Free to try,StuffIt Deluxe x64
80,"Back up, restore, sync, and clone data.",Windows,Free,AOMEI Backupper Standard
81,Display information about programs and processes running on your computer.,Windows,Free to try,Security Task Manager
82,Back up and synchronize your important files automatically.,Windows,Free to try,GoodSync
83,Back up and restore your Windows system.,Windows,Free,Paragon Backup & Recovery Free 16 (64-bit)
84,Use joystick for playing Web games and controlling applications.,Windows,Free to try,JoyToKey
85,Synchronize your Windows Mobile-based device with a Windows powered desktop PC.,Windows,Free,Microsoft ActiveSync
86,Remove obsolete entries from your system registry.,Windows,Free,TweakNow RegCleaner
87,Optimize your Windows settings and improve overall system performance.,Windows,Free,WinUtilities Free Edition
88,Find and delete unwanted files on your hard disk.,Windows,Free to try,CleanCenter
89,Root your android device in one click.,Windows,Free,Kingo Android Root
90,Get an unlimited online backup for your computer.,Windows,Free to try,FullDataBackup
91,Update your mobile device to the latest version of the Android operating system.,Android,Free,Android 6.0 Marshmallow
92,"Emulate CD, DVD, BD and HDD drives.",Windows,Free to try,Daemon Tools Pro
93,Optimize your PC for smoother and more responsive gameing experience.,Windows,Free,Razer Cortex
94,Extract multiple archives with the ease of a single button.,Windows,Free,ExtractNow
95,"Benchmark, test, analyze and diagnose your computer or a remote network computer.",Windows,Free to try,SiSoftware Sandra
96,View over 150 file types on your Windows PC.,Windows,Free,File Viewer Lite
97,Find and remove true duplicate files from your PC or network.,Windows,Free to try,DupeRazor - Duplicate Files Removal Kit
98,"Juggle PC operations and fully exploit the system potential with all-in-one maintenance toolkit.
",Windows,Free to try,Advanced SystemCare Pro
99,Clean up registry to speed up your PC.,Windows,Free,Auslogics Registry Cleaner
100,Expand RAR archives on your Mac.,Mac,Free,RAR Expander
101,Choose from 10 Windows auto optimization profiles.,Windows,Free to try,Cacheman
102,Automate keyboard and mouse actions.,Windows,Free,Ghost Mouse
103,"Recover deleted files, perform unformatted recovery, and corrupt drive recovery.",Windows,Free to try,Recover My Files
104,Keep your Windows 7 PC on the latest support level.,Windows,Free,Microsoft Windows 7 Service Pack 1
105,Optimize memory and manage computer's cache.,Windows,Free to try,MemTurbo
106,Root your Android phone with a simple application.,Windows,Free,SuperOneClick
107,Clean up your system and optimize PC performance.,Windows,Free to try,Advanced System Optimizer
108,Prevent your PC from locking or going to sleep.,Windows,Free,Caffeine
109,View HDD information and monitor disk temperature.,Windows,Free,CrystalDiskInfo
110,Recover lost or damaged files.,Windows,Free,PC Inspector File Recovery
111,"Manage mobile phone from PC via Wi-Fi, Bluetooth, or cable.",Windows,Free to try,MobilEdit
112,"Add Chinese, Japanese, and Korean language support to many Windows applications.",Windows,Free to try,AsianSuite X2
113,"Load Web pages, run diverse Web applications, search, navigate, and customize in a snap.",Windows,Free,Google Chrome Portable
114,Fix PC issues and improve system performance.,Windows,Free to try,Auslogics BoostSpeed
115,Split and join multiple files.,Windows,Free,HJ-Split
116,Free yourself from repetitive mouse click work and automate the clicks at specified intervals.,Windows,Free,Free Mouse Auto Clicker
117,Upgrade your Mac to Mac OS X Snow Leopard.,Mac,Free,Apple Mac OS X Snow Leopard
118,Install the latest operating system from Microsoft.,Windows,$119.00,Windows 10
119,Copy and backup hard disks and partitions.,Windows,$59.90,EaseUS Disk Copy
120,"Compress, encrypt, and extract ZIP, ZIPX, 7ZIP, CAB, TAR, ISO, RAR, PA, and other formats.",Windows,Free to try,PowerArchiver 2021
121,Recover any deleted or lost partition on your PC.,Windows,Free,EaseUS Partition Recovery
122,"Manage the link between your BlackBerry smartphone and your email, calendar, and organizer.",Windows,Free,BlackBerry Desktop Manager
123,Optimize system registry and speed up your PC.,Windows,Free,Auslogics Registry Defrag
124,Speed up opening of your RAR archives.,Windows,Free,RAR File Open Knife - Free Opener
125,"View, sort, find, edit, back up, and add anything to your Palm OS handheld.",Windows,Free,Palm Desktop
126,Recover lost files or data from your storage media.,Windows,Free to try,IsoBuster
127,Restore files which are deleted from the Recycle Bin by mistake.,Windows,Free,Restoration
128,desktop operating system,Windows,$119.99,Microsoft Windows XP Home Edition
129,Destroy completely hard drive data or data stored on any other type of device.,Windows,Free to try,Active@ KillDisk
130,Use your Android device from a web browser or desktop computer.,Windows,Free,Mobizen PC
131,Back up and restore everything and actively defend against ransomware.,Windows,Free to try,Acronis True Image
132,Remove unwanted software without leftovers.,Windows,Free to try,Ashampoo UnInstaller 10
133,"Customize the logon screen in Windows 7, Windows 8, and Windows 10.",Windows,Free,Tweaks.com Logon Changer
134,Handle RAR and ZIP files using a German interface.,Windows,Free to try,WinRAR German
135,Extract or decompress all sorts of RAR files.,Windows,Free,RarZilla Free Unrar
136,Compress and decompress archive files.,Windows,Free,ZipGenius Standard Edition
137,Find and remove duplicate files from your PC.,Windows,Free,Auslogics Duplicate File Finder
138,Recover lost data from FAT or NTFS file systems.,Windows,Free to try,GetDataBack
139,Create virtual drives that contain the information on your CDs.,Windows,Free to try,Virtual CD
140,"Recover deleted files, documents, images, and e-mails from any storage media.",Windows,Free,Wise Data Recovery
141,Scan your system for report on existing software and hardware.,Windows,Free,Fresh Diagnose
142,Synchronize the data between your Nokia device and computer.,Windows,Free,Nokia Suite
143,"Optimize, speed up, and clean your Windows computer.",Windows,Free to try,Ace Utilities
144,Synchronize the data between your Nokia device and computer.,Windows,Free,Nokia Suite
145,Recover lost data from FAT or NTFS file systems.,Windows,Free to try,GetDataBack
146,The latest version of the Android mobile operating system following Android 4.4 KitKat,Android,Free,Android 5.0 Lollipop
147,Scan your system for report on existing software and hardware.,Windows,Free,Fresh Diagnose
148,Run and develop applications targeting .NET Framework.,Windows,Free,Microsoft .NET Framework
149,"Experience instant Web browsing, applications, and secured data management on your computer.",Linux,Free,Google Chrome OS
150,"Optimize, speed up, and clean your Windows computer.",Windows,Free to try,Ace Utilities
151,Recover files and folders deleted accidentally or lost due to disk corruption.,Windows,Free to try,File Scavenger Data Recovery Utility
152,"Clean, fix, and restore your system registry.",Windows,Free,Eusing Free Registry Cleaner
153,Put your PC through one of the most comprehensive hardware and sofware benchmarks available.,Windows,Free,3DMark Basic Edition
154,Schedule your computer to shut down or log off at a specified time.,Windows,Free,Switch Off
155,"Share files with your friends or across your devices, and enjoy various media content online.",Android,Free,SHAREit - Transfer & Share
156,"Save, adjust, send, and print screen captures with flexible streamlined image management tool.",Windows,Free,Gadwin PrintScreen
157,"Restore accidentally deleted FAT12, FAT16, FAT32, and NTFS files.",Windows,Free,Data Recovery
158,Select and defrag files on your hard disk.,Windows,Free,Defraggler
159,Find and remove duplicate files from your PC.,Windows,Free to try,Duplicate File Finder
160,Archive and unpack files on your 64-bit OS.,Windows,Free,7-Zip (64-bit)
161,Activate Urdu language support and install necessary Urdu Fonts.,Windows,Free,Pak Urdu Installer
162,Change the names of multiple files at once.,Windows,Free,File Renamer Basic
163,Run multiple operating systems concurrently on a single PC.,Windows,Free to try,VMware Workstation Pro
164,"Protect your Android against the latest viruses, malwares, system vulnerabilities and privacy leaks.",Android,Free,"360 Security - Free Antivirus, Booster, Cleaner"
165,Get the power of WinZip without going through the graphical user interface.,Windows,Free,WinZip Command Line Support Add-On (32-bit)
166,Get diagnostic information about your system and network.,Windows,Free,AIDA32
167,Recover permanently deleted files from hard disks and removable media.,Windows,Free to try,Recover Files
168,Scan your Registry for possible problems and fix them.,Windows,Free to try,Free Registry Fix
169,Open Mac disks and dmg files from a Windows PC.,Windows,Free to try,TransMac
170,Run benchmarking tests of your computer to see if your PC is performing at its best.,Windows,Free to try,PerformanceTest
171,Package your files and get them where you want them to go easily and securely.,Mac,Free to try,StuffIt
172,"Recover data lost to viruses, malicious attacks, hardware failures, and operating system crashes.",Windows,Free to try,R Studio Data Recovery Software
173,multimedia os,Windows,Purchase,Windows XP Media Center Edition
174,Scan and clean up your registry to improve your system's performance.,Windows,Free,Registry Repair
175,Update your Nokia device software.,Windows,Free,Nokia Software Updater
176,"Establish instantly comprehensive, permanent, real-time remote access, control, and support through secure global network.",Windows,Free,TeamViewer Portable
177,Rescue your Android phone from a mess.,Windows,Free,Mobogenie
178,Extract and create ZIP file archives.,Windows,Free,CAM UnZip
179,Clean up Windows Installer directory and free up disk space.,Windows,Free,PatchCleaner
180,Maximize performance of Windows XP.,Windows,Free,TuneXP
181,Make your Mac run faster.,Mac,Free to try,MacBooster
182,OS X Mavericks is the latest release of the world's most advanced desktop operating system.,Mac,Free,Apple Mac OS X Mavericks
183,Synchronize and backup your files with extensive options.,Windows,Free,SyncBackFree  
184,Upgrade to the most powerful edition of the latest version of Windows.,Windows,$119.99,Windows 7 (Ultimate)
185,"Create, delete, and resize partitions.",Windows,Free,Ranish Partition Manager
186,Manage start-up applications and improve your system performance.,Windows,Free,Startup Inspector for Windows
187,"Move, resize, copy, create, and recover hard disk drive partitions.",Windows,$39.00,MiniTool Partition Wizard Professional Edition
188,"Clean junk from your PC, optimize the system performance.",Windows,Free,Clean Master for PC
189,Clean your Windows Registry from orphaned entries.,Windows,Free,ToniArts EasyCleaner
190,Optimize and speedup your system performance.,Windows,Free to try,WinUtilities Professional Edition
191,"Recover files that have been accidentally deleted, erased, corrupted, or lost.",Windows,Free to try,R-Undelete
192,Optimize your PC for better performance.,Windows,Free,Asmw PC-Optimizer pro
193,"Create screenshots of a selected region, window, or fullscreen, with annotations or highlighting.",Windows,Free,GreenShot
194,Shrink PDF files by using the Flate or RunLength compression algorithm.,Windows,Free,Free PDF Compressor
195,"Copy, move, or delete data from your PC.",Windows,Free,FastCopy
196,"Unblock any Web site or app to access videos, movies, and social networks.",Android,Free,Hotspot Shield Free VPN Proxy & Wi-Fi Security
197,Keep your drivers up-to-date automatically and keep your PC running like new.,Windows,Free to try,Driver Genius
198,Show product ID of software or OS installed on your computer.,Windows,Free,ProduKey
199,Permanently delete files beyond forensic recovery and wipe free space.,Windows,Free to try,BCWipe
200,"Make automatic backups, compression, encryption, synchronization of files in background.",Windows,Free to try,Second Copy
201,"Diagnose, benchmark, and monitor hardware of your PC.",Windows,Free to try,AIDA64 Extreme
202,"Manage, view, and search files in a tabbed, dual-pane mode.",Windows,Free,Xplorer2 Lite
203,Update Windows 95 to make it Y2K compliant.,Windows,Free,Windows 95 Y2K Update
204,Scan your disk drives for any deleted files and restore them.,Windows,Free to try,File Recover
205,Manage your smartphone from Windows PC.,Windows,Free,MoboRobo
206,Get extensive information about your PC's hardware.,Windows,Free to try,System Analyser
207,"Find out what applications, processes, and files are running on your PC.",Windows,Free,What's Running
208,Back up and synchronize data on a local network or over the Internet.,Windows,Free,@Max SyncUp
209,Scan your computer for missing and outdated drivers.,Windows,Free,Drivers For Free
210,Optimize the performance of your computer and protect it.,Windows,Free to try,Super Utilities Pro
211,Create ISO image from folders or data CD/DVD.,Windows,Free to try,Free ISO Creator
212,"Find and remove duplicate images, photos, MP3s, any other files.",Windows,Free to try,Duplicate Checker
213,Find out what files consume the most disk space to reclaim some space.,Mac,Free,Disk Inventory X
214,Find any file on your computer instantly.,Windows,Free,Ava Find
215,Clean your registry and hard drive to make PC run fast.,Windows,Free,Cloud System Booster
216,Update your Mac OS X Lion for Intel-based Macs.,Mac,Free,Apple Mac OS X Lion 10.7.5 Supplemental Update
217,Back up and synchronize your files and folders.,Windows,Free,Second Backup - Free File Backup
218,Find out what files consume the most disk space to reclaim some space.,Mac,Free,Disk Inventory X
219,Find any file on your computer instantly.,Windows,Free,Ava Find
220,Gain access to hidden Windows XP settings and tune your OS to run faster.,Windows,Free to try,Tweak-XP Pro
221,Recover your system and lost data to ensure security in future.,Windows,Free,Rescue Kit Free Edition
222,Scan your computer for missing and outdated drivers.,Windows,Free,Drivers For Free
223,The latest release of the Android operating system.,Android,Free,Android 7.0 Nougat
224,"Edit and recover partitions, manage multiboot environments, and optimize disk usage.",Windows,Free to try,Acronis Disk Director Home
225,"Recover lost data from deleted files, formatted disk, lost raid.",Mac,Free to try,VirtualLab Data Recovery
226,Upgrade to the latest Windows OS customized for home entertainment.,Windows,$119.99,Windows 7 (Home Premium)
227,Remove programs without using Windows' Add/Remove control panel.,Windows,Free,Easy Uninstaller
228,"Back up files into compressed archive, or create a disk image for recovery.",Windows,Free to try,Macrium Reflect
229,Monitor and free up your memory when it falls below a certain minimum.,Windows,Free,Free Ram Optimizer XP
230,Bring back deleted pictures from any digital camera media.,Windows,Free,PC Inspector Smart Recovery
231,"Zip, unzip, share, protect files and streamline data storage with trusted enhanced compression.",Mac,Free to try,WinZip Mac
232,Configure which programs run when your computer starts.,Windows,Free,Startup Control Panel
233,Recover your Microsoft software CD Keys.,Windows,Free,Keyfinder Thing
234,"Stay within the reach with free voice/HD video calling, videoconferencing, screen sharing, and smart messaging.",Windows,Free,sPortable
235,Optimize your Windows 2000/XP/Vista performance.,Windows,Free to try,TweakNow PowerPack Professional
236,Extract ZIP archives and other compressed file formats.,Windows,Free,Quick Zip
237,"Create, extract, and manipulate ZIP, RAR, TAR, GZIP, 7-ZIP and other file archives.",Windows,Free,jZip
238,Make an exact copy of your original CD for backup purposes.,Windows,Free to try,Easy CD Clone
239,"Automate repetitive tasks by creating macros and hotkeys for your mouse, keyboard, and joystick.
",Windows,Free,AutoHotkey
240,Extract ZIP archives and other compressed file formats.,Windows,Free,Quick Zip
241,"Automate repetitive tasks by creating macros and hotkeys for your mouse, keyboard, and joystick.
",Windows,Free,AutoHotkey
242,Transform folders into connected workspace and keep team collaboration in sync with intelligent content solutions.,Mac,Free,Dropbox
243,"Zip, unzip, share, protect files and streamline data storage with trusted enhanced compression.",Mac,Free to try,WinZip Mac
244,Change the speed of your CD-ROM device.,Windows,Free to try,CD Speed
245,Scan your hard drive to quickly find and remove temporary files from your PC.,Windows,Free to try,Temp File Cleaner
246,Backup and restore to drives and removable media.,Windows,Free,TrueSafe Personal Edition
247,"Duplicate file, photo, mp3 and folder finder. Now with search by image in v2014",Windows,Free to try,Reasonable NoClone 2014
248,"Automate backup tasks, password protect and compress to save storage space. ",Windows,Free,FBackup
