,Description,Platform,Price,Product
4364,Windscribe VPN is a tool that secures Wifi and helps you safeguard your privacy online.,Android,Free,Windscribe VPN
4365,Customize your Visio tool by adding tab control.,Windows,Free to try,Office Tabs for Visio (32-bit)
4366,Automate your own online life and build bots to sell.,Windows,$245.00,UBot Studio
4367,Create a recovery CD and restore your system after crash.,Windows,Free to try,Selkie Rescue
4368,Create macros to automate your PC routine tasks.,Windows,Free to try,AutoClickExtreme
4369,Read and edit property list of files with an intuitive process.,Windows,Free,Free PList Editor
4370,"Test your hard drives, CDs, and other electronic media using forensic evidence.",Windows,Free to try,Forensic Replicator
4371,Record and replay your keyboard and mouse activities.,Windows,Free to try,Smack Macro Recorder
4372,Remove all the activity logs of USB devices from Registry.,Windows,Free,USBOblivion (32-Bit)
4373,Optimize and monitor your system's memory usage.,Windows,Free to try,Monitor and Free RAM
4374,Compare folders with PDFs and convert text files to PDF format.,Windows,Free to try,Advanced PDF Manager
4375,Get file manager for your Android device.,Android,Free,File Manager
4376,"Add the shutdown button onto the taskbar and choose from Shut down, Restart, Sleep, or Hibernate options.",Windows,Free,Shutdown8
4377,Update retail Windows 10 to build 10240.16405,Windows,Free,Windows 10 Day One Patch (64-bit) (KB 3074683)
4378,Learn how much disk space certain directories are taking up on your drive.,Windows,Free,DirSpace
4379,"Free today with App of the Day.OPlayer is also dropping price today.AirPlayer is an application for streaming video*, music*, photo* from UPnP/DLNA...",iOS,$4.99,AirPlayer - video player and network streaming app
4380,Organize the utilities from other sites or utility suits.,Windows,Free,WSCC Portable Edition
4381,Open and analyze SFV files.,Mac,Free,iSFV
4382,"Speed up your development lifecycle with an easy, accessible, and effective testing tool.",Windows,Free,Genymotion
4383,"Sticky Notes. is the ultimate application to quickly create sticky notes and reminders on your Windows Phone. It is very simple to use, small in...",Windows,Free,Sticky Notes for Windows 10
4384,"Capture screen in three ways (only a rectangle of the screen, active window, whole screen).",Windows,Free,Screen Capture
4385,Erase files and folders without the possibility of being recovered again.,Windows,Free to try,ObjectWipe
4386,Play all your videos directly without having to convert them.,iOS,Free,"OPlayer Lite - media player, video file manager"
4387,Enable or disable Windows Services.,Windows,Free,Mz Services Manager
4388,"Type common phrases instantly and automate chat conversations, website logins, and program codes.",Windows,Free,TyperTask
4389,Add live preview of opened windows to Alt-Tab screen.,Windows,Free,Alt-Tab Replacement
4390,Increase your operating system performance using a suite of specialized tools.,Windows,Free to try,WinTools.net Extra
4391,Make your PC silent when it is turning on or is waking up.,Windows,Free,Auto Mute
4392,Locate duplicate and empty files.,Windows,Free,Duplicate File Finder
4393,Recover lost data on Android devices.,Windows,Free to try,iReparo for Android
4394,Use nonstandard characters for documents and applications.,Windows,Free,Quick Key
4395,Use the iSCSI target to convert server to SAN that works over the existing Ethernet network.,Windows,Free to try,Starwind Enterprise Server
4396,Deploy virtual machines on your Linux system.,Linux,Free,VMware Player for Linux
4397,Organize files into folders based on their extensions.,Windows,Free to try,Organize Now 2005
4398,"Sync playlists, music, podcasts, and photos onto mobile devices.",Mac,Free to try,Salling Media Sync
4399,"check/adjust TFT, CRT, video monitors w/different test patterns",Mac,Free to try,MonitorTest
4400,Explore or install 64-bit PC operating system created from scratch.,Windows,Free,The LoseThos Operating System
4401,Get a shutdown tool.,Windows,Free to try,ShutDown Timer
4402,Recover deleted data from hard disk and removable media.,Windows,Free to try,FineRecovery
4403,Monitor your computer's battery or power level.,Windows,Free,Power Plug
4404,Read bar codes on your Windows machine.,Windows,Free,Barcode Labels Scanner
4405,Repair PC and Internet connection errors.,Windows,Free to try,Page Cannot Be Displayed Error Fixer
4406,Clean invalid and incorrect entries and repair Windows registry.,Windows,Free,Registry CleanUP 4
4407,"Boost mobile speed, save battery, clean junk files.",Android,Free,Fast Cleaner - Speed Booster & Cleaner
4408,Remove traces and unnecessary files on your PC.,Windows,Free,Kleaner
4409,Get all information about your device.,Android,Free,Cpu-z
4410,Take screenshots easily.,Mac,Free,InstantShot
4411,Download info and catalogue all your movies.,Windows,Free,VisualDivX
4412,Recover and fix corrupted RAR archives in just a click.,Windows,Free to try,Easy RAR Recovery
4413,Repair bad sectors (physical defects) on on floppy and hard drives.,Windows,Free to try,DRevitalize
4414,Turn your PC into a dual-trace storage oscilloscope and spectrum analyzer.,Windows,Free to try,Zelscope
4415,"Repair corrupt mac hard disk, partitions and damaged volume directory.",Mac,Free to try,Stellar Volume Repair
4416,Prevent restoration of the old files in disks.,Windows,Free,Disk Redactor
4417,Bring serial port communication to the new level.,Windows,Free to try,Advanced Serial Port Terminal
4418,Patch your MacBook Pro early 2011 model.,Mac,Free,Apple MacBook Pro Software Update
4419,Recover all multimedia type of files from any Windows system hard drive.,Windows,Free,Free Hard Drive Data Recovery
4420,"Manage Oracle, MySQL, PostgreSQL, SQLServer, Sybase, Db2, MongoDB, MariaDB, and SQLite databases.",Windows,Free to try,DtSQL Portable
4421,Speedify makes your internet secure and fast with the magic of Channel Bonding.,Android,Free,Speedify - Bonding VPN
4422,Print any available document in form of book.,Windows,Free to try,Print as Book
4423,Get the caller's Telecom location on Incoming call screen.,Android,Free,Trace Mobile Number
4424,Monitor backup activities on remote computers.,Windows,Free,Plan B
4425,Find and delete duplicate documents on your PC.,Windows,Free,Duplicate Files Searcher
4426,allow user to access your iDisk Public Folder,Windows,Free,Apple iDisk Utility
4427,"Repair, optimize & accelerate your PC.",Windows,Free to try,Total PC Care
4428,lets you select your boot partition (OS X Server),Mac,Free,Apple System Disk
4429,Mouse Distance Measurer allows you to display the distance your mouse travels all day long.,Mac,Free to try,Mouse Distance Measurer
4430,Make host to host conversions of VMWare virtual machines to Hyper-V virtual machines.,Windows,Free,5nine V2V Easy Converter Free Edition (64-bit)
4431,Enjoy the latest updates to Expression Web 4 and enhance the web design.,Windows,Free,Microsoft Expression Web 4 Service Pack 1
4432,"Simple way to quickly manage tasks and resource usage on your Mac. 
",Mac,Free,System Lens
4433,Move mouse across dual monitors and create desktop shortcuts to control dual monitors.,Windows,Free to try,MurgeeMon
4434,"Turn your USB or network printer to wifi AirPrint-enabled printer for iPhone, iPad.",Windows,Free to try,Air Printer
4435,Database connection utility.,Mac,Free,ODBC Manager
4436,"Recover your important files, photos from HDD, SD card, USB drive.",Windows,Free to try,Renee Undeleter
4437,Control the performance of File Open and Save-As dialog.,Windows,Free to try,File-Ex
4438,Change the type and creator of any file manually or like another file.,Mac,Free to try,Type And Creator Changer
4439,Add Jalali calendar to your Microsoft products.,Windows,Free to try,Edsoft Jalali Multi Pack 2007
4440,Recover and view your lost Windows product key.,Windows,Free,Keybits Product Key Viewer
4441,"Clean and optimize your Windows registry by removing old, corrupted, or damaged data.",Windows,Free,Warp Speed PC Tune-up Free
4442,Run Windows application and games on your linux PC.,Linux,Free to try,CrossOver for Debian/Ubuntu (64-bit)
4443,Create keyboard shortcuts using any key on your keyboard.,Windows,Free,Clavier+ (64-bit)
4444,Speed up your PC with registry fixing and system optimization.,Windows,Free to try,Boost Windows
4445,Clean your PC from unwanted duplicate files.,Windows,Free to try,Clone Terminator
4446,Kill the specified background processes.,Windows,Free,Auto TaskKiller
4447,Allow you to add new page to explorer properties.,Windows,Free,SKTimeStamp
4448,Speed up your PC and optimize your RAM.,Windows,Free to try,eConcept Memory Booster
4449,Connect to different databases through JDBC drivers.,Windows,Free,DbVisualizer Portable
4450,Create bootable Live USB drives for many Linux distributions.,Windows,Free,UNetbootin Portable
4451,Recover corrupted Microsoft SQL Server database files.  ,Windows,Free to try,Recovery for SQL Server
4452,Pack hundreds of free applications on a single thumb drive.,Windows,Free,LiberKey
4453,Analyze the monitor USB controllers and the devices connected to it.,Windows,Free to try,USBTrace (64-Bit)
4454,"Back up and restore files and folders, optimize PC performance, and manage partitions.",Windows,Free to try,Qiling Disk Master Professional
4455,Back up your data and keep it protected.,Windows,Free to try,MiniTool ShadowMaker
4456,Make backing up your content to an external drive easy.,Windows,Free to try,Clickfree Automatic Backup
4457,Manage and resolve overclocking of systems issues.,Windows,Free,Intel Extreme Tuning Utility
4458,Print images quickly and with minimum effort.,Windows,Free to try,Hot Folder Printer
4459,Fully emulated Mouse/Keyboard/Trackpad for your PC/Mac.,iOS,Free,Remote : Mouse/Keyboard/Presentation/Trackpad Free for PC/Mac
4460,Simple NFC Tag Reader that shows all Details of the NDEF Records.,Windows,Free,NFC Writer Reader for Windows 10
4461,"FREE FOR A VERY LIMITED TIME! GET IT NOW!Decorate your words with thousands of New, Animated, 3D emoticons!Express yourself with the largest...",iOS,Free,Animated 3D Emoji Free - New Animated Emojis & Emoticons Art Keyboard
4462,A free file finding and text searching tool.,Windows,Free,BareGrep
4463,HIDClass driver,Windows,Free,Microsoft SideWinder Precision Pro (USB)
4464,Repair system crashes and returns your systems to operating at full capacity.,Windows,Free,AVG Rescue CD (for USB stick)
4465,Improve your PC's performance by customizing its factory setting.,Windows,Free to try,PCTuner
4466,Open .zip and .zipx files and share files from anywhere.,Windows,$7.99,WinZip (Windows 8)
4467,Back up all your imporant files automatically.,Windows,Free,AutoSync File Backup
4468,Manage everything on your Android phones and tablets through desktop computer.,Windows,Free to try,MobiKin Assistant for Android
4469,Accept print jobs from a remote computer and print them on a Windows printer.,Windows,Free to try,SDI LPD
4470,Retrieve data from damaged ZIP archives.,Windows,Free to try,Recovery Toolbox for ZIP
4471,"Record, store, and sort clipped text and images.",Windows,Free,ClipMagic Lite
4472,Set up a number of schedules per day for each device and send remote commands to the control center to turn on/off or enable/disable automation for specified lights or sensors.,Windows,Free,Wemo Control Center
4473,Use a RS232 serial port monitor/sniffer tool.,Windows,Free,SerialMon
4474,MTK Engineer App Allow to Access MTK Engineering Mode Without any Secret Code.,Android,Free,MTK Engineer App
4475,Get the Linux distribution meant for enterprise use.,Linux,Free to try,Red Hat Enterprise Linux Server
4476,Maintain peak performance of the SanDisk SSD in Windows operating system.,Windows,Free,SanDisk SSD Dashboard
4477,Find and replace words and phrases within files.,Windows,Free,Replace
4478,Tap Roulette is like drawing straws 2.0Each friend puts a finger down on the screen and one will be selected.Use it to make decisions like who has...,iOS,Free,Tap Roulette
4479,Check outdated programs on your PC.,Windows,Free,Soft4Boost Update Checker
4480,Add an enhanced command line tool to increase your productivity in everyday tasks.,Windows,Free,TCC/LE
4481,Clean your Registry and improve your system performance.,Windows,Free to try,Registry Toolkit
4482,"Recover lost files, like photos, videos, and documents.",Mac,Free to try,Odin Data Recovery
4483,Get more out of your Android device.,Android,Free,Root ToolCase
4484,Record desktop screen and save it as a video file.,Windows,Free,Screencast Capture Lite Portable
4485,"Schedule PC shutdown, logoff, restart, sleep, and poweroff tasks.",Windows,Free,Wise Auto Shutdown Portable
4486,Identify and manage configuration problems in IIS.,Windows,Free,SSL Diagnostics (x64)
4487,address multiple Outlook Express issues,Windows,Free,Update for Windows XP
4488,"Protect BIOS, operating system, applications and data from unauthorized modification or corruption.",Windows,Free to try,Juzt-Reboot SW
4489,"Manage and configure startup programs, toolbars, and browser helper objects on PC.",Windows,Free,Autoruns Portable
4490,Pack and unpack your files without any difficulties.,Windows,Free,Rar Zip Extractor Pro
4491,Delete junk files from your PC.,Windows,Free to try,DelinvFile
4492,"Manage multiple RDP, VNC and HTTP(S) connections in a tabbed view.
",Windows,Free,LisSyl Remote Desktops
4493,Manage and extract RAR files in batch.,Windows,Free,UnRarIt.Net
4494,Convert any printable document into PDF format.,Windows,Free to try,novaPDF Professional Server
4495,"Convert your documents, videos, music, and images between formats.",Webware,Free,Fileminx
4496,Manage ISO or BIN image files.,Windows,Free,Munge Explorer Tool
4497,"Backup, restore, synchronize data with minimal effort.",Mac,$49.00,Data Backup
4498,How about trying something new?,Windows,Free,Desktop Launcher for Windows 10
4499,Compare and track your files and keep shared files in sync.,Windows,Free to try,ComparatorPro
4500,View multiple document formats using a single app.,Windows,Free,STDU Viewer Portable
4501,Megaphone is a must have app for your iPhone.,iOS,Free,Megaphone: turn your device into a microphone
4502,"Create, extract, and convert 200+ archive types: ACE, ARC, CAB, PEA, RAR, TAR, WIM, ZIPX, ZPAQ, XZ.",Windows,Free,PeaZip Portable (64-bit)
4503,Manage files and folders on your PC.,Windows,Free,FastCopy Portable
4504,Turns your android phone into a Wi-Fi analyzer.,Android,Free,Wifi Analyzer
4505,Download and install network drivers without internet connection.,Windows,Free to try,Driver Talent for Network Card
4506,Browse and change your system registry.,Windows,Free,RegAlyzer
4507,Analyze your hard disk information.,Windows,$19.00,DISKdata
4508,Clone a disk or partition to another disk or partition.,Windows,Free,Keriver Disk Sync
4509,Backup your files and folders.,Windows,Free,The Backup
4510,Manage various processes run by your computer.,Windows,Free to try,Advance Process Manager
4511,Compare files and synchronize them with your PC.,Windows,Free,FreeFileSync Portable
4512,Protect your online privacy from targeted hacks and password data theft.,Android,Free,Archie VPN
4513,Fix blockage and fragmentation of your system registry.,Windows,Free to try,Registry Clean Master
4514,Change the configurations settings on the Black Box Micro HD Hidden Camera and Black Box Pro HD Hidden Camera.,Windows,Free,BHS Cam Setup Tool
4515,Read MOBI files on ePub-friendly devices.,Mac,Free to try,iPubsoft MOBI to ePub Converter for Mac
4516,Improve PC's system responsiveness and stability.,Windows,Free to try,Process Lasso (32-bit)
4517,file renamer,Windows,Free to try,Oscar's Renamer
4518,BusyBox for Android is the most advanced BusyBox installer.,Android,Free,BusyBox for Android
4519,Easily Manage and Control Everything on Android from Computer.,Windows,Free to try,Vibosoft Android Mobile Manager
4520,Create and distribute PDF files from your documents and save money on your daily print job.,Windows,Free,GreenCloud Printer
4521,Extract and decompress all files and folders in the RAR archive.,Windows,Free,RAR File Extractor
4522,Run Linux operating system virtually on your Windows machine.,Windows,Free,LinuxLive USB Creator
4523,"Observe, determine, and merge changes for files, folders, or directories in visually appealing text format.",Windows,Free,WinMerge Portable
4524,View the size of every folder in view.,Windows,Free,MC FolderSize
4525,View PDA mobile phone details.,Windows,Free to try,Mobile Phone Forensics Software
4526,Restore cell phone picture videos files folder data of mobile memory or sd cards.,Android,Free,Mobile Phone Data Recovery DOC
4527,Trace and log API and ActiveX interface with parameters.,Windows,Free to try,Blade API Monitor
4528,Create backups of your documents and files stored locally or online.,Windows,Free,Ocster Backup Freeware
4529,Get a community supported software operating system based on Red Hat Enterprise Linux.,Linux,Free,CentOS
4530,"Manage local music files, listen to Internet radio, and surf the Web.",Windows,Free,Songbird Portable
4531,Download and save regular files of varying size from the Web swiftly and effectively.,Android,Free,Download All Files
4532,Turn your mobile phone into the remote controller of the TV.,Android,Free,DISH TV Remote Control
4533,"Manage and administer your server, databases, and database objects from a Windows interface.",Windows,Free,DbaMgr2k
4534,change your Dock from new 3D-look to the old Tiger look and more,Mac,Free,TigerDock
4535,Diagnose and fix malware and boot issues.,Windows,Free,Farbar Recovery Scan Tool (64-bit)
4536,Extract with decompression of multiple files to a single file automatically.,Windows,Free to try,JiJi Self Extractor
4537,"Recover e-mails from deleted, damaged, or corrupt mailbox files.",Windows,Free to try,Nucleus Kernel Outlook Express
4538,Simple and fast backup software.,Mac,Free to try,Sync Sync Sync
4539,"Backup, protect, and recover important documents or files.",Windows,Free to try,Office Backup
4540,Disable the Eject button on your CD/DVD drive to prevent kids from breaking it.,Windows,Free,Sidi
4541,Download and update device drivers.,Windows,Free to try,Driver Dr
4542,Tag any file on your hard drive.,Windows,Free,Tagged Frog
4543,Calculate payments for your loan or mortgage.,Windows,Free,Loan Amortization Calculator
4544,Keep and manage your passwords in KeePass 2.x compatible database on your Android device.,Android,Free,Keepass2Android Password Safe
4545,Reset or remove Windows 7 passwords.,Windows,Free to try,iSumsoft Windows 7 Password Refixer
4546,"Meet Geeni. Your wish is Geeni's command. Control all Geeni smart home devices in one easy app, or by voice using Amazon Echo, from ANYWHERE in...",Android,Free,Geeni
4547,Browse Time Machine backups and find frequently copied items.,Mac,Free to try,BackupLoupe
4548,Record keyboard or mouse input or both and playback with one click or by hotkey.,Windows,Free,Olaay Macro Recorder
4549,Lock and unlock files and folders via drag and drop.,Mac,Free,uLock
4550,"Transfer mobile phone files such as contacts, SMS between Android, iOS and iTunes.",Windows,Free to try,Gihosoft Mobile Transfer
4551,Print checks based on your existing back checks from your checkbook.,Windows,Free to try,Check Printer BE
4552,Recover RAW drive and convert RAW drive to NTFS.,Windows,Free to try,M3 RAW Drive Recovery
4553,"Catalog and organize your CD, DVD, and local folder contents.",Windows,Free,MAKara CDCatalog
4554,Lock your PC without logging off.,Windows,Free,Lock Platinum
4555,Find and play (or view) media files.,Windows,Free,MediaFinder
4556,A simple digital clock with multiple configuration possibilities.,Windows,Free,Digital Clock for Windows 10
4557,Find the version of Windows installed on your computer and check for the compatibility of your processor for a 64bit operating systems. ,Windows,Free,64bit Checker
4558,Optimize PDF documents to make them more accessible and easier to process.,Windows,Free to try,PdfCompressor Professional
4559,Eliminate print waste by optimizing page layout and removing unnecessary materials from pages.,Windows,Free to try,GreenPrint Home Premium
4560,Export registry keys to .reg files from remote PCs.,Windows,Free,EMCO Remote Registry Exporter
4561,"Make custom access to your programs, files, and folders.",Windows,Free,Menu Inventor
4562,"Repair SQL database, and resolve all it's issues.",Windows,Free to try,Kernel SQL Database Recovery
4563,"Log off, shut down, and restart your system in Windows or DOS.",Windows,Free,Winexit
4564,Optimize your images for easy uploading and e-mailing.,Windows,Free,Memory Waves Image Optimizer
4565,Add international handwriting recognizers to a Tablet PC or other personal computer.,Windows,Free,Microsoft Windows XP Tablet PC Edition 2005 Recognizer Pack
4566,Play audio files.,Windows,Free,Portable Foobar2000
4567,"Shows folder sizes, and finds duplicate files & folders.",Windows,Free to try,SpaceMan 99
4568,"Copy anything from your screen directly to a graphic file, printer, or e-mail message.",Windows,Free to try,ScreenHunter Plus
4569,Synchronize contact data between Palm Desktop and Microsoft Outlook.,Windows,Free to try,ContactMirror for Outlook and Palm Desktop
4570,Recover your lost data and files in case of file-deletion disasters.,Windows,Free to try,Nucleus Kernel Undelete
4571,Optimize Internet experience,Windows,Free to try,Internet Optimizer
4572,Launch your desired scripts as soon as you connect USB to PC.,Windows,Free,USB Detect & Launch
4573,Record all print activities to a central database and generate various reports.,Windows,Free to try,PrintUsage Pro
4574,Improve your PC performance and protect your privacy by deleting unnecessary Registry entries.,Windows,Free to try,1-abc.net Registry Washer
4575,Manage and organize your documents.,Windows,Free,Wise Doc Manager
4576,Generate MSI setup for your applications.,Windows,Free,AppDeploy Repackager 
4577,Adjust computer settings to accelerate gaming performance.,Windows,Free to try,GameHike
4578,Remove items from your recycle bin based on file type and user defined time limits.,Windows,Free to try,Recycle Bin Manager
4579,Relocate installed programs from one path to another on your hard disk.,Windows,Free to try,Application Mover (64-bit)
4580,Manage your hard disk drives.,Mac,Free to try,SpeedTools Utilities
4581,Clean up your Internet history and optimize PC performance.,Windows,Free,Privacy Eraser Free Portable
4582,Copy files with unreadable sectors.,Windows,Free to try,Durable Copy
4583,Create bootable Live USB drives for many Linux distributions.,Linux,Free,UNetbootin for Ubuntu (32-bit)
4584,Clone and run multiple accounts of the same app on one device.,Android,Free,Multi-multiple accounts app
4585,Get a simplified download/install experience for all of Microsoft's free web products.,Windows,Free,Web Platform Installer (64-bit)
4586,Search and repair disk errors in your machine.,Windows,Free,CheckDiskGUI 
4587,Macgo iPhone Cleaner is an excellent iOS cleaner tool runs on Windows.,Windows,Free,Macgo iPhone Cleaner
4588,"Diagnose and fix PC problems, enhance security, and optimize PC performance.",Windows,Free,PC Magician's Toolbox
4589,Monitor your computer system activity.,Windows,Free to try,Argus
4590,ASUS Wi-Fi GO! & NFC Remote gives you complete control of your PC anytime and anywhere. Plus one step to manage all your public clouds or sync...,iOS,Free,Wi-Fi GO! & NFC Remote
4591,"Get reminded to take a break, while using a computer.",Mac,Free,Dejal Time Out
4592,"Clean, speed up, maintain, secure, and repair your system.",Windows,Free to try,Synei System Utilities
4593,"Notifies about software updates, allows you to track comments and questions.",Mac,Free,Mac Informer
4594,"Resolve an issue with Spanish UI when Catalan, Basque, or Galician is set as the display language.",Windows,Free,HP MediaSmart Music Application Update
4595,Optimize your system registry and fix PC errors.,Windows,Free to try,Speed up PC Tool
4596,Open applications in different languages.,Mac,Free,Language Switcher
4597,Unleash the power of the Windows 7 platform for in-store devices. ,Windows,Free,Windows Embedded POSReady(64-bit)
4598,Organize and protect your hard drive.,Windows,Free to try,Partition Commander
4599,"Create one multiboot USB and manage pendrive, hard disks and all removables media.",Windows,Free,SARDU
4600,Get various software products that can run from a USB pen-drive.,Windows,Free,WinInizio PenSuite
4601,Create large virtual disks up to 16TB disk.,Windows,Free,2Tware Virtual Disk 2011 Free
4602,"Remotely zoom in the pc screen with the wireless mouse. It's free!!With the MOUSE AGENT do presentation or relax and enjoy movie,music,photo and...",iOS,Free,Mouse Agent
4603,Convert physical system partitions to virtual.,Windows,Free,Citrix XenConvert
4604,Capture and process video before exporting to tape or processing with another program.,Windows,Free,VirtualDub Portable
4605,Clean up your PC to improve its performance.,Windows,Free,TVcleaner
4606,Use your Android phone's camera as a wireless webcam in PC or Mac.,Android,Free,Iriun 4K Webcam for PC and Mac
4607,Monitor for and correct the three main types of CPU throttling that are being used on many laptop computers.,Windows,Free,ThrottleStop
4608,"Create and print cover boxes for your CD, DVD, and VHS.",Windows,Free,ImPrinting
4609,Check the status of your printer on your Windows 8 device.,Windows,Free,HP Printer Control for Windows 8
4610,Capture screenshots of your desktop screen.,Windows,Free,My Screen Capture
