,Description,Platform,Price,Product
3078,Create autorun menu for data CDs and DVDs and add Web and e-mail links.,Windows,Free to try,Simple CD/DVD Menu
3079,Determine the presence of a DVD decoder on your Windows XP computer.,Windows,Free,Windows XP Video Decoder Checkup Utility
3080,"Find files, mail messages, photos, and other data easily.",Mac,Free to try,HoudahSpot
3081,Create a simple loader for your multimedia CDs.,Windows,Free,Autorun Now
3082,Manage your IT infrastructure through a suite of online services.,Windows,Free to try,Automatos Server Agent
3083,"Remove programs, check dependencies, and manage startup items.",Windows,Free,ProCleaner
3084,Remove unwanted files from your computer completely.,Windows,Free,AHHB Power Delete
3085,"Unlock PDF files printing, editing, and copy restrictions.
",Windows,Free to try,PDF Security Removal
3086,Search for duplicate files on your hard disk.,Windows,Free to try,DoubleKiller Pro
3087,Clean up unsuccessful uninstallation files.,Windows,Free to try,Final Uninstaller
3088,Securely erase hard disks and other media.,Windows,Free,HDShredder Free Edition
3089,Alternative dock application.,Mac,Free to try,DragThing
3090,Find files with identical content.,Windows,Free,Exact Duplicate Finder
3091,"Extract, create, and update a compressed archive.",Windows,Free to try,AnyZip
3092,Locate & remove duplicate files in a snap.,Mac,Free to try,Singular
3093,Simplify path managment on your PC.,Windows,Free,Path Editor
3094,Maintain and optimize your HP Pavilion Notebooks performance.,Windows,Free,HP Advisor for HP Pavilion Notebooks
3095,Record Windows macros and automate repetitive tasks through a visual interface without writing code.,Windows,Free to try,WinAutomation
3096,Increase the performance of applications by optimizing memory allocation.,Windows,Free,7-max
3097,Run an full-powered operating system that is based on community development.,Linux,Free,Ubuntu Netbook Edition
3098,Create bootable Live USB drives for many Linux distributions.,Linux,Free,UNetbootin for Debian (64-bit)
3099,Monitor your hard drive space.,Windows,Free,Drive Manager
3100,Back up and sync files on remote machines.,Windows,Free,cwRsync
3101,Optimize your computer's performance and make your system faster.,Windows,Free,Actual Booster
3102,Fix stuck printers and clear the print queue.,Windows,Free,Print Queue Cleaner
3103,Activate Flip 3D using your mouse.,Windows,Free,Vista Flip 3D Activator
3104,iFile Organizer allows you to arrange your local and cloud files in a single application.,iOS,Free,iFile Organizer
3105,Track and control print usage in your organization.,Windows,Free to try,Print Tracker
3106,Create photo slide shows.,Windows,Free,SlideShow Maker Freeware
3107,Learn everything about your computer.,Windows,Free,CompInfo
3108,Rebuild inaccessible PDF files.,Windows,Free to try,PDF Repair
3109,"Customize, optimize, and maintain your Windows operating system.",Windows,Free to try,PC Power Suite
3110,Capture all necessary screenshots and create helps and manuals.,Windows,Free to try,Click Recorder
3111,Search for entries in the Windows registry.,Windows,Free to try,Registry Finder
3112,Remove all metadata from JPEG files.,Windows,Free,Metanull
3113,Take advantage of unrestricted digitalized printing with a truly universal maintenance and expenditure control. ,Windows,Free,NetSpooler Client
3114,"Manage every document on your computer, including pictures, graphics, or any other Windows-based content.",Windows,Free to try,eDocPlus
3115,Create rules and rename your files and folders in batch mode.,Windows,Free to try,BatchRename Pro
3116,Get a specialized copy environment useful for data backup and data recovery applications.,Windows,Free to try,Youtica Power Copy
3117,"Recover corrupted, deleted, or original versions of files.",Windows,Free to try,Eaz-Fix Professional
3118,Stable screen reader.,Windows,Free to try,Window-Eyes
3119,"mount, create, resize, and get info about disk images",Mac,$14.95,Disk Imager
3120,Scan and monitor home network activities.,Windows,Free to try,Portable MyLanViewer
3121,July 2006 update for edition 2005,Windows,Free,Rollup for Windows XP Media Center
3122,Install this program and have your CDs autorun in your current viewer.,Windows,Free to try,AutoView
3123,"View, zoom, capture, enhance, and rotate any section of your desktop screen.",Windows,Free to try,Magic Lens Max
3124,"Stream from iTunes, iPhoto, Aperture or the Finder to PlayStation 3.",Mac,Free to try,MediaLink
3125,Move your files from anywhere to anywhere.,Windows,Free,Limagito FileMover Lite
3126,A powerful Recovery tool that Search your internal storage and SD card for deleted images and recover them again easily.,Android,Free,DigDeep Image Recovery
3127,Clean and organize your Windows Registry to make your computer run faster.,Windows,Free to try,WinZip Registry Optimizer
3128,Automate your repetitive everyday tasks.,Windows,Free to try,My Macros
3129,Calculate CRC32 and MD5 checksum code for any file.,Windows,Free,F CRC Calculator
3130,Search any files on your computer or local network.,Windows,Free to try,Finder
3131,Youtube is not supported due to their terms of service.,Android,Free,FVD - Free Video Downloader
3132,Recover system files with ease.,Windows,Free to try,ConfigSafe
3133,Browse with privacy on your side with automated online tracker blocking and history erasure.,iOS,Free,Firefox Focus: The privacy browser
3134,Analyze and manage different services running background.,Windows,Free,Synei Service Manager
3135,View three analog clocks for multiple international time zones.,Windows,Free,Analogtime Lite
3136,Create images of your data using a virtual printer.,Windows,Free to try,SoftCopy
3137,Remove duplicate events and to-dos from iCal.,Mac,Free,iCal Dupe Deleter
3138,Count down to each and every hour.,Windows,Free,CountDown
3139,Restore e-mails and attachments from Outlook.,Windows,Free to try,Easy Outlook Recovery
3140,Get various software products that can run from a USB pen-drive.,Windows,Free,WinInizio PenSuite
3141,Catalog your removable media.,Mac,Free to try,DiskCatalogMaker
3142,Remove font cache files.,Mac,Free,FontNuke
3143,Get various software products that can run from a USB pen-drive.,Windows,Free,WinInizio PenSuite
3144,"Recover lost data from your iPhone, iPad, or iPod touch.",Windows,Free to try,Fone Rescue
3145,"Gain access to graphics hardware, audio output, and gaming peripherals within cross-platform development library.",Windows,Free,SDL
3146,Monitor and manage your CPU activities.,Windows,Free,MCS CPU Benchmark V5
3147,Allow complete user permissions for specific applications.,Windows,Free,UAC Trust Shortcut (64-Bit)
3148,Share documents and images and swap between different Windows Live accounts.,Windows,Free,Windows Live Sign-in Assistant
3149,Generate random passwords on your Palm.,Windows,Free,Readable Password Generator
3150,Improve Time Machine compatibility with Time Capsule.,Mac,Free,Apple Time Machine & AirPort Update
3151,Monitor processes on your Mac or another Mac connected to your AppleTalk network.,Mac,Free,ProcessWatcher
3152,Reset local administrator and user password for Windows.,Windows,Free to try,iSeePassword Windows Password Recovery Pro
3153,Add new applications to startup menu or remove existing ones.,Windows,Free,Mz StartUp Manager
3154,Get a GUI front end for RoboCopy command line utility for Windows.,Windows,Free,WinRoboCopy
3155,Simplify your use of command-line networking commands.,Windows,Free,ToggIT Command Line Helper
3156,"Create any application for a PDA, HHT's, or mobile phone.",Windows,Free,Active Studio 2008
3157,Kungsoft NTFS to FAT32 Editor is free utility for converting Windows file system,Windows,Free,NTFS to FAT32 Editor
3158,"Install live operating systems including Linux and Windows on USB flash drives.
",Windows,Free,Live USB Creator
3159,Measure your reading and writing speed.,Windows,Free,Parkdale
3160,Streamline mass deployment of HP System Software updates for notebooks.,Windows,Free,HP System Software Manager
3161,Get tablet optimized file manager for your Android device.,Android,Free,File Manager HD
3162,Create LivePCs for downloading and tesing software without damaging your PC.,Windows,Free,LivePC Engine
3163,advanced archiver,Windows,$19.95,ZipZag
3164,Customize and bind your keyboard.,Mac,Free,Karabiner Elements
3165,Keep your eye on network connections.,Windows,Free,Moo0 ConnectionWatcher Portable
3166,Uncompress ZIP files.,Windows,Free,Zip Pro
3167,Handle ACE archives in your PeaZip.,Windows,Free,PeaZip Unace plugin
3168,Type and edit documents in Malayalam language.,Windows,Free,Typeit Portable
3169,PocoDoc shrinks your files while keeping all images at the highest quality.,Windows,Free,PocoDoc Lite
3170,Discover and configure Bonjour-enabled printers from your Windows computer.,Windows,Free,Bonjour Print Services
3171,Manage projects and resources across your organization and enhance the productivity.,Windows,Free to try,Microsoft Office Project Server 2007 with Service Pack 2 (64-Bit)
3172,Schedule events in Windows.,Windows,Free to try,Action Process Automator
3173,Check available memory under OS X.,Mac,Free to try,Memtest
3174,Turn off or restart your computer automatically.,Windows,Free,Easy Pro Shutdown
3175,"Capture the screen of remote workstation, check running processes, and gather system information.",Windows,Free to try,Nimbus
3176,Get access to corrections and manipulation of timestamp for any file and folder.,Windows,Free,NewFileTime
3177,Unlock your netbooks resolution.,Windows,Free,Higher Netbook Resolution
3178,"Modify system apps through ""haxie"" patches.",Mac,Free,Application Enhancer
3179,Calculate the total time you worked.,Windows,Free,Time Worked Calculator
3180,"Organize and rename your music, picture, video, text, and e-mail files.",Windows,Free,Peter's Flexible Renaming Kit
3181,Backup your critical files via the Internet.,Windows,Free to try,DataFort Offsite Backup
3182,Create macros to automate repetitive tasks of all kinds.,Windows,Free to try,Perfect Keyboard Professional
3183,"Manage your system using a tweaking utility with 2,494 policies to configure.",Windows,Free to try,TweakEasy Professional
3184,View the status of their processor directly from Windows Media Center UI.,Windows,Free,Core Temp MC
3185,"Arrange and track your appointments and events with cross-platform scheduler, planner, and reminder.",Windows,Free,Efficient Calendar Free Portable 
3186,"Tune, tweak, and optimize your Windows Vista.",Windows,Free,Best Vista Tune Free
3187,Monitor which process has a file open.,Windows,Free,mst IsUsedBy
3188,Find out the total size of your files and folders and the distribution of your disk space.,Windows,Free to try,Moleskinsoft Directory Size
3189,Keep your browser with you always on your Windows PC.,Windows,Free to try,Portable Offline Browser
3190,The easiest and fastest QR Code and Barcode Reader.,iOS,Free,QR Code Reader and Scanner
3191,View all your DjVu documents easily.,Windows,Free,WinDjView Portable
3192,Clone and back up your Mac OS X system disc with full HFS support.,Mac,Free,XTar
3193,Display information about CPU and memory usage.,Windows,Free,CPU Meter
3194,Cleanup all the tracks of Internet and computer activities.,Windows,Free,WinUtilities Free History Cleaner
3195,Launch Desk Accessory applications on your Palm OS device.,Windows,Free,DA Launcher
3196,"Sync contacts, calendars, ringtones, music and photos.",Mac,Free to try,The Missing Sync for Palm Pre
3197,Control the usage of RAM on your Mac.,Mac,Free,MemoryStick
3198,Configure and manage boot operations on PC.,Windows,Free,Plop Boot Manager
3199,"Optimize your Firefox, Skype, Chrome, and Thunderbird to work faster.",Windows,Free,SpeedyFox
3200,Use as an alternative for the standard Windows Run-Dialog.,Windows,Free,Run-Command (64-bit)
3201,Manage your system's registry and eliminate corrupted and obsolete entries.,Windows,Free to try,WyvernWorks Registry Fix-Up 2004
3202,Remote Mouse turns your mobile phone or tablet into a wireless user-friendly remote control for your computer.,Android,Free,Remote Mouse
3203,"Recover deleted, formatted, or lost files from hard drives and external storage.",Windows,Free,Free Any Data Recovery
3204,Arm your Android device with the latest virus detection.,Android,Free,Bitdefender Antivirus Free
3205,"Utility that cleans, optimizes, and creates bootable backups.",Mac,Free to try,MacTuneUp
3206,Get detailed info about which handles and DLL processes are opened or loaded on your system.,Windows,Free,Process Explorer Portable
3207,Recover lost data from SD memory cards.,Windows,Free,Free SD Card Data Recovery
3208,HIDClass driver,Windows,Free,Microsoft SideWinder Precision Pro
3209,Log on in a Windows domain automatically.,Windows,Free,LogonEdit
3210,Save energy when your computer is idle.,Windows,Free,CO2 Saver
3211,Organize and manage your files.,Windows,Free,FileCommander
3212,Play and transcribe ordinary WAV or MP3 recordings.,Windows,Free,Listen N Write Portable
3213,Eliminate the frustrations of the old Windows command prompt.,Windows,Free to try,PromptPal
3214,Evaluate your GPS antenna using your Win32 machine with Bluetooth.,Windows,Free,Bluetooth GPS Tester for Win32
3215,Shut down your system based on certain options.,Windows,Free to try,Shutdown Timer (32-bit)
3216,The Google Pinyin Input is an input method (IME) optimized for typing Chinese on Android.,Android,Free,Google Pinyin Input
3217,"Hibernate, suspend, or shutdown your PC with configurable rules.",Windows,Free,SmartPower
3218,"Print multiple PDF files, texts, documents, HTML, XML, drawings, charts, and JPG images.",Windows,Free,Print Conductor
3219,Control several Macs with the same mouse & keyboard.,Mac,Free,Teleport
3220,"Perform file or keyword searching on your local computer, or across the network.",Windows,Free to try,Turbo Searcher
3221,Synchronize your Microsoft Outlook and Exchange data with your SQL database.,Windows,Free to try,GeniusConnect 32-bit Unicode
3222,"Display, edit, manipulate and archive multiple clips.",Mac,Free to try,CopyPaste Pro
3223,Enhance the performance of your MSI graphics card.,Windows,Free,MSI Afterburner Remote Server
3224,Clean disk information that clogs your system.,Windows,Free to try,Windows Optimizer--System and Disk Cleaner
3225,Optimize you Windows system by scheduling a defragmentation.,Windows,Free to try,Windows Defrag Manager
3226,Recover lost data on Android phone.,Windows,Free to try,MyJad Android Data Recovery
3227,Record keyboard activities.,Windows,Free,TypeTeller
3228,Recover your corrupted MS Excel documents.,Windows,Free to try,Kernel Recovery for Excel
3229,Control you system from going to sleep mode.,Windows,Free,Sleep Preventer
3230,Transfer music and playlists from iPod to any computer.,Windows,Free to try,iPodAid iPod To Computer Transfer
3231,Optimize the file cache management of your PC system.,Windows,Free to try,O&O CleverCache Professional Edition
3232,Brother iPrint&Scan is a free app that enables you to print from and scan to your iOS device (iPhone / iPod touch / iPad).,iOS,Free,Brother iPrint&Scan
3233,"Recover deleted, formatted or damaged video files.",Windows,Free,Free Video Recovery
3234,Automate any series of tasks you do on your computer.,Windows,Free to try,RoboTask
3235,"Recover deleted photos, videos, and audio files with a few clicks.",Windows,Free to try,O&O MediaRecovery
3236,Make a diagnosis and detect the error codes displaying on your PC.,Windows,Free,Windows Error Lookup Tool
3237,Remove clutter and boost performance.,Mac,Free to try,Spring Cleaning Deluxe
3238,Improve QuickTime compatibility with iChat.,Mac,Free,Apple Compatibility Update for QuickTime 7.5.5
3239,Download driver updates automatically and safely. ,Windows,Free to try,Driver Updater Pro
3240,Partition your physical server into multiple virtual machines.,Linux,Free,VMware Server for Linux (64-bit)
3241,Scan your disk drives for errors and fix them.,Windows,Free,Disk Check
3242,Find and remove all duplicate files from your computer.,Windows,Free to try,Doppelganger
3243,Improve the start up speed of Adobe Acrobat 6.,Windows,Free,Acrobat 6 SpeedUp
3244,"Recover lost DOC, XLS, PPT, PDF, and other document file types from hard drive and storage media.",Windows,Free to try,DocumentsRescue Pro
3245,"Back up whatever, whenever, and restore everywhere, anytime.",Windows,Free,EaseBackup
3246,Perform mouse actions automatically.,Windows,Free,Free Auto Clicker
3247,Identifies and fixes typical problems that may occur with your high speed internet service.,Windows,Free,Qwest Quickcare
3248,Make folders from a selection of files and move those files into their respective folders.,Windows,$14.99,FileToFolder
3249,Get a serial terminal emulator that works with any serial port.,Windows,Free,Hyper Serial Port
3250,"Recover deleted files and recover data from formatted, damaged or lost partitions.",Windows,Free,Lazesoft Data Recovery Home
3251,Unleash full filming and broadcasting capability spectrum through your iPhone/iPad camera lens. ,iOS,Free,iVCam - Webcam for PC
3252,Transfer data from your machine to remote computer via serial RS232 or parallel LPT port.,Windows,Free,Machine Controller
3253,"If you purchase Surge 2 after Aug 16, 2016.",iOS,Free,Surge 3 - Web Developer Tool
3254,Recover e-mails from damaged DBX files or hard drive.,Windows,Free,Mail-Cure for Outlook Express
3255,Scan your computer for installed software and displays a list of updates.,Windows,Free,Update Notifier
3256,Remove all traces of installed AMD and NVIDIA drivers.,Windows,Free,Display Driver Uninstaller
3257,Accelerate your Window's shutdown function.,Windows,Free,Windows Shutdown Speed Up
3258,Create a disk summary and a file/folder index.,Windows,Free,Disk Index
3259,"Cute Emoticons, GIF, Stickers Keyboard is a free emoji keyboard app that makes typing more fun, accurate and fast.",Android,Free,"Emoji keyboard - Cute Emoticons, GIF, Stickers"
3260,uninstall the leftovers in computer,Windows,$19.95,Absolute Uninstaller Free Version
3261,Patch and upgrade your Windows 98 Second Edition machine.,Windows,Free,Auto-Patcher For Windows 98SE (English)
3262,"Recover images, movies, and sound files.",Mac,Free to try,RescuePRO Deluxe
3263,Find files on your computer instantly.,Windows,Free to try,Instant File Find Pro
3264,Find files on your computer instantly.,Windows,Free to try,Instant File Find Pro
3265,Search and find information and related data on your PC.,Windows,Free to try,FileLocator Pro
3266,Scan your hard disk to see everything in your cache history.,Windows,Free,IndexDatZap
3267,Add tab control capability to your Microsoft PowerPoint,Windows,Free to try,Office Tabs for PowerPoint (32-Bit)
3268,"Back up, restore, and control your programs.",Windows,Free to try,My PC Quick Tool
3269,"Analyze, clean, compact, backup, and restore Windows registry.",Windows,Free to try,Registry Purify
3270,Accelerate the operating system and application deployment process.,Windows,Free,Microsoft Deployment Toolkit 2012 (64-Bit)
3271,Reproduce all features of the original command-line packet capture tool - tcpdump.,Windows,Free to try,Microolap TCPDUMP for Windows
3272,Save partitions by compressing files on your hard drive.,Linux,Free,Partition Image for Linux
3273,"Search and delete internet traces, invalid registry entries, cookies, and unneeded files.",Windows,Free to try,All in One Cleaner
3274,"Delete temporary files, remove history. ",Windows,Free,Disk Cleanup Free
3275,Collect all your running applications and minimize them on system tray.,Windows,Free,TrayIt
3276,"Recover your files, documents, images and e-mails from any storage media.",Windows,Free,Wise Data Recovery Portable
3277,Automate your PC activities.,Windows,Free to try,AI Robot
3278,"Monitor CPU usage, memory, resources, disk space, laptop battery, plus synchronize computer's clock.",Windows,Free to try,Computer Status Monitor
3279,registry cleaning tool,Windows,Free to try,RegSupreme Pro
3280,Improve your cell phone's ram speed.,Android,Free,RAM Cleaner
3281,"Enables audio, video, and other time-based media to be added to applications and applets built on Java technology.",Windows,Free,Java Media Framework
3282,Update drivers for your Magic Mouse.,Mac,Free,Apple Wireless Mouse Software Update
3283,Make your 3D printing job easy and fast.,Windows,Free,EasyPrint 3D
3284,"Back up system drive, perform disk imaging, file sync, and disk cloning.",Windows,Free to try,AOMEI Backupper Professional
3285,Examine your hard disk's performance.,Windows,Free to try,Disk benchmark 2006
3286,Remove and cleanup notification area icon cache.,Windows,Free,Notification Area Cleaner (64-Bit)
3287,"Transcend digital borders, access geo-restricted content, anonymize online activity, and shield personal data within one-tap connect.",Android,Free to try,CyberGhost VPN - Fast & Secure WiFi protection
3288,Develop wireless and handheld applications.,Windows,Free to try,GoDB
3289,Join split files to a single file with your Windows machine.,Windows,Free,File Joiner
3290,"Repair IE and system faults, clean cookies and history.",Windows,Free,PC Brother IE Care Free
3291,Boot up any PC from CD/DVD or USB and recover crashed system or reset lost passwords.,Windows,Free to try,Active@ LiveCD
3292,Restore contacts from Android smartphones.,Windows,$19.95,Myjad Android Contact Recovery
3293,Rename large batches of files.,Windows,Free,Smart F.R. - Smart File Renamer
3294,Measure performance of drives at operating system level.,Windows,Free,SciMark Drives Lite
3295,Map a drive to a path fast and easily.,Windows,Free,vDrive Plus
3296,Get double your battery's autonomy. ,Windows,Free to try,Battery Doubler
3297,Rename MP3 files with ID3 tag information and vice versa.,Windows,Free,TagScanner Portable
3298,Customize your Windows XP settings.,Windows,Free,SafeTweak XP Knowledge Base
3299,Show information about your local or remote system resources and performances.,Windows,Free to try,EF System Monitor
3300,Search for and edit files in four unique ways.,Windows,Free to try,Finders Keepers
3301,Need to connect to a wireless network that is WEP encoded but all you have is the passphrase and your network connection client doesn't handle...,iOS,$0.99,WEPGen
3302,locate and fix dead pixels,Windows,Free,UDPixel
3303,Improve your PC performance.,Windows,Free to try,WinClean
3304,Monitor your system's hard-drive and logical-disk activity.,Windows,Free to try,HddLed Indicator
3305,Shutdown or reboot local and remote operating systems.,Windows,Free to try,rmtShutDown
3306,Share printers in a mixed OS environment.,Windows,Free to try,AlphaLPD
3307,Secure and protect your path across the Internet.,Android,Free,Private Tunnel VPN - Fast & Secure Cloud VPN
3308,Get a lightweight and simple Linux distribution.,Linux,Free,Arch Linux (64-bit)
3309,"Get the operating system for Home Theater PCs, Media Center Computers, and Set-Top Boxes.",Linux,Free,Element OS (Linux)
3310,"Backup, restore, encrypt and filter your files.",Windows,Free,AnyBackup Free Edition
3311,Windows 98 Update,Windows,Free,Microsoft Windows 98 Update: PC Speaker Driver
3312,"Recover data from lost or deleted files, formatted drive, or missed partitions.",Windows,Free to try,DERescue Data Recovery Master
3313,Find and fix the PC problems that slow you down.,Windows,Free,Nero TuneItUp 2019
3314,Delete files and folders from your computer completely.,Windows,Free to try,SafeIT File Shredding 2006
3315,Create hot keys for click-free pasting.,Windows,Free to try,Keyboard Manager Standard
3316,"open, view & convert Mac files",Windows,$69.95,DataViz Conversions Plus
3317,Open and close CD-ROM drive door with a mouse click.,Windows,Free,Door Control
3318,"Extract text from PDF, DOC, RTF, CHM, or HTML files.",Windows,Free,Text Mining Tool
3319,Get a terminal emulator for the Unix/Linux desktop.,Linux,Free,Terminal for Linux
3320,"View, edit, and print DBF-format database.",Windows,Free,DBF Viewer Plus
3321,"Cleans web browser cache files, browsing history, cookies, and download history.",Mac,$1.99,Cache Out X
3322,Enforce software productivity by memory-management optimization.,Windows,Free to try,PC Tweaker
3323,Expand your Finder's 'Get Info' window.,Mac,Free to try,XRay
3324,"Back up and protect your files, databases, mailboxes, and VMs.",Windows,Free,Uranium Backup Free
3325,Control the applications running on your system.,Windows,Free,MKN TaskExplorer
3326,Jailbreak your iOS device.,Windows,Free,Pangu
3327,This app uses the Device Administrator permission.,Android,Free,Phone Factory Reset
3328,Transfer contacts from iPhone to computer.,Windows,Free to try,Tansee iPhone Transfer Contact
3329,Incorporate all the communication alternatives available at an enterprise level into a unique solution.,Linux,Free,Elastix (64-bit)
3330,Create backups of your valuable data.,Windows,Free,Snap Backup
3331,Execute all your essential file management tasks.,Android,Free,File Manager
3332,Retrieve files from reformatted or damaged floppy disks.,Windows,Free to try,RECOVER Floppy Pro
3333,"Specify the server port, view the console, and run the scripts.",Windows,Free,Shadowsocks Client
3334,Create a virtual audio output device on your Mac.,Mac,Free,VirtualSpeaker
3335,Manage your files and folders.,Mac,Free,muCommander
3336,Synchronize and backup your files with extensive options.,Windows,Free to try,SyncBackSE
3337,Perform backups and data protection from Windows PC.,Windows,Free to try,BackupAssist
3338,Manage execution of Windows start-up programs.,Windows,Free to try,WinUtilities Startup Cleaner
