,Description,Platform,Price,Product
1540,Protect all your servers and cloud workloads via single web console with RTOs less than 15 secs.,Windows,Free to try,Acronis Backup for Server
1541,Prevent interruption to your computer.,Mac,Free,Jiggler
1542,Improve the performance of your PC by optimizing its Windows core NT.,Windows,Free,ZNsoft Optimizer Xp
1543,Recover data from any CHK files that exist on your computer.,Windows,Free to try,CHK File Recovery
1544,"Test the speed of your computer, and compare your results online to others.",Windows,Free,NovaBench
1545,"Monitor and manipulate network events, network traffic and DNS to and from a target application.",Windows,Free,PacketEditor
1546,Back up and restore configuration files on your system.,Windows,Free to try,LifeSaver
1547,Recover and read files from unreadable disks and other media.,Windows,Free,Dead Disk Doctor
1548,Recover deleted or lost data from external hard drives and storage media.,Windows,Free to try,Aid File Recovery Software Professional Edition
1549,"Recover deleted, formatted, or lost data.",Windows,Free to try,RescuePro Deluxe
1550,Synchronize files and folders in real time.,Windows,Free to try,Beyond Sync
1551,Back up your activities with a manual or fully automated process.,Windows,Free,File Backup Watcher Free Edition
1552,Compare file details and generate reports.,Windows,Free to try,DLSuperC--Text Compare with Filters (32-bit)
1553,"Restore BMP, JPEG, PNG, TIFF, MP3 files.",Mac,Free,Softtote Mac Free Data Recovery
1554,"Scan, fix, and optimize your Windows Registry.",Windows,Free,System Boost Elite
1555,Recover accidentally deleted files even from recycle bin.,Windows,Free,DataRecovery
1556,Build and control your own keyboard.,Windows,Free to try,KeyboardChanger
1557,"Change file names, properties, attributes, and extensions.",Windows,Free to try,File Properties Changer
1558,Shutdown your PC when you want.,Windows,Free,Rs Somnifero
1559,"Synchronize, backup, compare files and folders from your digital camera.",Windows,Free,PureSync
1560,Recover lost data from external hard drives.,Windows,Free,Free External Hard Drive Data Recovery
1561,Clean your system and optimize its performance.,Windows,Free to try,Quick Heal PCTuner
1562,Expand the abilities of your workstation using this suite of tools.,Windows,Free,Gizmo Central
1563,Perform automatic real-time encrypted backup of all files and folders.,Windows,Free to try,Genie Timeline Professional 2014
1564,Remove invalid entries from the Windows Registry.,Windows,Free to try,Registry Clean Pro
1565,Browse and extract data from backup file of Nokia phone.,Windows,Free to try,Noki
1566,Find and install firmware updates to your Sansa device.,Windows,Free,Sansa Firmware Updater 
1567,Restore Windows and Office activation data Offline.,Windows,Free,Advanced Tokens Manager
1568,Create virtual CD-ROMs on your computer.,Windows,Free to try,Original CD Emulator
1569,"Restore BMP, JPEG, PNG, TIFF, MP3 files.",Mac,Free,Softtote Mac Free Data Recovery
1570,Accelerate your game without any reboot.,Windows,Free,Mz Game Accelerator
1571,"Pick apps that you want, then download a customized installer file.",Webware,Free,Ninite
1572,Uninstall applications and keep your computer clean.,Windows,Free to try,Fresh System
1573,Create scalable OpenGL applications.,Windows,Free,Equalizer
1574,Extract any files from ZIP archive.,Windows,Free,Free Zip Extractor
1575,"Recover your deleted, damaged, and lost files.",Windows,Free to try,FinalData Standard Demo
1576,Control your computer through voice commands and make it read any text.,Windows,Free,HAL
1577,"Manage and recover deleted, formatted, or corrupted documents, spreadsheets, and other files.",Windows,Free to try,MediaRecover Pro
1578,Mount CD or DVD images by clicking at the image files in Windows Explorer.,Windows,Free,WinCDEmu
1579,Protect your data from potential threats and data loss.,Windows,Free to try,SystemRecovery Online Backup
1580,Find and recover damaged MS Word documents.,Windows,Free to try,WordFIX
1581,"Open, create, mount, and manage archive files.",Windows,Free to try,WinArchiver
1582,Recover from system crashes using a sophisticated backup system.,Windows,Free to try,ERS 9x - Emergency Recovery System for Windows 95/98/Me
1583,Control your computer mouse using Android phone.,Windows,Update,MouseMote Server
1584,Recover from system crashes using a sophisticated backup system.,Windows,Free to try,ERS 9x - Emergency Recovery System for Windows 95/98/Me
1585,Control your computer mouse using Android phone.,Windows,Update,MouseMote Server
1586,"Print from Legacy, DOS programs to Windows printers, USB, GDI, PDF, e-mail, fax.",Windows,Free to try,Printfil
1587,Clean the registry of errors and outdated data.,Windows,Free,Vit Registry Fix Free
1588,Manages multiple remote desktop connections running on your PC.,Windows,Free,Remote Desktop Connection Manager
1589,View text files containing ASCII Art and description files.,Windows,Free,Compact NFO Viewer
1590,"Free up storage space, manage big files and apps, prevent privacy leak for iOS devices on Mac.",Mac,Free,iFreeUp
1591,Share and synchronize files across multiple devices.,Windows,Free,Live Mesh 2011
1592,"Get the full power of WinZip on any Windows 10 PC, tablet or phone.",Windows,Free,WinZip Universal
1593,Manage your ZIP files and incorporate an encryption toolbar.,Windows,Free to try,ZipONE Professional
1594,Protect your printer with password and save ink and paper.,Windows,Free to try,PrintLock
1595,"Manipulate, calculate, and graphically display data.",Windows,Free,R for Windows
1596,Remove potentially harmful files & optimize PC boot time.,Windows,Free to try,PC Turbo Boost
1597,"Take control of your personal information as you search and browse the web, no matter where the Internet takes you.",Android,Free,DuckDuckGo Privacy Browser
1598,View information about hardware and software on your PC.,Windows,Free,Computer Specifications
1599,Copy a full path of files to your Clipboard.,Windows,Free,ClipPath
1600,Control your display's brightness and resolution settings.,Windows,Free to try,Display Resolution Manager
1601,"Print raw PRN, PCL, or PostScript files.",Windows,Free to try,Frogmore Raw Print
1602,Share your Mac's printers with iPhone and iPads on your network.,Mac,Free to try,Printopia
1603,Defragment your hard disk to accelerate PC performance.,Windows,Free,WinUtilities Free Disk Defragmenter
1604,"Manage temporary Internet files, cookies, and history.",Windows,Free,Index.dat Suite
1605,Create and print posters from any image.,Windows,Free to try,Mr. Poster
1606,Switch between audio playback devices seamlessly.,Windows,Free,Audio Output Switcher
1607,Fix all your important file associations.,Windows,Free,File Association Fixer
1608,Increase Windows operating system performance.,Windows,Free to try,WinTools.net Classic
1609,Disable or delete unnecessary start-up items.,Windows,Free,StartUpLite
1610,"Automate the shutdown, wake-up, sleep, logoff, restart and WOL process of your PCs and servers.",Windows,Free to try,Auto Shutdown Manager
1611,Recover data from crashed disk.,Windows,Free to try,Kernel for Windows Data Recovery
1612,Zip and send a file in one action.,Windows,Free,Quickzip
1613,Recover information from scratched or damaged CD or DVD media.,Windows,Free to try,DVD Data Rescue
1614,Recover lost or unreadable files from damaged CDs and DVDs.,Windows,Free to try,Power CD DVD Recovery
1615,Remove the files that remain after uninstallation of application.,Mac,Free to try,Amnesia
1616,Sort and search files on any system root or path.,Windows,Free to try,XLFileLister
1617,Repair corrupt RAR and SFX archives.,Windows,$49.95,Actual Rar Repair
1618,Recover data on formatted or damaged disks and partitions.,Mac,Free to try,R-Studio Data Recovery
1619,"Recover deleted data from iPhone, iPad, or iPod.",Windows,Free,EaseUS MobiSaver Free
1620,Add multiple files to one self-extracting file.,Windows,Free,SFX Compiler
1621,Convert all your video and music files on your android device.,Android,Free,Video Format Factory
1622,Remove junk files and free your PC's disk space.,Windows,Free,FCleaner
1623,Store and retrieve data from memory with accuracy.,Windows,Free,MemTest
1624,"Recover lost or deleted data, photos, music, and documents from various types of storage devices.",Windows,Free to try,Undo Delete
1625,"Recover music files, audio, video, photographs, text documents from damaged storage media drives.",Windows,Free to try,DDR Recovery Pen Drive
1626,Scan and clean up registry in your system.,Windows,Free,WinUtilities Free Registry Cleaner
1627,"Recover data from damaged CD, DVD, and Blu-ray discs.",Windows,Free to try,AnyReader
1628,"Repair, back up, upgrade and replace your hard disk drive.",Windows,Free,Copy+
1629,Clean up history of activities on your PC.,Windows,Free,Free Window Sweeper
1630,Retrieve files from any types of media.,Windows,Free to try,Recover Deleted Files
1631,"Clean, optimize and protect your Mac.",Mac,Free,Magican
1632,Compare and merge ASCII files.,Windows,Free to try,FCU
1633,Free up your hard drives space by performing defragmentation.,Windows,Free,UltraDefrag (32-bit)
1634,Check and display rootkits that hook the kernel system services of your computer.,Windows,Free,RootKit Hook Analyzer
1635,Eliminate Windows XP's corrupted autoplay entries.,Windows,Free,Autoplay Repair
1636,"Search for files by name, date and size.",Mac,Free,Find Any File
1637,Defragment your hard disks and improve computer performance and stability.,Windows,Free,Anvi Ultimate Defrag
1638,Manage Windows file type associations and create new file types.,Windows,Free to try,File Association Manager
1639,"Operate data between local PC and remote servers via FTP, FTPS, SCP, SFTP, WebDAV, S3 file transfer protocols.",Windows,Free,WinSCP Portable
1640,Keep your hard drives spic and span.,Windows,Free to try,WashandGo
1641,Convert OST files to PST.,Windows,Free to try,OST to PST Converter Toolbox
1642,Record and play mouse clicking sequences.,Windows,Free,Easy Auto Clicker
1643,Chop up large files or applications into floppy-sized pieces.,Mac,Free to try,SplitIt
1644,Record mouse clicks with macro and keyboard typings and automate repeating sequences.,Windows,Free,Shark Auto Clicker - Image Recognizer
1645,Enable and disable USB ports.,Windows,Free,USB Manager
1646,"Compress and expand ZIP, TAR, and GZIP file formats.",Windows,Free to try,Hard Code Compress 2000
1647,Remove association of file types on PC.,Windows,Free,Unassoc
1648,100% free VPN. Totally unlimited bandwidth. Super fast and high VPN speed. The best unlimited free VPN clients for android. Super fast VPN to...,Android,Free,VPN Robot -Free Unlimited VPN Proxy &WiFi Security
1649,Terminate user sessions completely when logging off.,Windows,Free,User Profile Hive Cleanup Service
1650,"Vpn One Click protects your privacy online encrypting your internet connection, and it unlocks all blocked services by connecting to a Virtual...",Android,Free,Vpn One Click
1651,"Recover, migrate, or backup your hard drive data.",Windows,Free,HDD Raw Copy Tool
1652,Divide and merge your files.,Windows,Free,Split and Join
1653,Scan and restore data from damaged or formatted disks.,Windows,Free to try,DiskInternals FAT Recovery
1654,"Recover lost or deleted data from your iPhone, iPad or iPod touch.",Mac,Free to try,Data Recovery for iPhone
1655,Create patches for your software.,Windows,Free,PatchWise Free
1656,"Analyze, defrag, and optimize hard disks.",Windows,Free,Disk SpeedUp
1657,"Enhance open and save dialogs with improved navigation, preview, and spotlight tagging.",Mac,Free to try,Default Folder X
1658,"Search for and change files with attributes like hidden, system, read only or archive.",Windows,Free,Hidden File Tool
1659,Manage your iDEN phone book.,Windows,Free,iDEN Phonebook Manager
1660,Capture an area of your desktop as an animated GIF.,Mac,Free,LICEcap
1661,Scrub your disk to ensure that erased files are erased.,Windows,Free to try,Disk Scrubber
1662,Disable keys and customize your keyboard layout.,Windows,Free to try,KeyExtender
1663,Transfer Android WhatsApp messages to iPhone.,Windows,Free to try,Backuptrans Android WhatsApp to iPhone Transfer
1664,burn multiple CD-R sessions so all space is used,Mac,Free to try,CD Session Burner
1665,Record and play back your mouse actions for various purposes.,Windows,Free to try,Auto-Clicker
1666,Uninstall applications along with their associated files.,Mac,Free to try,AppDelete
1667,Retreive Windows 8 product key from your system.,Windows,Free,Windows 8 Key Finder
1668,"Calculate MD5, SHA-1, SHA-256, SHA-384, SHA-512 or CRC-32 hashes of multiple files or text with ease.",Windows,Free,Hash Tool
1669,Browse your files and perform multiple file-level operations.,Windows,Free to try,Useful File Utilities
1670,Recover deleted or lost data from Android devices.,Windows,Free to try,Jihosoft Android Phone Recovery
1671,Monitor a GPU core temperature in real time.,Windows,Free,GPU Temp
1672,"Back up, restore, print, and burn your files on CDs or DVDs.",Windows,Free,BackPack Professional Standard Edition
1673,Get some command-line utilities on your desktop.,Windows,Free,NirCmd
1674,Convert your music compilations made with Nero to regular m3u playlists.,Windows,Free,NRA DMSA to M3U Converter
1675,Create a standard photocopying machine from your scanner and printer.,Windows,Free to try,LC Copier
1676,Run other operating systems on your computer.,Linux,Free,VirtualBox for Ubuntu (64-bit)
1677,Combine spyware-removal functions with the commonly used Windows utilities.,Windows,Free to try,Maintenance Checkup Home Edition 2005
1678,Partition your disk with ease.,Windows,Free to try,Paragon Partition Manager Personal Edition
1679,"Access applications, manage windows, and manipulate clipboard through hot keys and mouse gestures.",Windows,Free,Quick Cliq
1680,"Access applications, manage windows, and manipulate clipboard through hot keys and mouse gestures.",Windows,Free,Quick Cliq
1681,"Get an RPM-based, general purpose operating system built on top of the Linux kernel.",Linux,Free,Fedora Desktop Edition (32-bit)
1682,Update or back-up user files automatically.,Windows,Free to try,PowerSync WS
1683,"Convert and combine GIF, JPG, PDF, TIFF and PNG files to PDF.",Mac,Free,iCombiner
1684,Manage and configure your Apache Web server.,Windows,Free to try,Apache Admin
1685,Transfer your music and video between iOS devices and PC.,Windows,Free,iDump
1686,Watch the little ants moving over your desktop.,Windows,Free,12-Ants
1687,"Catalog and find your files, label your disks, and generate reports.",Windows,Free to try,1-Pro-File
1688,Recover a computer that will not boot.,Windows,Free,BootMed 64Bit
1689,Force your Mac to stay awake or set up a scheduled wake time.,Mac,Free,NoSleep
1690,Store and execute various killer applications on your USB pen-drive.,Windows,Free,WinInizio PenSuite
1691,Stay alerted about the flash drive connoted to the PC during the shutdown or log off process.,Windows,Free,Free USB Guard
1692,Back up files and folders to any kind of removable or fixed drive.,Windows,Free to try,DataSafe
1693,Open not accessible archives of RAR format.,Windows,Free to try,Recovery Toolbox for RAR
1694,"Recover lost or deleted photo, file, video, document, partition.",Windows,Free to try,7-Data Recovery Suite
1695,"Back up your important files and programs to local drives, devices, or to the cloud automatically.",Windows,Free to try,NovaBackup
1696,Detect problems in your Registry before they cause any damages.,Windows,Free to try,Run PC Doctor
1697,"Chat with Google, AOL, MSN, and Yahoo users in easy-to-use interface.",Windows,Free,Pidgin Portable
1698,Includes the latest updates and provides enhancements to security and stability.,Windows,Free,Windows Server 2003 SP2 (32-bit x86)
1699,"Search files, folders and other data.",Windows,Free,Super Finder XT
1700,"Get rid of common and repetitious tasks, such as entering data or starting programs.",Windows,Free,Launch Pad
1701,Perform data backup and recover lost passwords.,Windows,Free to try,Emergency Boot CD
1702,Monitor and automatically resolve your memory issues.,Windows,Free to try,Memory Improve Professional
1703,Capture screenshots of different size.,Windows,Free,SnapaShot
1704,"Manage your files and folders using skins, drag-and-drop support, and hierarchical folder lists.",Mac,Free to try,Macintosh Explorer
1705,Back up and recover data on your small and medium business servers.,Windows,Free to try,EaseUS Todo Backup Server
1706,downloads blacklists & exports,Windows,Free,Blocklist Manager
1707,Modify the attributes and properties including EXIF of a batch of files or directories.,Windows,Free to try,File Property Edit Pro
1708,"Manage and sync apps, photos, music, videos, e-books between Android/iPhone and PC.",Windows,Free,Syncios
1709,Reduce strain and hand movement working with the mouse pointer.,Windows,Free to try,IntelliPointer
1710,Clean windows registry by stripping out unnecessary data.,Windows,Free,Registry Trash Keys Finder
1711,"Synchronize files between your computers, USB keychain drives, and portable hard disks.",Windows,Free to try,Memeo AutoSync
1712,Diagnose and repair your system to keep it running at the top shape.,Windows,Free,Genuine Registry Doctor
1713,Split all your large files for easier distribution.,Windows,Free to try,Chop
1714,Get total information about your computer.,Windows,Free,Private Eye's System Info
1715,"Protect your Windows desktop, wallpaper, and desktop settings from crash.",Windows,Free,Desktop Hijack Fix
1716,Split large files into smaller ones.,Windows,Free to try,Easy File Splitter
1717,"Unpack, edit, and sign Symbian 9 SIS packages.",Windows,Free,SISContents
1718,AnySoftKeyboard keyboards pack: Arabic layout.,Android,Free,Arabic for AnySoftKeyboard
1719,Create keyboard shortcuts or to remap your keyboard.,Windows,Free to try,Hotkeycontrol
1720,"Rename batches of files, photos and folders.",Mac,Free to try,A Better Finder Rename
1721,Search and delete temporary files and folders created by Windows and other applications.,Windows,Free to try,SBMAV Disk Cleaner
1722,"Improve your Wi-Fi experience, surf the net anywhere and anytime.",Android,Free,Portable Hotspot - Wifi Tether
1723,Optimize your computer's memory to speed up games and applications.,Windows,Free,Memory Washer
1724,Create installation media to install Windows 10 on your PC.,Windows,Free,Windows 10 Media Creation Tool
1725,Search and find required files on PC.,Windows,Free,SwiftSearch
1726,Perform thorough analysis of your network protocol.,Windows,Free,Wireshark Portable
1727,Office 97 update,Windows,Free,Microsoft Office 97 Service Release 1 (SR-1)
1728,"Perform any migration, no matter the source or target.",Windows,Free to try,Paragon Drive Copy Professional
1729,"Undo, redo, find, replace, and compare your registry files. ",Windows,Free to try,Registry Workshop
1730,Defrag and Optimize Your Hard Drive... Any Way You Want To,Windows,Free to try,UltimateDefrag
1731,Work in a DOS-based environment with a user-friendly interface.,Windows,Free to try,AlacartE
1732,NTFS disk writing enabler.,Mac,Free,SL-NTFS
1733,ejects disks of all types at any time using a hotkey,Mac,$14.95,EjectDisk
1734,check for dead pixels on monitor,Windows,Free,Dead Pixel Tester
1735,Graphically displays disk usage.,Mac,Free,GrandPerspective
1736,Clean your Registry of invalid entries.,Windows,Free to try,Perfect Companion
1737,Recover damaged DBX files.,Windows,Free,Power Email Recovery for Outlook Express
1738,Decompress or extract RAR files.,Windows,Free,RarZilla Free Unrar Portable
1739,"Combine the qualities of Microsoft Explorer, WinFile, Norton Commander, and XTree Gold in one.",Windows,Free to try,Explor2000
1740,update,Windows,Free,Microsoft Update Rollup 1 for Windows 2000 SP4
1741,Find and remove duplicate files of any type and free up hard disk space.,Windows,Free,AllDup
1742,"Add notes to any file, folder, drive, or network drive.",Windows,Free to try,File Notes Organizer
1743,Measure sizes of your files and folders.,Mac,Free to try,WhatSize
1744,Create a disk image of your system into a file.,Windows,Free to try,Drive Snapshot
1745,Provide intuitive GUI for editing optional parameters of Robocopy command line.,Windows,Free,Better Robocopy GUI
1746,Secure your data and anonymize your Internet.,Android,Free,ExpressVPN - Best Android VPN
1747,"Recover lost data from CD, DVD, and Blu-ray discs.",Windows,Free,Recovery Toolbox for CD Free
1748,"Archive and back up files, folders, and application data.",Windows,Free to try,CyberLink PowerBackup
1749,Search for the latest versions of files and synchronize with them.,Windows,Free to try,Synchromat
1750,Search and delete junk files from your PC.,Windows,Free,Dedaulus System Cleaner
1751,Destroy and irreversibly delete any trace of old data on your hard drive.,Windows,Free,Morgud's Erasure Suite
1752,Capture and save screenshots with ease.,Windows,Free to try,Gadwin PrintScreen Professional
1753,Shut down frozen windows with customized hot key.,Windows,Free to try,UnFreeze
1754,Compact the Windows registry and speed up your computer.,Windows,Free,Eusing Free Registry Defrag
1755,Apple iOS 11 opens to the amazing possibilities for augmented reality in games and apps. ,iOS,Free,Apple iOS 11
1756,"Show system log, unix commands, images on desktop.",Mac,Free,GeekTool
1757,Back up your important files to your local external USB hard drive or to the cloud using Dropbox.,Windows,Free to try,WD SmartWare Pro
1758,"Sync any BlackBerry to your Mac; syncs Outlook 2011, Entourage 2008, iCal, Address Book, iTunes.",Mac,$29.97,PocketMac for BlackBerry
1759,Get a collection of portable applications for use with a USB pen drive or directly from a hard disk.,Windows,Free,winPenPack Flash 2GB
1760,Restore system and search the boot time of your Windows XP or Windows 2000 computer.,Windows,Free,PC Boot Timer
1761,Read PDF files with this lightweight PDF viewer.,Windows,Free,Sumatra PDF Portable
1762,Enable or disable LAN via desktop shortcut.,Windows,Free to try,Network Controller
1763,"Manage Android media, contacts, SMS, and apps.",Windows,Free to try,Coolmuster Android Assistant
1764,Perform multi-directory and multi-folder file searches.,Windows,Free,QuickSearcher - Freeware edition
1765,Execute programs or system options at specified times.,Windows,Free to try,Techscheduler Advanced
1766,"Why? Yoga VPN is the best free VPN in the world? Yoga VPN is really permanent free, without in-app purchases. The number of high-speed proxy...",Android,Free,Yoga VPN - Free Unlimited & Secure Proxy & Unblock
1767,Synchronize and back up your files.,Windows,Free,CopyTo Synchronizer Free
1768,speed dial for your digital hub,Mac,$10.00,MacDialer
1769,Clean up junk files and invalid Registry entries.,Windows,Free,EasyPC Cleaner Free
1770,Be alerted about the safety of your data.,Windows,Free,Acronis Drive Monitor
1771,translucent analog clock for those who miss it,Mac,Free,Simple Floating Clock
1772,Design and print RFID and bar code labels.,Windows,Free to try,Label Matrix
1773,"Schedule your Windows system shutdown (restart, hibernate) using several conditions.",Windows,Free,AMP WinOFF
1774,Monitor harmful plugins and remove junk files from your system.,Windows,Free,HackCleaner
1775,Benchmark your personal computers using a series of tests as well as system information.,Windows,Free to try,XMark
1776,Burn your backup discs to any CDs or DVDs.,Windows,Free to try,Back4WinXP
1777,"Monitor registry, disk space, installed software, and HDD temperature.",Windows,Free,EnhanceMySe7en Free
1778,"Search, collect, restore, and export data in Exchange, Office 365, and SharePoint environments.",Windows,Free to try,Ontrack PowerControls for Exchange and SharePoint
1779,Make your Windows 95/NT 4.0 machine function like a Unix system.,Windows,Free to try,WinXs
1780,Update you copy of Micrsofts Virtual PC for Mac to take advantage of the latest features and bug fixes.,Mac,Free,Microsoft Virtual PC for Mac Update
1781,"Search and find files, documents, and email messages on your PC.",Windows,Free,Windows Search for XP (32-bit)
1782,Create and edit macros for repetitive tasks and carry out functional and regression tests.,Windows,Free to try,WinTask
1783,Archive files in different formats and manage them.,Linux,Free,7-Zip
1784,Delete data from your hard disk and ensure no one can recover it.,Windows,Free,DiskDeleter ZW
1785,Suite of system diagnose/repair tools,Windows,Purchase,Administrators Pack
1786,"Recover videos, photos, music, documents, emails, archives from Mac computer.",Mac,Free,EaseUS Data Recovery Wizard Free
1787,"Delete, copy or rename long path files.",Windows,$18.00,Long Path Tool
1788,"Recover files from formatted hard drive, formatted card, formatted USB drives.",Windows,Free to try,iCare Format Recovery
1789,Mount and create CD/DVD disc images on Mac.,Mac,Free to try,Daemon Tools
1790,Back up and restore your Windows system.,Windows,Free,Paragon Backup & Recovery (French)
1791,Fix invalid registry entries in a few simple clicks.,Windows,Free,RegClean Pro
1792,Rename files and folders in bulk.,Windows,Free to try,File Renamer
1793,Scan and recover data from your hard drive.,Windows,Free to try,DiskGetor Data Recovery
1794,Explore the best entertainment experience on your PC.,Windows,$119.99,Windows 7 Home Premium Upgrade
1795,Test if your Access Point is vulnerable.,Android,Free,Wifi Wps Wpa Tester
1796,Perform basic and advanced partition operations on your servers without data loss.,Windows,Free to try,Partition Wizard Server Edition
